16:44:37.860257 IP 172.20.38.238.51797 > ord30s22-in-f14.1e100.net.https: UDP, length 1350
16:44:37.944978 IP ord30s22-in-f14.1e100.net.https > 172.20.38.238.57840: Flags [.], ack 854245865, win 369, length 0
16:44:37.946639 IP ord30s22-in-f14.1e100.net.https > 172.20.38.238.57840: Flags [P.], seq 0:82, ack 1, win 369, length 82
16:44:37.947087 IP ord30s22-in-f14.1e100.net.https > 172.20.38.238.57840: Flags [P.], seq 82:274, ack 1, win 369, length 192
16:44:37.947089 IP ord30s22-in-f14.1e100.net.https > 172.20.38.238.57840: Flags [P.], seq 274:320, ack 1, win 369, length 46
16:44:37.947156 IP 172.20.38.238.57840 > ord30s22-in-f14.1e100.net.https: Flags [.], ack 320, win 253, length 0
16:44:37.947900 IP 172.20.38.238.57840 > ord30s22-in-f14.1e100.net.https: Flags [P.], seq 1:47, ack 320, win 253, length 46
16:44:38.152444 IP ord30s22-in-f14.1e100.net.https > 172.20.38.238.57840: Flags [.], ack 47, win 369, length 0
16:44:38.464460 IP 172.20.38.238.51797 > ord30s22-in-f14.1e100.net.https: UDP, length 1350
16:44:39.668372 IP 172.20.38.238.51797 > ord30s22-in-f14.1e100.net.https: UDP, length 1350
16:44:40.172599 IP 172.20.38.238.57634 > ie-in-f125.1e100.net.xmpp-client: Flags [P.], seq 1369680032:1369680058, ack 1649369269, win 251, length 26
16:44:40.296563 IP 172.20.38.238.52962 > resolver2.opendns.com.domain: 45734+ A? clixsense.com. (31)
16:44:40.342123 IP ie-in-f125.1e100.net.xmpp-client > 172.20.38.238.57634: Flags [.], ack 26, win 419, length 0
16:44:40.491997 IP resolver2.opendns.com.domain > 172.20.38.238.52962: 45734 2/0/0 A 198.41.189.40, A 198.41.188.40 (63)
16:44:40.493422 IP 172.20.38.238.57842 > 198.41.189.40.http: Flags [S], seq 3826335112, win 8192, options [mss 1460,nop,wscale 8,nop,nop,sackOK], length 0
16:44:40.544616 IP 172.20.38.238.57843 > 198.41.189.40.http: Flags [S], seq 3689293154, win 8192, options [mss 1460,nop,wscale 8,nop,nop,sackOK], length 0
16:44:40.717250 IP 198.41.189.40.http > 172.20.38.238.57842: Flags [S.], seq 2372490322, ack 3826335113, win 29200, options [mss 1460,nop,nop,sackOK,nop,wscale 10], length 0
16:44:40.717406 IP 172.20.38.238.57842 > 198.41.189.40.http: Flags [.], ack 1, win 256, length 0
16:44:40.717666 IP 198.41.189.40.http > 172.20.38.238.57843: Flags [S.], seq 1675958, ack 3689293155, win 29200, options [mss 1460,nop,nop,sackOK,nop,wscale 10], length 0
16:44:40.717738 IP 172.20.38.238.57843 > 198.41.189.40.http: Flags [.], ack 1, win 256, length 0
16:44:40.717939 IP 172.20.38.238.57842 > 198.41.189.40.http: Flags [P.], seq 1:372, ack 1, win 256, length 371
16:44:40.890948 IP 198.41.189.40.http > 172.20.38.238.57842: Flags [.], ack 372, win 30, length 0
16:44:41.054405 IP 198.41.189.40.http > 172.20.38.238.57842: Flags [P.], seq 1:576, ack 372, win 30, length 575
16:44:41.054753 IP 198.41.189.40.http > 172.20.38.238.57842: Flags [P.], seq 576:581, ack 372, win 30, length 5
16:44:41.054843 IP 172.20.38.238.57842 > 198.41.189.40.http: Flags [.], ack 581, win 254, length 0
16:44:41.058958 IP 172.20.38.238.61843 > resolver2.opendns.com.domain: 46759+ A? www.clixsense.com. (35)
16:44:41.228058 IP resolver2.opendns.com.domain > 172.20.38.238.61843: 46759 2/0/0 A 198.41.188.40, A 198.41.189.40 (67)
16:44:41.229587 IP 172.20.38.238.57844 > 198.41.188.40.http: Flags [S], seq 2891338181, win 8192, options [mss 1460,nop,wscale 8,nop,nop,sackOK], length 0
16:44:41.309069 IP 172.20.38.238.57845 > 198.41.188.40.http: Flags [S], seq 2950430521, win 8192, options [mss 1460,nop,wscale 8,nop,nop,sackOK], length 0
16:44:41.387475 IP ord30s22-in-f99.1e100.net.https > 172.20.38.238.57792: Flags [P.], seq 2673840723:2673840786, ack 2715683608, win 361, length 63
16:44:41.387477 IP ord30s22-in-f99.1e100.net.https > 172.20.38.238.57792: Flags [F.], seq 63, ack 1, win 361, length 0
16:44:41.387593 IP 172.20.38.238.57792 > ord30s22-in-f99.1e100.net.https: Flags [.], ack 64, win 387, length 0
16:44:41.387958 ARP, Request who-has 172.20.38.238 tell 172.20.32.3, length 46
16:44:41.388008 ARP, Reply 172.20.38.238 is-at 24:fd:52:62:80:09 (oui Unknown), length 28
16:44:41.388078 IP 172.20.38.238.57792 > ord30s22-in-f99.1e100.net.https: Flags [F.], seq 1, ack 64, win 387, length 0
16:44:41.394729 IP 198.41.188.40.http > 172.20.38.238.57844: Flags [S.], seq 435369973, ack 2891338182, win 29200, options [mss 1460,nop,nop,sackOK,nop,wscale 10], length 0
16:44:41.394883 IP 172.20.38.238.57844 > 198.41.188.40.http: Flags [.], ack 1, win 256, length 0
16:44:41.395376 IP 172.20.38.238.57844 > 198.41.188.40.http: Flags [P.], seq 1:438, ack 1, win 256, length 437
16:44:41.396021 IP 172.20.38.238.51797 > ord30s22-in-f14.1e100.net.https: UDP, length 43
16:44:41.545040 IP ord30s22-in-f99.1e100.net.https > 172.20.38.238.57792: Flags [.], ack 2, win 361, length 0
16:44:41.564748 IP 198.41.188.40.http > 172.20.38.238.57845: Flags [S.], seq 547170502, ack 2950430522, win 29200, options [mss 1460,nop,nop,sackOK,nop,wscale 10], length 0
16:44:41.564901 IP 172.20.38.238.57845 > 198.41.188.40.http: Flags [.], ack 1, win 256, length 0
16:44:41.571447 IP 198.41.188.40.http > 172.20.38.238.57844: Flags [.], ack 438, win 30, length 0
16:44:41.872422 IP 198.41.188.40.http > 172.20.38.238.57844: Flags [.], seq 1461:2921, ack 438, win 30, length 1460
16:44:41.872515 IP 172.20.38.238.57844 > 198.41.188.40.http: Flags [.], ack 1, win 256, options [nop,nop,sack 1 {1461:2921}], length 0
16:44:41.873260 IP 198.41.188.40.http > 172.20.38.238.57844: Flags [.], seq 1:1461, ack 438, win 30, length 1460
16:44:41.873264 IP 198.41.188.40.http > 172.20.38.238.57844: Flags [.], seq 2921:4381, ack 438, win 30, length 1460
16:44:41.873266 IP 198.41.188.40.http > 172.20.38.238.57844: Flags [P.], seq 4381:4428, ack 438, win 30, length 47
16:44:41.873378 IP 172.20.38.238.57844 > 198.41.188.40.http: Flags [.], ack 2921, win 256, length 0
16:44:41.873526 IP 172.20.38.238.57844 > 198.41.188.40.http: Flags [.], ack 4428, win 256, length 0
16:44:41.873700 IP 198.41.188.40.http > 172.20.38.238.57844: Flags [P.], seq 7348:8469, ack 438, win 30, length 1121
16:44:41.873742 IP 172.20.38.238.57844 > 198.41.188.40.http: Flags [.], ack 4428, win 256, options [nop,nop,sack 1 {7348:8469}], length 0
16:44:41.874078 IP 198.41.188.40.http > 172.20.38.238.57844: Flags [.], seq 4428:5888, ack 438, win 30, length 1460
16:44:41.874128 IP 172.20.38.238.57844 > 198.41.188.40.http: Flags [.], ack 5888, win 256, options [nop,nop,sack 1 {7348:8469}], length 0
16:44:41.875199 IP 198.41.188.40.http > 172.20.38.238.57844: Flags [.], seq 5888:7348, ack 438, win 30, length 1460
16:44:41.875260 IP 172.20.38.238.57844 > 198.41.188.40.http: Flags [.], ack 8469, win 256, length 0
16:44:41.890284 IP 172.20.38.238.60049 > resolver2.opendns.com.domain: 9987+ A? csstatic.com. (30)
16:44:41.930705 IP 198.41.188.40.http > 172.20.38.238.57844: Flags [P.], seq 8469:8489, ack 438, win 30, length 20
16:44:41.976203 IP 172.20.38.238.57844 > 198.41.188.40.http: Flags [.], ack 8489, win 256, length 0
16:44:42.007088 IP ord30s22-in-f4.1e100.net.https > 172.20.38.238.57794: Flags [P.], seq 2398976349:2398976412, ack 537482531, win 374, length 63
16:44:42.007488 IP 172.20.38.238.57794 > ord30s22-in-f4.1e100.net.https: Flags [F.], seq 1, ack 63, win 252, length 0
16:44:42.054663 IP resolver2.opendns.com.domain > 172.20.38.238.60049: 9987 2/0/0 A 198.41.188.12, A 198.41.189.12 (62)
16:44:42.055781 IP 172.20.38.238.57846 > 198.41.188.12.http: Flags [S], seq 2027246338, win 8192, options [mss 1460,nop,wscale 8,nop,nop,sackOK], length 0
16:44:42.056090 IP 172.20.38.238.57847 > 198.41.188.12.http: Flags [S], seq 3911704501, win 8192, options [mss 1460,nop,wscale 8,nop,nop,sackOK], length 0
16:44:42.056300 IP 172.20.38.238.57848 > 198.41.188.12.http: Flags [S], seq 2173200354, win 8192, options [mss 1460,nop,wscale 8,nop,nop,sackOK], length 0
16:44:42.056489 IP 172.20.38.238.57849 > 198.41.188.12.http: Flags [S], seq 3112893168, win 8192, options [mss 1460,nop,wscale 8,nop,nop,sackOK], length 0
16:44:42.056668 IP 172.20.38.238.57850 > 198.41.188.12.http: Flags [S], seq 842935951, win 8192, options [mss 1460,nop,wscale 8,nop,nop,sackOK], length 0
16:44:42.140518 IP 172.20.38.238.57851 > 198.41.188.12.http: Flags [S], seq 3698415096, win 8192, options [mss 1460,nop,wscale 8,nop,nop,sackOK], length 0
16:44:42.213401 IP ord30s22-in-f4.1e100.net.https > 172.20.38.238.57794: Flags [.], ack 2, win 374, length 0
16:44:42.236422 IP 198.41.188.12.http > 172.20.38.238.57846: Flags [S.], seq 677009761, ack 2027246339, win 29200, options [mss 1460,nop,nop,sackOK,nop,wscale 10], length 0
16:44:42.236585 IP 172.20.38.238.57846 > 198.41.188.12.http: Flags [.], ack 1, win 256, length 0
16:44:42.237318 IP 172.20.38.238.57846 > 198.41.188.12.http: Flags [P.], seq 1:339, ack 1, win 256, length 338
16:44:42.237546 IP 198.41.188.12.http > 172.20.38.238.57847: Flags [S.], seq 678788340, ack 3911704502, win 29200, options [mss 1460,nop,nop,sackOK,nop,wscale 10], length 0
16:44:42.237707 IP 172.20.38.238.57847 > 198.41.188.12.http: Flags [.], ack 1, win 256, length 0
16:44:42.237937 IP 172.20.38.238.57847 > 198.41.188.12.http: Flags [P.], seq 1:317, ack 1, win 256, length 316
16:44:42.239262 IP 198.41.188.12.http > 172.20.38.238.57849: Flags [S.], seq 885043597, ack 3112893169, win 29200, options [mss 1460,nop,nop,sackOK,nop,wscale 10], length 0
16:44:42.239264 IP 198.41.188.12.http > 172.20.38.238.57850: Flags [S.], seq 4242487540, ack 842935952, win 29200, options [mss 1460,nop,nop,sackOK,nop,wscale 10], length 0
16:44:42.239473 IP 172.20.38.238.57849 > 198.41.188.12.http: Flags [.], ack 1, win 256, length 0
16:44:42.239579 IP 172.20.38.238.57850 > 198.41.188.12.http: Flags [.], ack 1, win 256, length 0
16:44:42.240001 IP 172.20.38.238.57850 > 198.41.188.12.http: Flags [P.], seq 1:329, ack 1, win 256, length 328
16:44:42.240271 IP 172.20.38.238.57849 > 198.41.188.12.http: Flags [P.], seq 1:339, ack 1, win 256, length 338
16:44:42.383679 IP 198.41.188.12.http > 172.20.38.238.57851: Flags [S.], seq 2652906097, ack 3698415097, win 29200, options [mss 1460,nop,nop,sackOK,nop,wscale 10], length 0
16:44:42.383836 IP 172.20.38.238.57851 > 198.41.188.12.http: Flags [.], ack 1, win 256, length 0
16:44:42.384616 IP 172.20.38.238.57851 > 198.41.188.12.http: Flags [P.], seq 1:353, ack 1, win 256, length 352
16:44:42.408563 IP 198.41.188.12.http > 172.20.38.238.57846: Flags [.], ack 339, win 30, length 0
16:44:42.410888 IP 198.41.188.12.http > 172.20.38.238.57847: Flags [.], ack 317, win 30, length 0
16:44:42.412040 IP 198.41.188.12.http > 172.20.38.238.57850: Flags [.], ack 329, win 30, length 0
16:44:42.412501 IP 198.41.188.12.http > 172.20.38.238.57849: Flags [.], ack 339, win 30, length 0
16:44:42.412503 IP 198.41.188.12.http > 172.20.38.238.57847: Flags [P.], seq 1461:2520, ack 317, win 30, length 1059
16:44:42.412580 IP 172.20.38.238.57847 > 198.41.188.12.http: Flags [.], ack 1, win 256, options [nop,nop,sack 1 {1461:2520}], length 0
16:44:42.413039 IP 198.41.188.12.http > 172.20.38.238.57847: Flags [.], seq 1:1461, ack 317, win 30, length 1460
16:44:42.413136 IP 172.20.38.238.57847 > 198.41.188.12.http: Flags [.], ack 2520, win 256, length 0
16:44:42.415397 IP 198.41.188.12.http > 172.20.38.238.57850: Flags [.], seq 1:1461, ack 329, win 30, length 1460
16:44:42.415399 IP 198.41.188.12.http > 172.20.38.238.57850: Flags [.], seq 1461:2921, ack 329, win 30, length 1460
16:44:42.415406 IP 198.41.188.12.http > 172.20.38.238.57850: Flags [.], seq 2921:4381, ack 329, win 30, length 1460
16:44:42.415408 IP 198.41.188.12.http > 172.20.38.238.57850: Flags [.], seq 4381:5841, ack 329, win 30, length 1460
16:44:42.415412 IP 198.41.188.12.http > 172.20.38.238.57850: Flags [.], seq 5841:7301, ack 329, win 30, length 1460
16:44:42.415414 IP 198.41.188.12.http > 172.20.38.238.57850: Flags [.], seq 7301:8761, ack 329, win 30, length 1460
16:44:42.415416 IP 198.41.188.12.http > 172.20.38.238.57850: Flags [.], seq 8761:10221, ack 329, win 30, length 1460
16:44:42.415417 IP 198.41.188.12.http > 172.20.38.238.57850: Flags [.], seq 10221:11681, ack 329, win 30, length 1460
16:44:42.415419 IP 198.41.188.12.http > 172.20.38.238.57850: Flags [.], seq 11681:13141, ack 329, win 30, length 1460
16:44:42.415421 IP 198.41.188.12.http > 172.20.38.238.57850: Flags [.], seq 13141:14601, ack 329, win 30, length 1460
16:44:42.415545 IP 172.20.38.238.57850 > 198.41.188.12.http: Flags [.], ack 14601, win 256, length 0
16:44:42.420451 IP 198.41.188.12.http > 172.20.38.238.57849: Flags [.], seq 1:1461, ack 339, win 30, length 1460
16:44:42.420453 IP 198.41.188.12.http > 172.20.38.238.57849: Flags [.], seq 1461:2921, ack 339, win 30, length 1460
16:44:42.420455 IP 198.41.188.12.http > 172.20.38.238.57849: Flags [.], seq 2921:4381, ack 339, win 30, length 1460
16:44:42.420461 IP 198.41.188.12.http > 172.20.38.238.57849: Flags [.], seq 4381:5841, ack 339, win 30, length 1460
16:44:42.420462 IP 198.41.188.12.http > 172.20.38.238.57849: Flags [.], seq 5841:7301, ack 339, win 30, length 1460
16:44:42.420464 IP 198.41.188.12.http > 172.20.38.238.57849: Flags [.], seq 7301:8761, ack 339, win 30, length 1460
16:44:42.420466 IP 198.41.188.12.http > 172.20.38.238.57849: Flags [.], seq 8761:10221, ack 339, win 30, length 1460
16:44:42.420468 IP 198.41.188.12.http > 172.20.38.238.57849: Flags [.], seq 10221:11681, ack 339, win 30, length 1460
16:44:42.420470 IP 198.41.188.12.http > 172.20.38.238.57849: Flags [.], seq 11681:13141, ack 339, win 30, length 1460
16:44:42.420472 IP 198.41.188.12.http > 172.20.38.238.57849: Flags [.], seq 13141:14601, ack 339, win 30, length 1460
16:44:42.420580 IP 172.20.38.238.57849 > 198.41.188.12.http: Flags [.], ack 14601, win 256, length 0
16:44:42.421996 IP 198.41.188.12.http > 172.20.38.238.57846: Flags [.], seq 1:1461, ack 339, win 30, length 1460
16:44:42.422000 IP 198.41.188.12.http > 172.20.38.238.57846: Flags [.], seq 1461:2921, ack 339, win 30, length 1460
16:44:42.422003 IP 198.41.188.12.http > 172.20.38.238.57846: Flags [.], seq 2921:4381, ack 339, win 30, length 1460
16:44:42.422011 IP 198.41.188.12.http > 172.20.38.238.57846: Flags [.], seq 4381:5841, ack 339, win 30, length 1460
16:44:42.422014 IP 198.41.188.12.http > 172.20.38.238.57846: Flags [.], seq 5841:7301, ack 339, win 30, length 1460
16:44:42.422016 IP 198.41.188.12.http > 172.20.38.238.57846: Flags [.], seq 7301:8761, ack 339, win 30, length 1460
16:44:42.422018 IP 198.41.188.12.http > 172.20.38.238.57846: Flags [P.], seq 8761:9085, ack 339, win 30, length 324
16:44:42.422102 IP 172.20.38.238.57846 > 198.41.188.12.http: Flags [.], ack 9085, win 256, length 0
16:44:42.600808 IP 198.41.188.12.http > 172.20.38.238.57851: Flags [.], ack 353, win 30, length 0
16:44:42.602752 IP 198.41.188.12.http > 172.20.38.238.57851: Flags [.], seq 1:1461, ack 353, win 30, length 1460
16:44:42.602755 IP 198.41.188.12.http > 172.20.38.238.57851: Flags [P.], seq 1461:2469, ack 353, win 30, length 1008
16:44:42.602756 IP ord30s22-in-f4.1e100.net.https > 172.20.38.238.57794: Flags [F.], seq 63, ack 2, win 374, length 0
16:44:42.602756 IP 198.41.188.12.http > 172.20.38.238.57850: Flags [.], seq 14601:16061, ack 329, win 30, length 1460
16:44:42.602774 IP 198.41.188.12.http > 172.20.38.238.57850: Flags [.], seq 16061:17521, ack 329, win 30, length 1460
16:44:42.602898 IP 172.20.38.238.57794 > ord30s22-in-f4.1e100.net.https: Flags [.], ack 64, win 252, length 0
16:44:42.603062 IP 172.20.38.238.57851 > 198.41.188.12.http: Flags [.], ack 2469, win 256, length 0
16:44:42.603111 IP 172.20.38.238.57850 > 198.41.188.12.http: Flags [.], ack 17521, win 256, length 0
16:44:42.603498 IP 198.41.188.12.http > 172.20.38.238.57850: Flags [.], seq 17521:18981, ack 329, win 30, length 1460
16:44:42.603500 IP 198.41.188.12.http > 172.20.38.238.57850: Flags [.], seq 18981:20441, ack 329, win 30, length 1460
16:44:42.603536 IP 172.20.38.238.57850 > 198.41.188.12.http: Flags [.], ack 20441, win 256, length 0
16:44:42.604454 IP 198.41.188.12.http > 172.20.38.238.57850: Flags [.], seq 20441:21901, ack 329, win 30, length 1460
16:44:42.604456 IP 198.41.188.12.http > 172.20.38.238.57850: Flags [.], seq 21901:23361, ack 329, win 30, length 1460
16:44:42.604538 IP 172.20.38.238.57850 > 198.41.188.12.http: Flags [.], ack 23361, win 256, length 0
16:44:42.604826 IP 198.41.188.12.http > 172.20.38.238.57850: Flags [.], seq 23361:24821, ack 329, win 30, length 1460
16:44:42.605241 IP 198.41.188.12.http > 172.20.38.238.57850: Flags [.], seq 24821:26281, ack 329, win 30, length 1460
16:44:42.605289 IP 172.20.38.238.57850 > 198.41.188.12.http: Flags [.], ack 26281, win 256, length 0
16:44:42.605511 IP 198.41.188.12.http > 172.20.38.238.57850: Flags [.], seq 26281:27741, ack 329, win 30, length 1460
16:44:42.606040 IP 172.20.38.238.57851 > 198.41.188.12.http: Flags [P.], seq 353:761, ack 2469, win 256, length 408
16:44:42.606546 IP 198.41.188.12.http > 172.20.38.238.57850: Flags [.], seq 27741:29201, ack 329, win 30, length 1460
16:44:42.606553 IP 198.41.188.12.http > 172.20.38.238.57850: Flags [.], seq 29201:30661, ack 329, win 30, length 1460
16:44:42.606555 IP 198.41.188.12.http > 172.20.38.238.57850: Flags [.], seq 30661:32121, ack 329, win 30, length 1460
16:44:42.606559 IP 198.41.188.12.http > 172.20.38.238.57850: Flags [.], seq 32121:33581, ack 329, win 30, length 1460
16:44:42.606561 IP 198.41.188.12.http > 172.20.38.238.57850: Flags [P.], seq 33581:33643, ack 329, win 30, length 62
16:44:42.606561 IP 198.41.188.12.http > 172.20.38.238.57849: Flags [P.], seq 14601:14624, ack 339, win 30, length 23
16:44:42.606624 IP 172.20.38.238.57850 > 198.41.188.12.http: Flags [.], ack 33643, win 256, length 0
16:44:42.610510 IP 172.20.38.238.57850 > 198.41.188.12.http: Flags [P.], seq 329:737, ack 33643, win 256, length 408
16:44:42.610825 IP 172.20.38.238.57849 > 198.41.188.12.http: Flags [P.], seq 339:746, ack 14624, win 256, length 407
16:44:42.611038 IP 172.20.38.238.57846 > 198.41.188.12.http: Flags [P.], seq 339:746, ack 9085, win 256, length 407
16:44:42.611223 IP 172.20.38.238.57847 > 198.41.188.12.http: Flags [P.], seq 317:724, ack 2520, win 256, length 407
16:44:42.797460 IP 198.41.188.12.http > 172.20.38.238.57846: Flags [P.], seq 9085:10318, ack 746, win 31, length 1233
16:44:42.799764 IP 172.20.38.238.57846 > 198.41.188.12.http: Flags [P.], seq 746:1153, ack 10318, win 251, length 407
16:44:42.799786 IP 198.41.188.12.http > 172.20.38.238.57851: Flags [.], seq 2469:3929, ack 761, win 31, length 1460
16:44:42.799789 IP 198.41.188.12.http > 172.20.38.238.57851: Flags [.], seq 3929:5389, ack 761, win 31, length 1460
16:44:42.799791 IP 198.41.188.12.http > 172.20.38.238.57851: Flags [.], seq 5389:6849, ack 761, win 31, length 1460
16:44:42.799800 IP 198.41.188.12.http > 172.20.38.238.57851: Flags [.], seq 6849:8309, ack 761, win 31, length 1460
16:44:42.799801 IP 198.41.188.12.http > 172.20.38.238.57851: Flags [.], seq 8309:9769, ack 761, win 31, length 1460
16:44:42.799803 IP 198.41.188.12.http > 172.20.38.238.57851: Flags [.], seq 9769:11229, ack 761, win 31, length 1460
16:44:42.799806 IP 198.41.188.12.http > 172.20.38.238.57851: Flags [.], seq 11229:12689, ack 761, win 31, length 1460
16:44:42.799812 IP 198.41.188.12.http > 172.20.38.238.57851: Flags [P.], seq 12689:12817, ack 761, win 31, length 128
16:44:42.799813 IP 198.41.188.12.http > 172.20.38.238.57850: Flags [.], seq 33643:35103, ack 737, win 31, length 1460
16:44:42.799815 IP 198.41.188.12.http > 172.20.38.238.57850: Flags [.], seq 35103:36563, ack 737, win 31, length 1460
16:44:42.799817 IP 198.41.188.12.http > 172.20.38.238.57850: Flags [.], seq 36563:38023, ack 737, win 31, length 1460
16:44:42.800006 IP 172.20.38.238.57851 > 198.41.188.12.http: Flags [.], ack 12817, win 256, length 0
16:44:42.800119 IP 172.20.38.238.57850 > 198.41.188.12.http: Flags [.], ack 38023, win 256, length 0
16:44:42.801248 IP 198.41.188.12.http > 172.20.38.238.57850: Flags [.], seq 38023:39483, ack 737, win 31, length 1460
16:44:42.801251 IP 198.41.188.12.http > 172.20.38.238.57850: Flags [.], seq 39483:40943, ack 737, win 31, length 1460
16:44:42.801253 IP 198.41.188.12.http > 172.20.38.238.57850: Flags [.], seq 40943:42403, ack 737, win 31, length 1460
16:44:42.801258 IP 198.41.188.12.http > 172.20.38.238.57850: Flags [P.], seq 42403:42810, ack 737, win 31, length 407
16:44:42.801260 IP 198.41.188.12.http > 172.20.38.238.57847: Flags [P.], seq 2520:3768, ack 724, win 31, length 1248
16:44:42.801372 IP 172.20.38.238.57850 > 198.41.188.12.http: Flags [.], ack 42810, win 256, length 0
16:44:42.805663 IP 172.20.38.238.57851 > 198.41.188.12.http: Flags [P.], seq 761:1168, ack 12817, win 256, length 407
16:44:42.806071 IP 172.20.38.238.57847 > 198.41.188.12.http: Flags [P.], seq 724:1131, ack 3768, win 251, length 407
16:44:42.806261 IP 172.20.38.238.57850 > 198.41.188.12.http: Flags [P.], seq 737:1143, ack 42810, win 256, length 406
16:44:42.807506 IP 198.41.188.12.http > 172.20.38.238.57849: Flags [P.], seq 14624:15933, ack 746, win 31, length 1309
16:44:42.810891 IP 172.20.38.238.57849 > 198.41.188.12.http: Flags [P.], seq 746:1152, ack 15933, win 251, length 406
16:44:42.924512 IP 172.20.38.238.65408 > resolver2.opendns.com.domain: 42636+ A? cdn.castplatform.com. (38)
16:44:42.993274 IP 198.41.188.12.http > 172.20.38.238.57846: Flags [P.], seq 10318:11198, ack 1153, win 32, length 880
16:44:42.995201 IP 172.20.38.238.57846 > 198.41.188.12.http: Flags [P.], seq 1153:1559, ack 11198, win 256, length 406
16:44:42.995291 IP 198.41.188.12.http > 172.20.38.238.57851: Flags [.], seq 12817:14277, ack 1168, win 32, length 1460
16:44:42.995293 IP 198.41.188.12.http > 172.20.38.238.57851: Flags [P.], seq 14277:14448, ack 1168, win 32, length 171
16:44:42.995294 IP 198.41.188.12.http > 172.20.38.238.57850: Flags [.], seq 42810:44270, ack 1143, win 32, length 1460
16:44:42.995296 IP 198.41.188.12.http > 172.20.38.238.57850: Flags [.], seq 44270:45730, ack 1143, win 32, length 1460
16:44:42.995311 IP 198.41.188.12.http > 172.20.38.238.57850: Flags [P.], seq 45730:45873, ack 1143, win 32, length 143
16:44:42.995312 IP 198.41.188.12.http > 172.20.38.238.57847: Flags [.], seq 3768:5228, ack 1131, win 32, length 1460
16:44:42.995314 IP 198.41.188.12.http > 172.20.38.238.57847: Flags [P.], seq 5228:5392, ack 1131, win 32, length 164
16:44:42.995315 IP 198.41.188.12.http > 172.20.38.238.57849: Flags [.], seq 15933:17393, ack 1152, win 32, length 1460
16:44:42.995317 IP 198.41.188.12.http > 172.20.38.238.57849: Flags [.], seq 17393:18853, ack 1152, win 32, length 1460
16:44:42.995318 IP 198.41.188.12.http > 172.20.38.238.57849: Flags [.], seq 18853:20313, ack 1152, win 32, length 1460
16:44:42.995320 IP 198.41.188.12.http > 172.20.38.238.57849: Flags [P.], seq 20313:20817, ack 1152, win 32, length 504
16:44:42.995457 IP 172.20.38.238.57851 > 198.41.188.12.http: Flags [.], ack 14448, win 256, length 0
16:44:42.995514 IP 172.20.38.238.57850 > 198.41.188.12.http: Flags [.], ack 45873, win 256, length 0
16:44:42.995556 IP 172.20.38.238.57847 > 198.41.188.12.http: Flags [.], ack 5392, win 256, length 0
16:44:42.995601 IP 172.20.38.238.57849 > 198.41.188.12.http: Flags [.], ack 20817, win 256, length 0
16:44:43.000025 IP 172.20.38.238.57850 > 198.41.188.12.http: Flags [P.], seq 1143:1548, ack 45873, win 256, length 405
16:44:43.000368 IP 172.20.38.238.57851 > 198.41.188.12.http: Flags [P.], seq 1168:1589, ack 14448, win 256, length 421
16:44:43.000577 IP 172.20.38.238.57847 > 198.41.188.12.http: Flags [P.], seq 1131:1551, ack 5392, win 256, length 420
16:44:43.000728 IP 172.20.38.238.57849 > 198.41.188.12.http: Flags [P.], seq 1152:1555, ack 20817, win 256, length 403
16:44:43.053948 IP ord30s22-in-f14.1e100.net.https > 172.20.38.238.57777: Flags [P.], seq 1109470994:1109471057, ack 1803420079, win 536, length 63
16:44:43.054243 IP ord30s22-in-f14.1e100.net.https > 172.20.38.238.57777: Flags [F.], seq 63, ack 1, win 536, length 0
16:44:43.054296 IP 172.20.38.238.57777 > ord30s22-in-f14.1e100.net.https: Flags [.], ack 64, win 252, length 0
16:44:43.054315 IP 172.20.38.238.57777 > ord30s22-in-f14.1e100.net.https: Flags [F.], seq 1, ack 64, win 252, length 0
16:44:43.083696 IP 172.20.38.238.62423 > resolver2.opendns.com.domain: 55720+ A? clients1.google.com. (37)
16:44:43.143834 IP 198.41.188.12.http > 172.20.38.238.57846: Flags [.], seq 11198:12658, ack 1559, win 33, length 1460
16:44:43.143837 IP 198.41.188.12.http > 172.20.38.238.57846: Flags [.], seq 12658:14118, ack 1559, win 33, length 1460
16:44:43.143839 IP 198.41.188.12.http > 172.20.38.238.57846: Flags [.], seq 14118:15578, ack 1559, win 33, length 1460
16:44:43.143972 IP 172.20.38.238.57846 > 198.41.188.12.http: Flags [.], ack 15578, win 256, length 0
16:44:43.144440 IP 172.20.38.238.65408 > resolver1.opendns.com.domain: 42636+ A? cdn.castplatform.com. (38)
16:44:43.144584 IP 198.41.188.12.http > 172.20.38.238.57846: Flags [P.], seq 15578:16687, ack 1559, win 33, length 1109
16:44:43.144647 IP 172.20.38.238.57846 > 198.41.188.12.http: Flags [.], ack 16687, win 252, length 0
16:44:43.146274 IP 172.20.38.238.57846 > 198.41.188.12.http: Flags [P.], seq 1559:1962, ack 16687, win 252, length 403
16:44:43.148810 IP 198.41.188.12.http > 172.20.38.238.57850: Flags [.], seq 45873:47333, ack 1548, win 33, length 1460
16:44:43.148812 IP 198.41.188.12.http > 172.20.38.238.57850: Flags [.], seq 47333:48793, ack 1548, win 33, length 1460
16:44:43.148819 IP 198.41.188.12.http > 172.20.38.238.57850: Flags [.], seq 48793:50253, ack 1548, win 33, length 1460
16:44:43.148821 IP 198.41.188.12.http > 172.20.38.238.57850: Flags [.], seq 50253:51713, ack 1548, win 33, length 1460
16:44:43.148929 IP 172.20.38.238.57850 > 198.41.188.12.http: Flags [.], ack 51713, win 256, length 0
16:44:43.152178 IP 198.41.188.12.http > 172.20.38.238.57850: Flags [.], seq 51713:53173, ack 1548, win 33, length 1460
16:44:43.152181 IP 198.41.188.12.http > 172.20.38.238.57850: Flags [.], seq 53173:54633, ack 1548, win 33, length 1460
16:44:43.152183 IP 198.41.188.12.http > 172.20.38.238.57850: Flags [.], seq 54633:56093, ack 1548, win 33, length 1460
16:44:43.152187 IP 198.41.188.12.http > 172.20.38.238.57850: Flags [.], seq 56093:57553, ack 1548, win 33, length 1460
16:44:43.152191 IP 198.41.188.12.http > 172.20.38.238.57850: Flags [.], seq 57553:59013, ack 1548, win 33, length 1460
16:44:43.152193 IP 198.41.188.12.http > 172.20.38.238.57850: Flags [.], seq 59013:60473, ack 1548, win 33, length 1460
16:44:43.152197 IP 198.41.188.12.http > 172.20.38.238.57850: Flags [.], seq 60473:61933, ack 1548, win 33, length 1460
16:44:43.152199 IP 198.41.188.12.http > 172.20.38.238.57850: Flags [.], seq 61933:63393, ack 1548, win 33, length 1460
16:44:43.152201 IP 198.41.188.12.http > 172.20.38.238.57850: Flags [.], seq 63393:64853, ack 1548, win 33, length 1460
16:44:43.152202 IP 198.41.188.12.http > 172.20.38.238.57850: Flags [.], seq 64853:66313, ack 1548, win 33, length 1460
16:44:43.152205 IP 198.41.188.12.http > 172.20.38.238.57850: Flags [.], seq 66313:67773, ack 1548, win 33, length 1460
16:44:43.152207 IP 198.41.188.12.http > 172.20.38.238.57850: Flags [.], seq 67773:69233, ack 1548, win 33, length 1460
16:44:43.152384 IP 172.20.38.238.57850 > 198.41.188.12.http: Flags [.], ack 69233, win 256, length 0
16:44:43.152847 IP 198.41.188.12.http > 172.20.38.238.57850: Flags [.], seq 69233:70693, ack 1548, win 33, length 1460
16:44:43.152852 IP 198.41.188.12.http > 172.20.38.238.57850: Flags [.], seq 70693:72153, ack 1548, win 33, length 1460
16:44:43.152854 IP 198.41.188.12.http > 172.20.38.238.57850: Flags [P.], seq 72153:73232, ack 1548, win 33, length 1079
16:44:43.152988 IP 172.20.38.238.57850 > 198.41.188.12.http: Flags [.], ack 73232, win 256, length 0
16:44:43.153525 IP 198.41.188.12.http > 172.20.38.238.57851: Flags [.], seq 14448:15908, ack 1589, win 33, length 1460
16:44:43.153529 IP 198.41.188.12.http > 172.20.38.238.57851: Flags [.], seq 15908:17368, ack 1589, win 33, length 1460
16:44:43.153530 IP 198.41.188.12.http > 172.20.38.238.57851: Flags [.], seq 17368:18828, ack 1589, win 33, length 1460
16:44:43.153537 IP 198.41.188.12.http > 172.20.38.238.57851: Flags [.], seq 18828:20288, ack 1589, win 33, length 1460
16:44:43.153634 IP 172.20.38.238.57851 > 198.41.188.12.http: Flags [.], ack 20288, win 256, length 0
16:44:43.155753 IP 198.41.188.12.http > 172.20.38.238.57851: Flags [.], seq 20288:21748, ack 1589, win 33, length 1460
16:44:43.155756 IP 198.41.188.12.http > 172.20.38.238.57851: Flags [P.], seq 21748:22189, ack 1589, win 33, length 441
16:44:43.155757 IP 198.41.188.12.http > 172.20.38.238.57847: Flags [P.], seq 5392:6400, ack 1551, win 33, length 1008
16:44:43.155882 IP 172.20.38.238.57851 > 198.41.188.12.http: Flags [.], ack 22189, win 256, length 0
16:44:43.155979 IP 172.20.38.238.57850 > 198.41.188.12.http: Flags [P.], seq 1548:1957, ack 73232, win 256, length 409
16:44:43.159000 IP 172.20.38.238.57847 > 198.41.188.12.http: Flags [P.], seq 1551:1967, ack 6400, win 252, length 416
16:44:43.159368 IP 172.20.38.238.57851 > 198.41.188.12.http: Flags [P.], seq 1589:2005, ack 22189, win 256, length 416
16:44:43.178890 IP resolver2.opendns.com.domain > 172.20.38.238.65408: 42636 2/0/0 CNAME cast-prod-dlv-pull.ironsrc.netdna-cdn.com., A 198.232.125.51 (106)
16:44:43.180109 IP 172.20.38.238.57852 > 51-125-232-198.static.unitasglobal.net.http: Flags [S], seq 1860816652, win 8192, options [mss 1460,nop,wscale 8,nop,nop,sackOK], length 0
16:44:43.181625 IP 198.41.188.12.http > 172.20.38.238.57849: Flags [.], ack 1555, win 33, length 0
16:44:43.203243 IP ord30s22-in-f14.1e100.net.https > 172.20.38.238.57777: Flags [.], ack 2, win 536, length 0
16:44:43.230605 IP 198.41.188.12.http > 172.20.38.238.57849: Flags [P.], seq 20817:21277, ack 1555, win 33, length 460
16:44:43.232393 IP 172.20.38.238.57849 > 198.41.188.12.http: Flags [P.], seq 1555:1971, ack 21277, win 254, length 416
16:44:43.239549 IP ord30s22-in-f14.1e100.net.https > 172.20.38.238.57795: Flags [P.], seq 2101073395:2101073458, ack 2537091379, win 622, length 63
16:44:43.239996 IP ord30s22-in-f14.1e100.net.https > 172.20.38.238.57795: Flags [F.], seq 63, ack 1, win 622, length 0
16:44:43.240037 IP 172.20.38.238.57795 > ord30s22-in-f14.1e100.net.https: Flags [F.], seq 1, ack 63, win 256, length 0
16:44:43.240163 IP 172.20.38.238.57795 > ord30s22-in-f14.1e100.net.https: Flags [.], ack 64, win 256, length 0
16:44:43.280221 IP resolver2.opendns.com.domain > 172.20.38.238.62423: 55720 2/0/0 CNAME clients.l.google.com., A 216.58.216.110 (77)
16:44:43.281437 IP 172.20.38.238.57853 > ord30s22-in-f14.1e100.net.https: Flags [S], seq 4031238093, win 8192, options [mss 1460,nop,wscale 8,nop,nop,sackOK], length 0
16:44:43.296360 IP 198.41.188.12.http > 172.20.38.238.57846: Flags [P.], seq 16687:17151, ack 1962, win 34, length 464
16:44:43.298285 IP 172.20.38.238.57846 > 198.41.188.12.http: Flags [P.], seq 1962:2368, ack 17151, win 256, length 406
16:44:43.303341 IP 172.20.38.238.57844 > 198.41.188.40.http: Flags [P.], seq 438:930, ack 8489, win 256, length 492
16:44:43.307201 IP 198.41.188.12.http > 172.20.38.238.57850: Flags [P.], seq 73232:73738, ack 1957, win 34, length 506
16:44:43.309177 IP 172.20.38.238.57850 > 198.41.188.12.http: Flags [P.], seq 1957:2363, ack 73738, win 254, length 406
16:44:43.312135 IP 198.41.188.12.http > 172.20.38.238.57847: Flags [P.], seq 6400:6847, ack 1967, win 34, length 447
16:44:43.312637 IP 198.41.188.12.http > 172.20.38.238.57851: Flags [P.], seq 22189:22636, ack 2005, win 34, length 447
16:44:43.315725 IP 172.20.38.238.57847 > 198.41.188.12.http: Flags [P.], seq 1967:2373, ack 6847, win 250, length 406
16:44:43.316230 IP 172.20.38.238.57851 > 198.41.188.12.http: Flags [P.], seq 2005:2411, ack 22636, win 254, length 406
16:44:43.329259 IP resolver1.opendns.com.domain > 172.20.38.238.65408: 42636 2/0/0 CNAME cast-prod-dlv-pull.ironsrc.netdna-cdn.com., A 198.232.125.51 (106)
16:44:43.332331 IP 172.20.38.238.57854 > ord30s22-in-f14.1e100.net.https: Flags [S], seq 991031900, win 8192, options [mss 1460,nop,wscale 8,nop,nop,sackOK], length 0
16:44:43.335568 IP 51-125-232-198.static.unitasglobal.net.http > 172.20.38.238.57852: Flags [S.], seq 813860055, ack 1860816653, win 32767, options [mss 1460,nop,nop,sackOK,nop,wscale 12], length 0
16:44:43.335758 IP 172.20.38.238.57852 > 51-125-232-198.static.unitasglobal.net.http: Flags [.], ack 1, win 256, length 0
16:44:43.336387 IP 172.20.38.238.57852 > 51-125-232-198.static.unitasglobal.net.http: Flags [P.], seq 1:335, ack 1, win 256, length 334
16:44:43.391688 IP 198.41.188.12.http > 172.20.38.238.57849: Flags [.], ack 1971, win 34, length 0
16:44:43.393738 IP ord30s22-in-f14.1e100.net.https > 172.20.38.238.57795: Flags [.], ack 2, win 622, length 0
16:44:43.439986 IP ord30s22-in-f14.1e100.net.https > 172.20.38.238.57853: Flags [S.], seq 1366070663, ack 4031238094, win 42900, options [mss 1430,nop,nop,sackOK,nop,wscale 7], length 0
16:44:43.440156 IP 172.20.38.238.57853 > ord30s22-in-f14.1e100.net.https: Flags [.], ack 1, win 256, length 0
16:44:43.440668 IP 172.20.38.238.57853 > ord30s22-in-f14.1e100.net.https: Flags [P.], seq 1:213, ack 1, win 256, length 212
16:44:43.460940 IP 198.41.188.40.http > 172.20.38.238.57844: Flags [.], ack 930, win 31, length 0
16:44:43.463630 IP 198.41.188.40.http > 172.20.38.238.57844: Flags [P.], seq 8489:9120, ack 930, win 31, length 631
16:44:43.469868 IP 198.41.188.12.http > 172.20.38.238.57846: Flags [.], seq 17151:18611, ack 2368, win 35, length 1460
16:44:43.469871 IP 198.41.188.12.http > 172.20.38.238.57846: Flags [P.], seq 18611:19184, ack 2368, win 35, length 573
16:44:43.469978 IP 172.20.38.238.57846 > 198.41.188.12.http: Flags [.], ack 19184, win 256, length 0
16:44:43.471859 IP 172.20.38.238.57846 > 198.41.188.12.http: Flags [P.], seq 2368:2780, ack 19184, win 256, length 412
16:44:43.488716 IP 198.41.188.12.http > 172.20.38.238.57847: Flags [P.], seq 8307:9636, ack 2373, win 35, length 1329
16:44:43.488718 IP 198.41.188.12.http > 172.20.38.238.57847: Flags [.], seq 6847:8307, ack 2373, win 35, length 1460
16:44:43.488822 IP 172.20.38.238.57847 > 198.41.188.12.http: Flags [.], ack 6847, win 250, options [nop,nop,sack 1 {8307:9636}], length 0
16:44:43.489009 IP 172.20.38.238.57847 > 198.41.188.12.http: Flags [.], ack 9636, win 256, length 0
16:44:43.490867 IP 172.20.38.238.57847 > 198.41.188.12.http: Flags [P.], seq 2373:2793, ack 9636, win 256, length 420
16:44:43.504064 IP 51-125-232-198.static.unitasglobal.net.http > 172.20.38.238.57852: Flags [.], ack 335, win 9, length 0
16:44:43.512332 IP 51-125-232-198.static.unitasglobal.net.http > 172.20.38.238.57852: Flags [.], seq 1:1461, ack 335, win 9, length 1460
16:44:43.512335 IP 51-125-232-198.static.unitasglobal.net.http > 172.20.38.238.57852: Flags [.], seq 1461:2921, ack 335, win 9, length 1460
16:44:43.512336 IP 51-125-232-198.static.unitasglobal.net.http > 172.20.38.238.57852: Flags [.], seq 2921:4381, ack 335, win 9, length 1460
16:44:43.512341 IP 51-125-232-198.static.unitasglobal.net.http > 172.20.38.238.57852: Flags [.], seq 4381:5841, ack 335, win 9, length 1460
16:44:43.512342 IP 51-125-232-198.static.unitasglobal.net.http > 172.20.38.238.57852: Flags [.], seq 5841:7301, ack 335, win 9, length 1460
16:44:43.512344 IP 51-125-232-198.static.unitasglobal.net.http > 172.20.38.238.57852: Flags [.], seq 7301:8761, ack 335, win 9, length 1460
16:44:43.512460 IP 172.20.38.238.57852 > 51-125-232-198.static.unitasglobal.net.http: Flags [.], ack 8761, win 256, length 0
16:44:43.513514 IP 51-125-232-198.static.unitasglobal.net.http > 172.20.38.238.57852: Flags [.], seq 8761:10221, ack 335, win 9, length 1460
16:44:43.515000 IP 51-125-232-198.static.unitasglobal.net.http > 172.20.38.238.57852: Flags [.], seq 10221:11681, ack 335, win 9, length 1460
16:44:43.515004 IP 51-125-232-198.static.unitasglobal.net.http > 172.20.38.238.57852: Flags [.], seq 11681:13141, ack 335, win 9, length 1460
16:44:43.515105 IP 172.20.38.238.57852 > 51-125-232-198.static.unitasglobal.net.http: Flags [.], ack 13141, win 256, length 0
16:44:43.515921 IP 172.20.38.238.57844 > 198.41.188.40.http: Flags [.], ack 9120, win 254, length 0
16:44:43.517323 IP 51-125-232-198.static.unitasglobal.net.http > 172.20.38.238.57852: Flags [.], seq 13141:14601, ack 335, win 9, length 1460
16:44:43.517326 IP 51-125-232-198.static.unitasglobal.net.http > 172.20.38.238.57852: Flags [.], seq 14601:16061, ack 335, win 9, length 1460
16:44:43.517332 IP 51-125-232-198.static.unitasglobal.net.http > 172.20.38.238.57852: Flags [.], seq 16061:17521, ack 335, win 9, length 1460
16:44:43.517339 IP 51-125-232-198.static.unitasglobal.net.http > 172.20.38.238.57852: Flags [.], seq 17521:18981, ack 335, win 9, length 1460
16:44:43.517341 IP 51-125-232-198.static.unitasglobal.net.http > 172.20.38.238.57852: Flags [.], seq 18981:20441, ack 335, win 9, length 1460
16:44:43.517343 IP 51-125-232-198.static.unitasglobal.net.http > 172.20.38.238.57852: Flags [.], seq 20441:21901, ack 335, win 9, length 1460
16:44:43.517346 IP 51-125-232-198.static.unitasglobal.net.http > 172.20.38.238.57852: Flags [P.], seq 21901:23034, ack 335, win 9, length 1133
16:44:43.517522 IP 172.20.38.238.57852 > 51-125-232-198.static.unitasglobal.net.http: Flags [.], ack 23034, win 256, length 0
16:44:43.524085 IP 198.41.188.12.http > 172.20.38.238.57850: Flags [.], seq 73738:75198, ack 2363, win 35, length 1460
16:44:43.524903 IP 198.41.188.12.http > 172.20.38.238.57850: Flags [.], seq 75198:76658, ack 2363, win 35, length 1460
16:44:43.524908 IP 198.41.188.12.http > 172.20.38.238.57850: Flags [.], seq 76658:78118, ack 2363, win 35, length 1460
16:44:43.524910 IP 198.41.188.12.http > 172.20.38.238.57850: Flags [P.], seq 78118:78505, ack 2363, win 35, length 387
16:44:43.525017 IP 172.20.38.238.57850 > 198.41.188.12.http: Flags [.], ack 78505, win 256, length 0
16:44:43.526927 IP 172.20.38.238.57850 > 198.41.188.12.http: Flags [P.], seq 2363:2784, ack 78505, win 256, length 421
16:44:43.530898 IP ord30s22-in-f14.1e100.net.https > 172.20.38.238.57854: Flags [S.], seq 3187930835, ack 991031901, win 42900, options [mss 1430,nop,nop,sackOK,nop,wscale 7], length 0
16:44:43.531031 IP 172.20.38.238.57854 > ord30s22-in-f14.1e100.net.https: Flags [.], ack 1, win 256, length 0
16:44:43.547774 IP 172.20.38.238.56417 > resolver2.opendns.com.domain: 50965+ A? d.castplatform.com. (36)
16:44:43.557889 IP 198.41.188.12.http > 172.20.38.238.57851: Flags [.], seq 22636:24096, ack 2411, win 35, length 1460
16:44:43.557891 IP 198.41.188.12.http > 172.20.38.238.57851: Flags [P.], seq 24096:24811, ack 2411, win 35, length 715
16:44:43.558004 IP 172.20.38.238.57851 > 198.41.188.12.http: Flags [.], ack 24811, win 256, length 0
16:44:43.559844 IP 172.20.38.238.57851 > 198.41.188.12.http: Flags [P.], seq 2411:2827, ack 24811, win 256, length 416
16:44:43.598420 IP 198.41.188.12.http > 172.20.38.238.57849: Flags [P.], seq 21277:21832, ack 1971, win 34, length 555
16:44:43.600271 IP 172.20.38.238.57849 > 198.41.188.12.http: Flags [P.], seq 1971:2387, ack 21832, win 252, length 416
16:44:43.629801 IP ord30s22-in-f14.1e100.net.https > 172.20.38.238.57853: Flags [.], ack 213, win 344, length 0
16:44:43.630556 IP ord30s22-in-f14.1e100.net.https > 172.20.38.238.57853: Flags [.], seq 1:1431, ack 213, win 344, length 1430
16:44:43.630558 IP ord30s22-in-f14.1e100.net.https > 172.20.38.238.57853: Flags [.], seq 1431:2861, ack 213, win 344, length 1430
16:44:43.630662 IP 172.20.38.238.57853 > ord30s22-in-f14.1e100.net.https: Flags [.], ack 2861, win 256, length 0
16:44:43.631113 IP ord30s22-in-f14.1e100.net.https > 172.20.38.238.57853: Flags [P.], seq 2861:4097, ack 213, win 344, length 1236
16:44:43.631115 IP ord30s22-in-f14.1e100.net.https > 172.20.38.238.57853: Flags [P.], seq 4097:4533, ack 213, win 344, length 436
16:44:43.631216 IP 172.20.38.238.57853 > ord30s22-in-f14.1e100.net.https: Flags [.], ack 4533, win 256, length 0
16:44:43.637972 IP 172.20.38.238.57853 > ord30s22-in-f14.1e100.net.https: Flags [P.], seq 213:339, ack 4533, win 256, length 126
16:44:43.660691 IP 172.20.38.238.57853 > ord30s22-in-f14.1e100.net.https: Flags [P.], seq 339:392, ack 4533, win 256, length 53
16:44:43.660916 IP 172.20.38.238.57853 > ord30s22-in-f14.1e100.net.https: Flags [P.], seq 392:442, ack 4533, win 256, length 50
16:44:43.660986 IP 172.20.38.238.57853 > ord30s22-in-f14.1e100.net.https: Flags [P.], seq 442:484, ack 4533, win 256, length 42
16:44:43.661375 IP 172.20.38.238.57853 > ord30s22-in-f14.1e100.net.https: Flags [P.], seq 484:695, ack 4533, win 256, length 211
16:44:43.661499 IP 172.20.38.238.57853 > ord30s22-in-f14.1e100.net.https: Flags [P.], seq 695:1102, ack 4533, win 256, length 407
16:44:43.664745 IP 198.41.188.12.http > 172.20.38.238.57848: Flags [S.], seq 3605957142, ack 2173200355, win 29200, options [mss 1460,nop,nop,sackOK,nop,wscale 10], length 0
16:44:43.664890 IP 172.20.38.238.57848 > 198.41.188.12.http: Flags [.], ack 1, win 256, length 0
16:44:43.665373 IP 172.20.38.238.57848 > 198.41.188.12.http: Flags [P.], seq 1:404, ack 1, win 256, length 403
16:44:43.687134 IP 198.41.188.12.http > 172.20.38.238.57847: Flags [P.], seq 11096:11952, ack 2793, win 36, length 856
16:44:43.687233 IP 172.20.38.238.57847 > 198.41.188.12.http: Flags [.], ack 9636, win 256, options [nop,nop,sack 1 {11096:11952}], length 0
16:44:43.687687 IP 198.41.188.12.http > 172.20.38.238.57847: Flags [.], seq 9636:11096, ack 2793, win 36, length 1460
16:44:43.687787 IP 172.20.38.238.57847 > 198.41.188.12.http: Flags [.], ack 11952, win 256, length 0
16:44:43.710755 IP 198.41.188.12.http > 172.20.38.238.57850: Flags [.], seq 78505:79965, ack 2784, win 36, length 1460
16:44:43.710758 IP 198.41.188.12.http > 172.20.38.238.57850: Flags [.], seq 79965:81425, ack 2784, win 36, length 1460
16:44:43.710760 IP 198.41.188.12.http > 172.20.38.238.57850: Flags [P.], seq 81425:82765, ack 2784, win 36, length 1340
16:44:43.710888 IP 172.20.38.238.57850 > 198.41.188.12.http: Flags [.], ack 82765, win 256, length 0
16:44:43.729493 IP resolver2.opendns.com.domain > 172.20.38.238.56417: 50965 2/0/0 CNAME eus2-cast-delivery1.cloudapp.net., A 104.209.191.112 (98)
16:44:43.730574 IP 172.20.38.238.57855 > 104.209.191.112.http: Flags [S], seq 73393884, win 8192, options [mss 1460,nop,wscale 8,nop,nop,sackOK], length 0
16:44:43.753926 IP 198.41.188.12.http > 172.20.38.238.57851: Flags [P.], seq 24811:25355, ack 2827, win 36, length 544
16:44:43.768777 IP 198.41.188.12.http > 172.20.38.238.57849: Flags [.], ack 2387, win 35, length 0
16:44:43.772560 IP 198.41.188.12.http > 172.20.38.238.57849: Flags [P.], seq 21832:22485, ack 2387, win 35, length 653
16:44:43.796750 IP 172.20.38.238.57856 > 104.209.191.112.http: Flags [S], seq 903898778, win 8192, options [mss 1460,nop,wscale 8,nop,nop,sackOK], length 0
16:44:43.804053 IP 172.20.38.238.57851 > 198.41.188.12.http: Flags [.], ack 25355, win 254, length 0
16:44:43.804256 IP ord30s22-in-f14.1e100.net.https > 172.20.38.238.57853: Flags [P.], seq 4533:4795, ack 339, win 344, length 262
16:44:43.804604 IP ord30s22-in-f14.1e100.net.https > 172.20.38.238.57853: Flags [P.], seq 4795:4851, ack 339, win 344, length 56
16:44:43.804605 IP ord30s22-in-f14.1e100.net.https > 172.20.38.238.57853: Flags [P.], seq 4851:4893, ack 339, win 344, length 42
16:44:43.804669 IP 172.20.38.238.57853 > ord30s22-in-f14.1e100.net.https: Flags [.], ack 4893, win 255, length 0
16:44:43.805255 IP 172.20.38.238.57853 > ord30s22-in-f14.1e100.net.https: Flags [P.], seq 1102:1140, ack 4893, win 255, length 38
16:44:43.824062 IP 172.20.38.238.57849 > 198.41.188.12.http: Flags [.], ack 22485, win 256, length 0
16:44:43.831973 IP 172.20.38.238.57846 > 198.41.188.12.http: Flags [P.], seq 2368:2780, ack 19184, win 256, length 412
16:44:43.832368 IP ord30s22-in-f14.1e100.net.https > 172.20.38.238.57853: Flags [.], ack 442, win 344, length 0
16:44:43.832370 IP ord30s22-in-f14.1e100.net.https > 172.20.38.238.57853: Flags [P.], seq 4893:4931, ack 442, win 344, length 38
16:44:43.833918 IP ord30s22-in-f14.1e100.net.https > 172.20.38.238.57853: Flags [.], ack 695, win 352, length 0
16:44:43.847883 IP ord30s22-in-f14.1e100.net.https > 172.20.38.238.57853: Flags [P.], seq 4931:5172, ack 1102, win 361, length 241
16:44:43.847992 IP 172.20.38.238.57853 > ord30s22-in-f14.1e100.net.https: Flags [.], ack 5172, win 254, length 0
16:44:43.849481 IP ord30s22-in-f14.1e100.net.https > 172.20.38.238.57853: Flags [P.], seq 5172:5289, ack 1102, win 361, length 117
16:44:43.849483 IP ord30s22-in-f14.1e100.net.https > 172.20.38.238.57853: Flags [P.], seq 5289:5335, ack 1102, win 361, length 46
16:44:43.849587 IP 172.20.38.238.57853 > ord30s22-in-f14.1e100.net.https: Flags [.], ack 5335, win 253, length 0
16:44:43.850266 IP 172.20.38.238.57853 > ord30s22-in-f14.1e100.net.https: Flags [P.], seq 1140:1186, ack 5335, win 253, length 46
16:44:43.962063 IP 104.209.191.112.http > 172.20.38.238.57855: Flags [S.], seq 3843156463, ack 73393885, win 8192, options [mss 1440,nop,wscale 8,nop,nop,sackOK], length 0
16:44:43.962216 IP 172.20.38.238.57855 > 104.209.191.112.http: Flags [.], ack 1, win 258, length 0
16:44:43.962594 IP 172.20.38.238.57855 > 104.209.191.112.http: Flags [P.], seq 1:404, ack 1, win 258, length 403
16:44:44.031646 IP 104.209.191.112.http > 172.20.38.238.57856: Flags [S.], seq 3757186277, ack 903898779, win 8192, options [mss 1440,nop,wscale 8,nop,nop,sackOK], length 0
16:44:44.031648 IP 198.41.188.12.http > 172.20.38.238.57846: Flags [.], seq 19184:20644, ack 2780, win 36, length 1460
16:44:44.031650 IP 198.41.188.12.http > 172.20.38.238.57846: Flags [.], seq 20644:22104, ack 2780, win 36, length 1460
16:44:44.031652 IP 198.41.188.12.http > 172.20.38.238.57846: Flags [P.], seq 22104:23061, ack 2780, win 36, length 957
16:44:44.031661 IP ord30s22-in-f14.1e100.net.https > 172.20.38.238.57853: Flags [.], ack 1140, win 361, length 0
16:44:44.031889 IP 172.20.38.238.57856 > 104.209.191.112.http: Flags [.], ack 1, win 258, length 0
16:44:44.032075 IP 172.20.38.238.57846 > 198.41.188.12.http: Flags [.], ack 23061, win 256, length 0
16:44:44.062116 IP ord30s22-in-f14.1e100.net.https > 172.20.38.238.57853: Flags [.], ack 1186, win 361, length 0
16:44:44.305049 IP 104.209.191.112.http > 172.20.38.238.57855: Flags [.], ack 404, win 513, length 0
16:44:44.305398 IP 104.209.191.112.http > 172.20.38.238.57855: Flags [P.], seq 1:476, ack 404, win 513, length 475
16:44:44.356120 IP 172.20.38.238.57855 > 104.209.191.112.http: Flags [.], ack 476, win 256, length 0
16:44:46.396206 IP 172.20.38.238.57839 > 216.58.192.206.https: Flags [F.], seq 2674500694, ack 3960032743, win 256, length 0
16:44:46.552754 IP 216.58.192.206.https > 172.20.38.238.57839: Flags [F.], seq 1, ack 1, win 336, length 0
16:44:46.552849 IP 172.20.38.238.57839 > 216.58.192.206.https: Flags [.], ack 2, win 256, length 0
16:44:47.682856 IP ord30s22-in-f14.1e100.net.https > 172.20.38.238.57841: Flags [F.], seq 525946603, ack 2155576169, win 336, length 0
16:44:47.682942 IP 172.20.38.238.57841 > ord30s22-in-f14.1e100.net.https: Flags [.], ack 1, win 256, length 0
16:44:47.683443 IP 51-125-232-198.static.unitasglobal.net.http > 172.20.38.238.57852: Flags [F.], seq 23034, ack 335, win 9, length 0
16:44:47.683538 IP 172.20.38.238.57852 > 51-125-232-198.static.unitasglobal.net.http: Flags [.], ack 23035, win 256, length 0
16:44:47.732962 IP ord30s22-in-f14.1e100.net.https > 172.20.38.238.57841: Flags [F.], seq 0, ack 1, win 336, length 0
16:44:47.733036 IP 172.20.38.238.57841 > ord30s22-in-f14.1e100.net.https: Flags [.], ack 1, win 256, length 0
16:44:48.396147 IP 172.20.38.238.57796 > 75.98.93.51.http: Flags [.], seq 2205363145:2205363146, ack 3163071936, win 64746, length 1
16:44:48.444067 IP 172.20.38.238.57848 > 198.41.188.12.http: Flags [P.], seq 1:404, ack 1, win 256, length 403
16:44:48.606518 IP 75.98.93.51.http > 172.20.38.238.57796: Flags [.], ack 1, win 4514, length 0
16:44:48.617254 IP 198.41.188.12.http > 172.20.38.238.57848: Flags [.], ack 404, win 30, length 0
16:44:48.619813 IP 198.41.188.12.http > 172.20.38.238.57848: Flags [P.], seq 1:852, ack 404, win 30, length 851
16:44:48.632437 IP 172.20.38.238.57848 > 198.41.188.12.http: Flags [P.], seq 404:786, ack 852, win 253, length 382
16:44:48.806300 IP 198.41.188.12.http > 172.20.38.238.57848: Flags [P.], seq 852:1735, ack 786, win 31, length 883
16:44:48.862590 IP 172.20.38.238.57848 > 198.41.188.12.http: Flags [.], ack 1735, win 256, length 0
16:44:49.419531 IP 172.20.38.238.57798 > 75.98.93.51.https: Flags [.], seq 300421963:300421964, ack 1282182380, win 64860, length 1
16:44:49.658311 IP 75.98.93.51.https > 172.20.38.238.57798: Flags [.], ack 1, win 4924, length 0