16:39:35.261473 IP 172.20.38.238.57710 > a192-5-110-40.deploy.akamaitechnologies.com.http: Flags [.], seq 3171979179:3171979180, ack 4077075874, win 251, length 1
16:39:35.380782 IP 172.20.38.238.57681 > iq-in-f95.1e100.net.https: Flags [.], seq 3335146346:3335146347, ack 329841651, win 256, length 1
16:39:35.419737 IP a192-5-110-40.deploy.akamaitechnologies.com.http > 172.20.38.238.57710: Flags [.], ack 1, win 490, options [nop,nop,sack 1 {0:1}], length 0
16:39:35.565349 IP iq-in-f95.1e100.net.https > 172.20.38.238.57681: Flags [.], ack 1, win 361, options [nop,nop,sack 1 {0:1}], length 0
16:39:35.575564 IP 172.20.38.238.57668 > ord30s22-in-f110.1e100.net.http: Flags [.], seq 871668638:871668639, ack 717427188, win 256, length 1
16:39:35.637957 IP 172.20.38.238.57696 > 72.249.192.51.http: Flags [.], seq 136447898:136447899, ack 3964620810, win 253, length 1
16:39:35.746222 IP ord30s22-in-f110.1e100.net.http > 172.20.38.238.57668: Flags [.], ack 1, win 365, options [nop,nop,sack 1 {0:1}], length 0
16:39:35.804084 IP 72.249.192.51.http > 172.20.38.238.57696: Flags [.], ack 1, win 524, options [nop,nop,sack 1 {0:1}], length 0
16:39:35.852626 IP 172.20.38.238.57711 > a192-5-110-39.deploy.akamaitechnologies.com.http: Flags [.], seq 2689568463:2689568464, ack 2457996668, win 256, length 1
16:39:35.876652 IP 172.20.38.238.57712 > a192-5-110-39.deploy.akamaitechnologies.com.http: Flags [.], seq 3888278450:3888278451, ack 3324655365, win 256, length 1
16:39:35.968669 IP 172.20.38.238.57704 > a192-5-110-39.deploy.akamaitechnologies.com.http: Flags [.], seq 2646855452:2646855453, ack 2283253014, win 256, length 1
16:39:35.992491 IP 172.20.38.238.57670 > iq-in-f95.1e100.net.https: Flags [.], seq 1571500089:1571500090, ack 3473444258, win 252, length 1
16:39:35.996005 IP a192-5-110-39.deploy.akamaitechnologies.com.http > 172.20.38.238.57711: Flags [.], ack 1, win 490, options [nop,nop,sack 1 {0:1}], length 0
16:39:35.996431 IP 172.20.38.238.57699 > a192-5-110-39.deploy.akamaitechnologies.com.http: Flags [.], seq 2134997005:2134997006, ack 889411070, win 256, length 1
16:39:36.023961 IP a192-5-110-39.deploy.akamaitechnologies.com.http > 172.20.38.238.57712: Flags [.], ack 1, win 490, options [nop,nop,sack 1 {0:1}], length 0
16:39:36.028645 IP 172.20.38.238.57713 > a192-5-110-39.deploy.akamaitechnologies.com.http: Flags [.], seq 1734211656:1734211657, ack 2560737529, win 256, length 1
16:39:36.048486 IP 172.20.38.238.57677 > ord30s22-in-f110.1e100.net.http: Flags [.], seq 1308787949:1308787950, ack 2004155804, win 256, length 1
16:39:36.127284 IP a192-5-110-39.deploy.akamaitechnologies.com.http > 172.20.38.238.57704: Flags [.], ack 1, win 490, options [nop,nop,sack 1 {0:1}], length 0
16:39:36.152353 IP a192-5-110-39.deploy.akamaitechnologies.com.http > 172.20.38.238.57699: Flags [.], ack 1, win 557, options [nop,nop,sack 1 {0:1}], length 0
16:39:36.152355 IP iq-in-f95.1e100.net.https > 172.20.38.238.57670: Flags [.], ack 1, win 369, options [nop,nop,sack 1 {0:1}], length 0
16:39:36.160246 IP 172.20.38.238.57678 > ord30s22-in-f10.1e100.net.https: Flags [.], seq 1127653566:1127653567, ack 3751281560, win 253, length 1
16:39:36.160449 IP 172.20.38.238.57702 > a192-5-110-40.deploy.akamaitechnologies.com.http: Flags [.], seq 2165493078:2165493079, ack 2794271458, win 1363, length 1
16:39:36.180285 IP a192-5-110-39.deploy.akamaitechnologies.com.http > 172.20.38.238.57713: Flags [.], ack 1, win 490, options [nop,nop,sack 1 {0:1}], length 0
16:39:36.204167 IP ord30s22-in-f110.1e100.net.http > 172.20.38.238.57677: Flags [.], ack 1, win 355, options [nop,nop,sack 1 {0:1}], length 0
16:39:36.207040 IP 172.20.38.238.57700 > a192-5-110-39.deploy.akamaitechnologies.com.http: Flags [.], seq 690056210:690056211, ack 486196839, win 256, length 1
16:39:36.254010 IP 172.20.38.238.57701 > a192-5-110-40.deploy.akamaitechnologies.com.http: Flags [.], seq 1593704509:1593704510, ack 2041456724, win 256, length 1
16:39:36.269616 IP 172.20.38.238.57718 > a192-5-110-39.deploy.akamaitechnologies.com.http: Flags [.], seq 3149652139:3149652140, ack 4042732488, win 252, length 1
16:39:36.292576 IP ord30s22-in-f10.1e100.net.https > 172.20.38.238.57678: Flags [.], ack 1, win 361, options [nop,nop,sack 1 {0:1}], length 0
16:39:36.292831 IP a192-5-110-40.deploy.akamaitechnologies.com.http > 172.20.38.238.57702: Flags [.], ack 1, win 591, options [nop,nop,sack 1 {0:1}], length 0
16:39:36.352644 IP a192-5-110-39.deploy.akamaitechnologies.com.http > 172.20.38.238.57700: Flags [.], ack 1, win 557, options [nop,nop,sack 1 {0:1}], length 0
16:39:36.363198 IP 172.20.38.238.57688 > ord30s22-in-f110.1e100.net.https: Flags [.], seq 2780985864:2780985865, ack 3783353839, win 253, length 1
16:39:36.394509 IP 172.20.38.238.57716 > a192-5-110-39.deploy.akamaitechnologies.com.http: Flags [.], seq 2379150936:2379150937, ack 3807343618, win 256, length 1
16:39:36.398393 IP a192-5-110-40.deploy.akamaitechnologies.com.http > 172.20.38.238.57701: Flags [.], ack 1, win 557, options [nop,nop,sack 1 {0:1}], length 0
16:39:36.418616 IP a192-5-110-39.deploy.akamaitechnologies.com.http > 172.20.38.238.57718: Flags [.], ack 1, win 490, options [nop,nop,sack 1 {0:1}], length 0
16:39:36.488223 IP 172.20.38.238.57664 > ord30s22-in-f4.1e100.net.http: Flags [.], seq 2776929892:2776929893, ack 1003927722, win 256, length 1
16:39:36.503838 IP 172.20.38.238.57708 > a192-5-110-40.deploy.akamaitechnologies.com.http: Flags [.], seq 2349758115:2349758116, ack 3351009525, win 256, length 1
16:39:36.522409 IP ord30s22-in-f110.1e100.net.https > 172.20.38.238.57688: Flags [.], ack 1, win 361, options [nop,nop,sack 1 {0:1}], length 0
16:39:36.555112 IP a192-5-110-39.deploy.akamaitechnologies.com.http > 172.20.38.238.57716: Flags [.], ack 1, win 524, options [nop,nop,sack 1 {0:1}], length 0
16:39:36.566384 IP 172.20.38.238.57714 > a192-5-110-39.deploy.akamaitechnologies.com.http: Flags [.], seq 3076637262:3076637263, ack 3504583806, win 1745, length 1
16:39:36.654965 IP ord30s22-in-f4.1e100.net.http > 172.20.38.238.57664: Flags [.], ack 1, win 436, options [nop,nop,sack 1 {0:1}], length 0
16:39:36.662364 IP a192-5-110-40.deploy.akamaitechnologies.com.http > 172.20.38.238.57708: Flags [.], ack 1, win 557, options [nop,nop,sack 1 {0:1}], length 0
16:39:36.715750 IP a192-5-110-39.deploy.akamaitechnologies.com.http > 172.20.38.238.57714: Flags [.], ack 1, win 490, options [nop,nop,sack 1 {0:1}], length 0
16:39:37.254885 IP 172.20.38.238.57709 > a192-5-110-40.deploy.akamaitechnologies.com.http: Flags [.], seq 2813326908:2813326909, ack 2148600622, win 255, length 1
16:39:37.390683 IP a192-5-110-40.deploy.akamaitechnologies.com.http > 172.20.38.238.57709: Flags [.], ack 1, win 490, options [nop,nop,sack 1 {0:1}], length 0
16:39:37.423597 IP 172.20.38.238.57715 > a192-5-110-39.deploy.akamaitechnologies.com.http: Flags [.], seq 1089732962:1089732963, ack 2054342494, win 256, length 1
16:39:37.593716 IP a192-5-110-39.deploy.akamaitechnologies.com.http > 172.20.38.238.57715: Flags [.], ack 1, win 490, options [nop,nop,sack 1 {0:1}], length 0
16:39:39.033304 IP 172.20.38.238.50567 > resolver2.opendns.com.domain: 3321+ A? tube8.com. (27)
16:39:39.206025 IP resolver2.opendns.com.domain > 172.20.38.238.50567: 3321 1/0/0 A 31.192.112.104 (43)
16:39:39.207124 IP 172.20.38.238.57730 > 31.192.112.104.http: Flags [S], seq 1901863333, win 8192, options [mss 1460,nop,wscale 8,nop,nop,sackOK], length 0
16:39:39.285527 IP 172.20.38.238.57731 > 31.192.112.104.http: Flags [S], seq 1897049864, win 8192, options [mss 1460,nop,wscale 8,nop,nop,sackOK], length 0
16:39:39.470731 IP 31.192.112.104.http > 172.20.38.238.57730: Flags [S.], seq 3545358760, ack 1901863334, win 14600, options [mss 1460,nop,nop,sackOK,nop,wscale 7], length 0
16:39:39.470884 IP 172.20.38.238.57730 > 31.192.112.104.http: Flags [.], ack 1, win 256, length 0
16:39:39.471590 IP 172.20.38.238.57730 > 31.192.112.104.http: Flags [P.], seq 1:368, ack 1, win 256, length 367
16:39:39.550567 IP 31.192.112.104.http > 172.20.38.238.57731: Flags [S.], seq 3032620006, ack 1897049865, win 14600, options [mss 1460,nop,nop,sackOK,nop,wscale 7], length 0
16:39:39.550714 IP 172.20.38.238.57731 > 31.192.112.104.http: Flags [.], ack 1, win 256, length 0
16:39:39.724896 IP 31.192.112.104.http > 172.20.38.238.57730: Flags [P.], seq 1:458, ack 368, win 123, length 457
16:39:39.781023 IP 172.20.38.238.57730 > 31.192.112.104.http: Flags [.], ack 458, win 254, length 0
16:39:39.977238 IP 172.20.38.238.52598 > resolver2.opendns.com.domain: 27702+ A? www.tube8.com. (31)
16:39:40.005044 IP 172.20.38.238.57697 > 72.249.192.51.http: Flags [.], seq 1167908501:1167908502, ack 4009950611, win 256, length 1
16:39:40.182371 IP 72.249.192.51.http > 172.20.38.238.57697: Flags [.], ack 1, win 524, options [nop,nop,sack 1 {0:1}], length 0
16:39:40.977292 IP 172.20.38.238.52598 > resolver1.opendns.com.domain: 27702+ A? www.tube8.com. (31)
16:39:41.146227 IP resolver1.opendns.com.domain > 172.20.38.238.52598: 27702 1/0/0 A 31.192.112.104 (47)
16:39:41.147400 IP 172.20.38.238.57732 > 31.192.112.104.http: Flags [S], seq 1952166706, win 8192, options [mss 1460,nop,wscale 8,nop,nop,sackOK], length 0
16:39:41.237767 IP 172.20.38.238.57733 > 31.192.112.104.http: Flags [S], seq 1678895182, win 8192, options [mss 1460,nop,wscale 8,nop,nop,sackOK], length 0
16:39:41.388535 IP 31.192.112.104.http > 172.20.38.238.57732: Flags [S.], seq 1721849523, ack 1952166707, win 14600, options [mss 1460,nop,nop,sackOK,nop,wscale 7], length 0
16:39:41.388723 IP 172.20.38.238.57732 > 31.192.112.104.http: Flags [.], ack 1, win 256, length 0
16:39:41.389218 IP 172.20.38.238.57732 > 31.192.112.104.http: Flags [P.], seq 1:372, ack 1, win 256, length 371
16:39:41.492686 IP 31.192.112.104.http > 172.20.38.238.57733: Flags [S.], seq 2456592737, ack 1678895183, win 14600, options [mss 1460,nop,nop,sackOK,nop,wscale 7], length 0
16:39:41.492850 IP 172.20.38.238.57733 > 31.192.112.104.http: Flags [.], ack 1, win 256, length 0
16:39:41.688628 IP 31.192.112.104.http > 172.20.38.238.57732: Flags [.], ack 372, win 123, length 0
16:39:41.722537 IP 31.192.112.104.http > 172.20.38.238.57732: Flags [.], seq 1:1461, ack 372, win 123, length 1460
16:39:41.722540 IP 31.192.112.104.http > 172.20.38.238.57732: Flags [.], seq 1461:2921, ack 372, win 123, length 1460
16:39:41.722542 IP 31.192.112.104.http > 172.20.38.238.57732: Flags [.], seq 2921:4381, ack 372, win 123, length 1460
16:39:41.722560 IP 31.192.112.104.http > 172.20.38.238.57732: Flags [.], seq 4381:5841, ack 372, win 123, length 1460
16:39:41.722682 IP 172.20.38.238.57732 > 31.192.112.104.http: Flags [.], ack 5841, win 256, length 0
16:39:41.724172 IP 31.192.112.104.http > 172.20.38.238.57732: Flags [.], seq 5841:7301, ack 372, win 123, length 1460
16:39:41.724176 IP 31.192.112.104.http > 172.20.38.238.57732: Flags [.], seq 7301:8761, ack 372, win 123, length 1460
16:39:41.724178 IP 31.192.112.104.http > 172.20.38.238.57732: Flags [.], seq 8761:10221, ack 372, win 123, length 1460
16:39:41.724187 IP 31.192.112.104.http > 172.20.38.238.57732: Flags [.], seq 10221:11681, ack 372, win 123, length 1460
16:39:41.724189 IP 31.192.112.104.http > 172.20.38.238.57732: Flags [.], seq 11681:13141, ack 372, win 123, length 1460
16:39:41.724191 IP 31.192.112.104.http > 172.20.38.238.57732: Flags [.], seq 13141:14601, ack 372, win 123, length 1460
16:39:41.724301 IP 172.20.38.238.57732 > 31.192.112.104.http: Flags [.], ack 14601, win 256, length 0
16:39:41.741147 IP 172.20.38.238.57733 > 31.192.112.104.http: Flags [P.], seq 1:511, ack 1, win 256, length 510
16:39:41.817771 IP 172.20.38.238.57726 > ord30s22-in-f10.1e100.net.https: Flags [.], seq 3564705988:3564705989, ack 2601180570, win 255, length 1
16:39:41.997752 IP 31.192.112.104.http > 172.20.38.238.57732: Flags [.], seq 14601:16061, ack 372, win 123, length 1460
16:39:41.997756 IP 31.192.112.104.http > 172.20.38.238.57732: Flags [.], seq 16061:17521, ack 372, win 123, length 1460
16:39:41.997758 IP 31.192.112.104.http > 172.20.38.238.57732: Flags [.], seq 17521:18981, ack 372, win 123, length 1460
16:39:41.997766 IP 31.192.112.104.http > 172.20.38.238.57732: Flags [P.], seq 18981:20441, ack 372, win 123, length 1460
16:39:41.997768 IP 31.192.112.104.http > 172.20.38.238.57732: Flags [.], seq 20441:21901, ack 372, win 123, length 1460
16:39:41.997773 IP 31.192.112.104.http > 172.20.38.238.57732: Flags [.], seq 21901:23361, ack 372, win 123, length 1460
16:39:41.997775 IP 31.192.112.104.http > 172.20.38.238.57732: Flags [.], seq 23361:24821, ack 372, win 123, length 1460
16:39:41.997931 IP 172.20.38.238.57732 > 31.192.112.104.http: Flags [.], ack 24821, win 256, length 0
16:39:41.998614 IP 31.192.112.104.http > 172.20.38.238.57732: Flags [.], seq 24821:26281, ack 372, win 123, length 1460
16:39:41.998645 IP 172.20.38.238.57732 > 31.192.112.104.http: Flags [.], ack 26281, win 256, length 0
16:39:42.000205 IP 31.192.112.104.http > 172.20.38.238.57732: Flags [.], seq 26281:27741, ack 372, win 123, length 1460
16:39:42.000207 IP 31.192.112.104.http > 172.20.38.238.57732: Flags [P.], seq 27741:28242, ack 372, win 123, length 501
16:39:42.000208 IP ord30s22-in-f10.1e100.net.https > 172.20.38.238.57726: Flags [.], ack 1, win 378, options [nop,nop,sack 1 {0:1}], length 0
16:39:42.000287 IP 172.20.38.238.57732 > 31.192.112.104.http: Flags [.], ack 28242, win 256, length 0
16:39:42.001233 IP 172.20.38.238.51960 > resolver1.opendns.com.domain: 64129+ A? cdn1.static.tube8.phncdn.com. (46)
16:39:42.004309 IP 31.192.112.104.http > 172.20.38.238.57733: Flags [.], seq 1:1461, ack 511, win 123, length 1460
16:39:42.004312 IP 31.192.112.104.http > 172.20.38.238.57733: Flags [.], seq 1461:2921, ack 511, win 123, length 1460
16:39:42.004413 IP 172.20.38.238.57733 > 31.192.112.104.http: Flags [.], ack 2921, win 256, length 0
16:39:42.006730 IP 31.192.112.104.http > 172.20.38.238.57733: Flags [.], seq 2921:4381, ack 511, win 123, length 1460
16:39:42.006735 IP 31.192.112.104.http > 172.20.38.238.57733: Flags [.], seq 4381:5841, ack 511, win 123, length 1460
16:39:42.006737 IP 31.192.112.104.http > 172.20.38.238.57733: Flags [.], seq 5841:7301, ack 511, win 123, length 1460
16:39:42.006739 IP 31.192.112.104.http > 172.20.38.238.57733: Flags [.], seq 7301:8761, ack 511, win 123, length 1460
16:39:42.006824 IP 172.20.38.238.57733 > 31.192.112.104.http: Flags [.], ack 8761, win 256, length 0
16:39:42.008143 IP 31.192.112.104.http > 172.20.38.238.57733: Flags [.], seq 8761:10221, ack 511, win 123, length 1460
16:39:42.008147 IP 31.192.112.104.http > 172.20.38.238.57733: Flags [.], seq 10221:11681, ack 511, win 123, length 1460
16:39:42.008149 IP 31.192.112.104.http > 172.20.38.238.57733: Flags [.], seq 11681:13141, ack 511, win 123, length 1460
16:39:42.008155 IP 31.192.112.104.http > 172.20.38.238.57733: Flags [.], seq 13141:14601, ack 511, win 123, length 1460
16:39:42.008277 IP 172.20.38.238.57733 > 31.192.112.104.http: Flags [.], ack 14601, win 256, length 0
16:39:42.213659 IP resolver1.opendns.com.domain > 172.20.38.238.51960: 64129 3/0/0 CNAME cdn1.static.tube8.phncdn.com.rncdn1.com., A 8.26.213.126, A 8.254.59.253 (128)
16:39:42.214774 IP 172.20.38.238.57734 > 8.26.213.126.http: Flags [S], seq 2253474867, win 8192, options [mss 1460,nop,wscale 8,nop,nop,sackOK], length 0
16:39:42.249902 IP 172.20.38.238.57735 > 8.26.213.126.http: Flags [S], seq 903395656, win 8192, options [mss 1460,nop,wscale 8,nop,nop,sackOK], length 0
16:39:42.274590 IP 31.192.112.104.http > 172.20.38.238.57733: Flags [.], seq 14601:16061, ack 511, win 123, length 1460
16:39:42.274593 IP 31.192.112.104.http > 172.20.38.238.57733: Flags [.], seq 16061:17521, ack 511, win 123, length 1460
16:39:42.274712 IP 172.20.38.238.57733 > 31.192.112.104.http: Flags [.], ack 17521, win 256, length 0
16:39:42.275945 IP 31.192.112.104.http > 172.20.38.238.57733: Flags [.], seq 17521:18981, ack 511, win 123, length 1460
16:39:42.275948 IP 31.192.112.104.http > 172.20.38.238.57733: Flags [P.], seq 18981:19658, ack 511, win 123, length 677
16:39:42.276039 IP 172.20.38.238.57733 > 31.192.112.104.http: Flags [.], ack 19658, win 256, length 0
16:39:42.283866 IP 172.20.38.238.57733 > 31.192.112.104.http: Flags [P.], seq 511:1005, ack 19658, win 256, length 494
16:39:42.407675 IP 8.26.213.126.http > 172.20.38.238.57734: Flags [S.], seq 3382440574, ack 2253474868, win 5840, options [mss 1460,nop,nop,sackOK,nop,wscale 7], length 0
16:39:42.407823 IP 172.20.38.238.57734 > 8.26.213.126.http: Flags [.], ack 1, win 256, length 0
16:39:42.408462 IP 172.20.38.238.57734 > 8.26.213.126.http: Flags [P.], seq 1:433, ack 1, win 256, length 432
16:39:42.435432 IP 8.26.213.126.http > 172.20.38.238.57735: Flags [S.], seq 1353584379, ack 903395657, win 5840, options [mss 1460,nop,nop,sackOK,nop,wscale 7], length 0
16:39:42.435571 IP 172.20.38.238.57735 > 8.26.213.126.http: Flags [.], ack 1, win 256, length 0
16:39:42.529180 IP 172.20.38.238.51534 > resolver1.opendns.com.domain: 56941+ A? ss.phncdn.com. (31)
16:39:42.529475 IP 172.20.38.238.64273 > resolver1.opendns.com.domain: 20181+ A? cdn1.image.tube8.phncdn.com. (45)
16:39:42.543815 IP 31.192.112.104.http > 172.20.38.238.57733: Flags [.], seq 19658:21118, ack 1005, win 131, length 1460
16:39:42.543817 IP 31.192.112.104.http > 172.20.38.238.57733: Flags [.], seq 21118:22578, ack 1005, win 131, length 1460
16:39:42.543819 IP 31.192.112.104.http > 172.20.38.238.57733: Flags [.], seq 22578:24038, ack 1005, win 131, length 1460
16:39:42.543825 IP 31.192.112.104.http > 172.20.38.238.57733: Flags [P.], seq 24038:25272, ack 1005, win 131, length 1234
16:39:42.543943 IP 172.20.38.238.57733 > 31.192.112.104.http: Flags [.], ack 25272, win 256, length 0
16:39:42.546091 IP 172.20.38.238.57735 > 8.26.213.126.http: Flags [P.], seq 1:487, ack 1, win 256, length 486
16:39:42.608091 IP 8.26.213.126.http > 172.20.38.238.57734: Flags [.], ack 433, win 54, length 0
16:39:42.608093 IP 8.26.213.126.http > 172.20.38.238.57734: Flags [.], ack 433, win 54, length 0
16:39:42.608197 IP 172.20.38.238.57734 > 8.26.213.126.http: Flags [.], ack 1, win 256, length 0
16:39:42.609011 IP 8.26.213.126.http > 172.20.38.238.57734: Flags [.], seq 1:1461, ack 433, win 54, length 1460
16:39:42.609015 IP 8.26.213.126.http > 172.20.38.238.57734: Flags [.], seq 1461:2921, ack 433, win 54, length 1460
16:39:42.609150 IP 172.20.38.238.57734 > 8.26.213.126.http: Flags [.], ack 2921, win 256, length 0
16:39:42.637085 IP 172.20.38.238.57727 > ord30s22-in-f10.1e100.net.https: Flags [.], seq 552861927:552861928, ack 871987504, win 252, length 1
16:39:42.731953 IP resolver1.opendns.com.domain > 172.20.38.238.64273: 20181 2/0/0 CNAME cdn1.image.tube8.phncdn.com.rncdn1.com., A 207.123.42.253 (110)
16:39:42.733292 IP 172.20.38.238.57736 > 207.123.42.253.http: Flags [S], seq 87412809, win 8192, options [mss 1460,nop,wscale 8,nop,nop,sackOK], length 0
16:39:42.733747 IP 172.20.38.238.57737 > 207.123.42.253.http: Flags [S], seq 187351627, win 8192, options [mss 1460,nop,wscale 8,nop,nop,sackOK], length 0
16:39:42.734165 IP 172.20.38.238.57738 > 207.123.42.253.http: Flags [S], seq 2643167265, win 8192, options [mss 1460,nop,wscale 8,nop,nop,sackOK], length 0
16:39:42.734451 IP 172.20.38.238.57739 > 207.123.42.253.http: Flags [S], seq 3889881924, win 8192, options [mss 1460,nop,wscale 8,nop,nop,sackOK], length 0
16:39:42.734748 IP 172.20.38.238.57740 > 207.123.42.253.http: Flags [S], seq 220472495, win 8192, options [mss 1460,nop,wscale 8,nop,nop,sackOK], length 0
16:39:42.735092 IP 172.20.38.238.57741 > 207.123.42.253.http: Flags [S], seq 73231743, win 8192, options [mss 1460,nop,wscale 8,nop,nop,sackOK], length 0
16:39:42.744326 IP 8.26.213.126.http > 172.20.38.238.57735: Flags [.], ack 487, win 54, length 0
16:39:42.744684 IP 8.26.213.126.http > 172.20.38.238.57735: Flags [.], ack 487, win 54, length 0
16:39:42.744759 IP 172.20.38.238.57735 > 8.26.213.126.http: Flags [.], ack 1, win 256, length 0
16:39:42.746466 IP 8.26.213.126.http > 172.20.38.238.57735: Flags [.], seq 1:1461, ack 487, win 54, length 1460
16:39:42.746469 IP 8.26.213.126.http > 172.20.38.238.57735: Flags [.], seq 1461:2921, ack 487, win 54, length 1460
16:39:42.746578 IP 172.20.38.238.57735 > 8.26.213.126.http: Flags [.], ack 2921, win 256, length 0
16:39:42.748093 IP resolver1.opendns.com.domain > 172.20.38.238.51534: 56941 3/0/0 CNAME ss.phncdn.com.rncdn1.com., A 8.26.213.126, A 8.254.59.253 (98)
16:39:42.749475 IP 172.20.38.238.57742 > 8.26.213.126.http: Flags [S], seq 2731443208, win 8192, options [mss 1460,nop,wscale 8,nop,nop,sackOK], length 0
16:39:42.749878 IP 172.20.38.238.57743 > 8.26.213.126.http: Flags [S], seq 1546472868, win 8192, options [mss 1460,nop,wscale 8,nop,nop,sackOK], length 0
16:39:42.750188 IP 172.20.38.238.57744 > 8.26.213.126.http: Flags [S], seq 533307974, win 8192, options [mss 1460,nop,wscale 8,nop,nop,sackOK], length 0
16:39:42.781632 IP 172.20.38.238.57745 > 8.26.213.126.http: Flags [S], seq 2312278800, win 8192, options [mss 1460,nop,wscale 8,nop,nop,sackOK], length 0
16:39:42.796943 IP ord30s22-in-f10.1e100.net.https > 172.20.38.238.57727: Flags [.], ack 1, win 361, options [nop,nop,sack 1 {0:1}], length 0
16:39:42.803970 IP 8.26.213.126.http > 172.20.38.238.57734: Flags [.], seq 2921:4381, ack 433, win 54, length 1460
16:39:42.803972 IP 8.26.213.126.http > 172.20.38.238.57734: Flags [.], seq 4381:5841, ack 433, win 54, length 1460
16:39:42.803974 IP 8.26.213.126.http > 172.20.38.238.57734: Flags [P.], seq 5841:7065, ack 433, win 54, length 1224
16:39:42.804108 IP 172.20.38.238.57734 > 8.26.213.126.http: Flags [.], ack 7065, win 256, length 0
16:39:42.895613 IP 207.123.42.253.http > 172.20.38.238.57737: Flags [S.], seq 2711379159, ack 187351628, win 5840, options [mss 1460,nop,nop,sackOK,nop,wscale 7], length 0
16:39:42.895764 IP 172.20.38.238.57737 > 207.123.42.253.http: Flags [.], ack 1, win 256, length 0
16:39:42.896031 IP 207.123.42.253.http > 172.20.38.238.57736: Flags [S.], seq 2903788802, ack 87412810, win 5840, options [mss 1460,nop,nop,sackOK,nop,wscale 7], length 0
16:39:42.896108 IP 172.20.38.238.57736 > 207.123.42.253.http: Flags [.], ack 1, win 256, length 0
16:39:42.896488 IP 172.20.38.238.57737 > 207.123.42.253.http: Flags [P.], seq 1:374, ack 1, win 256, length 373
16:39:42.896836 IP 172.20.38.238.57736 > 207.123.42.253.http: Flags [P.], seq 1:374, ack 1, win 256, length 373
16:39:42.897422 IP 207.123.42.253.http > 172.20.38.238.57738: Flags [S.], seq 3104739653, ack 2643167266, win 5840, options [mss 1460,nop,nop,sackOK,nop,wscale 7], length 0
16:39:42.897424 IP 207.123.42.253.http > 172.20.38.238.57740: Flags [S.], seq 2911115410, ack 220472496, win 5840, options [mss 1460,nop,nop,sackOK,nop,wscale 7], length 0
16:39:42.897426 IP 207.123.42.253.http > 172.20.38.238.57739: Flags [S.], seq 2902892900, ack 3889881925, win 5840, options [mss 1460,nop,nop,sackOK,nop,wscale 7], length 0
16:39:42.897689 IP 172.20.38.238.57738 > 207.123.42.253.http: Flags [.], ack 1, win 256, length 0
16:39:42.897810 IP 172.20.38.238.57740 > 207.123.42.253.http: Flags [.], ack 1, win 256, length 0
16:39:42.897865 IP 172.20.38.238.57739 > 207.123.42.253.http: Flags [.], ack 1, win 256, length 0
16:39:42.898035 IP 207.123.42.253.http > 172.20.38.238.57741: Flags [S.], seq 2910950922, ack 73231744, win 5840, options [mss 1460,nop,nop,sackOK,nop,wscale 7], length 0
16:39:42.898086 IP 172.20.38.238.57738 > 207.123.42.253.http: Flags [P.], seq 1:374, ack 1, win 256, length 373
16:39:42.898108 IP 172.20.38.238.57741 > 207.123.42.253.http: Flags [.], ack 1, win 256, length 0
16:39:42.898353 IP 172.20.38.238.57740 > 207.123.42.253.http: Flags [P.], seq 1:375, ack 1, win 256, length 374
16:39:42.898631 IP 172.20.38.238.57739 > 207.123.42.253.http: Flags [P.], seq 1:374, ack 1, win 256, length 373
16:39:42.898988 IP 172.20.38.238.57741 > 207.123.42.253.http: Flags [P.], seq 1:374, ack 1, win 256, length 373
16:39:42.939123 IP 8.26.213.126.http > 172.20.38.238.57735: Flags [.], seq 2921:4381, ack 487, win 54, length 1460
16:39:42.940798 IP 8.26.213.126.http > 172.20.38.238.57735: Flags [.], seq 4381:5841, ack 487, win 54, length 1460
16:39:42.940901 IP 172.20.38.238.57735 > 8.26.213.126.http: Flags [.], ack 5841, win 256, length 0
16:39:42.942387 IP 8.26.213.126.http > 172.20.38.238.57735: Flags [.], seq 5841:7301, ack 487, win 54, length 1460
16:39:42.944391 IP 8.26.213.126.http > 172.20.38.238.57743: Flags [S.], seq 280298902, ack 1546472869, win 5840, options [mss 1460,nop,nop,sackOK,nop,wscale 7], length 0
16:39:42.944393 IP 8.26.213.126.http > 172.20.38.238.57744: Flags [S.], seq 3221682313, ack 533307975, win 5840, options [mss 1460,nop,nop,sackOK,nop,wscale 7], length 0
16:39:42.944394 IP 8.26.213.126.http > 172.20.38.238.57742: Flags [S.], seq 3131175872, ack 2731443209, win 5840, options [mss 1460,nop,nop,sackOK,nop,wscale 7], length 0
16:39:42.944656 IP 172.20.38.238.57743 > 8.26.213.126.http: Flags [.], ack 1, win 256, length 0
16:39:42.944853 IP 172.20.38.238.57744 > 8.26.213.126.http: Flags [.], ack 1, win 256, length 0
16:39:42.944916 IP 172.20.38.238.57742 > 8.26.213.126.http: Flags [.], ack 1, win 256, length 0
16:39:42.945136 IP 172.20.38.238.57743 > 8.26.213.126.http: Flags [P.], seq 1:421, ack 1, win 256, length 420
16:39:42.945425 IP 172.20.38.238.57744 > 8.26.213.126.http: Flags [P.], seq 1:317, ack 1, win 256, length 316
16:39:42.945683 IP 172.20.38.238.57742 > 8.26.213.126.http: Flags [P.], seq 1:319, ack 1, win 256, length 318
16:39:42.974103 IP 8.26.213.126.http > 172.20.38.238.57745: Flags [S.], seq 3234196847, ack 2312278801, win 5840, options [mss 1460,nop,nop,sackOK,nop,wscale 7], length 0
16:39:42.974277 IP 172.20.38.238.57745 > 8.26.213.126.http: Flags [.], ack 1, win 256, length 0
16:39:43.001095 IP 172.20.38.238.57735 > 8.26.213.126.http: Flags [.], ack 7301, win 256, length 0
16:39:43.057347 IP 172.20.38.238.61396 > resolver1.opendns.com.domain: 36852+ A? ht.tube8.com. (30)
16:39:43.067032 IP 207.123.42.253.http > 172.20.38.238.57737: Flags [.], ack 374, win 54, length 0
16:39:43.067933 IP 207.123.42.253.http > 172.20.38.238.57737: Flags [.], ack 374, win 54, length 0
16:39:43.067980 IP 172.20.38.238.57737 > 207.123.42.253.http: Flags [.], ack 1, win 256, length 0
16:39:43.070100 IP 207.123.42.253.http > 172.20.38.238.57736: Flags [.], ack 374, win 54, length 0
16:39:43.072214 IP 207.123.42.253.http > 172.20.38.238.57737: Flags [.], seq 1:1461, ack 374, win 54, length 1460
16:39:43.072217 IP 207.123.42.253.http > 172.20.38.238.57736: Flags [.], ack 374, win 54, length 0
16:39:43.072218 IP 207.123.42.253.http > 172.20.38.238.57738: Flags [.], ack 374, win 54, length 0
16:39:43.072219 IP 207.123.42.253.http > 172.20.38.238.57737: Flags [.], seq 1461:2921, ack 374, win 54, length 1460
16:39:43.072221 IP 207.123.42.253.http > 172.20.38.238.57740: Flags [.], ack 375, win 54, length 0
16:39:43.072222 IP 207.123.42.253.http > 172.20.38.238.57736: Flags [.], seq 1:1461, ack 374, win 54, length 1460
16:39:43.072239 IP 207.123.42.253.http > 172.20.38.238.57736: Flags [.], seq 1461:2921, ack 374, win 54, length 1460
16:39:43.072240 IP 207.123.42.253.http > 172.20.38.238.57740: Flags [.], ack 375, win 54, length 0
16:39:43.072356 IP 172.20.38.238.57736 > 207.123.42.253.http: Flags [.], ack 1, win 256, length 0
16:39:43.072536 IP 172.20.38.238.57740 > 207.123.42.253.http: Flags [.], ack 1, win 256, length 0
16:39:43.072588 IP 172.20.38.238.57737 > 207.123.42.253.http: Flags [.], ack 2921, win 256, length 0
16:39:43.072635 IP 172.20.38.238.57736 > 207.123.42.253.http: Flags [.], ack 2921, win 256, length 0
16:39:43.072856 IP 207.123.42.253.http > 172.20.38.238.57740: Flags [.], seq 1:1461, ack 375, win 54, length 1460
16:39:43.072859 IP 207.123.42.253.http > 172.20.38.238.57740: Flags [.], seq 1461:2921, ack 375, win 54, length 1460
16:39:43.072913 IP 172.20.38.238.57740 > 207.123.42.253.http: Flags [.], ack 2921, win 256, length 0
16:39:43.074456 IP 207.123.42.253.http > 172.20.38.238.57739: Flags [.], ack 374, win 54, length 0
16:39:43.074457 IP 207.123.42.253.http > 172.20.38.238.57741: Flags [.], ack 374, win 54, length 0
16:39:43.074458 IP 207.123.42.253.http > 172.20.38.238.57741: Flags [.], ack 374, win 54, length 0
16:39:43.074459 IP 207.123.42.253.http > 172.20.38.238.57739: Flags [.], ack 374, win 54, length 0
16:39:43.074460 IP 207.123.42.253.http > 172.20.38.238.57738: Flags [.], ack 374, win 54, length 0
16:39:43.074460 IP 207.123.42.253.http > 172.20.38.238.57739: Flags [.], seq 1:1461, ack 374, win 54, length 1460
16:39:43.074525 IP 172.20.38.238.57741 > 207.123.42.253.http: Flags [.], ack 1, win 256, length 0
16:39:43.074610 IP 172.20.38.238.57739 > 207.123.42.253.http: Flags [.], ack 1, win 256, length 0
16:39:43.074673 IP 172.20.38.238.57738 > 207.123.42.253.http: Flags [.], ack 1, win 256, length 0
16:39:43.077078 IP 207.123.42.253.http > 172.20.38.238.57739: Flags [.], seq 1461:2921, ack 374, win 54, length 1460
16:39:43.077080 IP 207.123.42.253.http > 172.20.38.238.57738: Flags [.], seq 1:1461, ack 374, win 54, length 1460
16:39:43.077086 IP 207.123.42.253.http > 172.20.38.238.57738: Flags [.], seq 1461:2921, ack 374, win 54, length 1460
16:39:43.077088 IP 207.123.42.253.http > 172.20.38.238.57741: Flags [.], seq 1:1461, ack 374, win 54, length 1460
16:39:43.077090 IP 207.123.42.253.http > 172.20.38.238.57741: Flags [.], seq 1461:2921, ack 374, win 54, length 1460
16:39:43.077184 IP 172.20.38.238.57739 > 207.123.42.253.http: Flags [.], ack 2921, win 256, length 0
16:39:43.077284 IP 172.20.38.238.57738 > 207.123.42.253.http: Flags [.], ack 2921, win 256, length 0
16:39:43.077352 IP 172.20.38.238.57741 > 207.123.42.253.http: Flags [.], ack 2921, win 256, length 0
16:39:43.135811 IP 8.26.213.126.http > 172.20.38.238.57735: Flags [.], seq 7301:8761, ack 487, win 54, length 1460
16:39:43.135814 IP 8.26.213.126.http > 172.20.38.238.57735: Flags [.], seq 8761:10221, ack 487, win 54, length 1460
16:39:43.135816 IP 8.26.213.126.http > 172.20.38.238.57735: Flags [.], seq 10221:11681, ack 487, win 54, length 1460
16:39:43.135941 IP 172.20.38.238.57735 > 8.26.213.126.http: Flags [.], ack 11681, win 256, length 0
16:39:43.136881 IP 8.26.213.126.http > 172.20.38.238.57743: Flags [.], ack 421, win 54, length 0
16:39:43.137432 IP 8.26.213.126.http > 172.20.38.238.57744: Flags [.], ack 317, win 54, length 0
16:39:43.137434 IP 8.26.213.126.http > 172.20.38.238.57744: Flags [.], ack 317, win 54, length 0
16:39:43.137435 IP 8.26.213.126.http > 172.20.38.238.57743: Flags [.], ack 421, win 54, length 0
16:39:43.137491 IP 172.20.38.238.57744 > 8.26.213.126.http: Flags [.], ack 1, win 256, length 0
16:39:43.137606 IP 172.20.38.238.57743 > 8.26.213.126.http: Flags [.], ack 1, win 256, length 0
16:39:43.137909 IP 8.26.213.126.http > 172.20.38.238.57744: Flags [P.], seq 1:986, ack 317, win 54, length 985
16:39:43.137910 IP 8.26.213.126.http > 172.20.38.238.57742: Flags [.], ack 319, win 54, length 0
16:39:43.138801 IP 8.26.213.126.http > 172.20.38.238.57742: Flags [.], ack 319, win 54, length 0
16:39:43.138836 IP 172.20.38.238.57742 > 8.26.213.126.http: Flags [.], ack 1, win 256, length 0
16:39:43.139571 IP 8.26.213.126.http > 172.20.38.238.57742: Flags [P.], seq 1:1397, ack 319, win 54, length 1396
16:39:43.142573 IP 172.20.38.238.57734 > 8.26.213.126.http: Flags [P.], seq 433:920, ack 7065, win 256, length 487
16:39:43.143685 IP 8.26.213.126.http > 172.20.38.238.57743: Flags [P.], seq 1:876, ack 421, win 54, length 875
16:39:43.189082 IP 172.20.38.238.57742 > 8.26.213.126.http: Flags [.], ack 1397, win 251, length 0
16:39:43.189085 IP 172.20.38.238.57744 > 8.26.213.126.http: Flags [.], ack 986, win 252, length 0
16:39:43.192858 IP 8.26.213.126.http > 172.20.38.238.57735: Flags [.], seq 11681:13141, ack 487, win 54, length 1460
16:39:43.192862 IP 8.26.213.126.http > 172.20.38.238.57735: Flags [.], seq 13141:14601, ack 487, win 54, length 1460
16:39:43.192992 IP 172.20.38.238.57735 > 8.26.213.126.http: Flags [.], ack 14601, win 256, length 0
16:39:43.200984 IP 172.20.38.238.57743 > 8.26.213.126.http: Flags [.], ack 876, win 253, length 0
16:39:43.238370 IP resolver1.opendns.com.domain > 172.20.38.238.61396: 36852 1/0/0 A 185.75.252.204 (46)
16:39:43.240786 IP 172.20.38.238.57746 > 185.75.252.204.http: Flags [S], seq 1886250006, win 8192, options [mss 1460,nop,wscale 8,nop,nop,sackOK], length 0
16:39:43.251716 IP 207.123.42.253.http > 172.20.38.238.57740: Flags [.], seq 2921:4381, ack 375, win 54, length 1460
16:39:43.251725 IP 207.123.42.253.http > 172.20.38.238.57740: Flags [.], seq 4381:5841, ack 375, win 54, length 1460
16:39:43.251728 IP 207.123.42.253.http > 172.20.38.238.57740: Flags [P.], seq 5841:6645, ack 375, win 54, length 804
16:39:43.251729 IP 207.123.42.253.http > 172.20.38.238.57737: Flags [.], seq 2921:4381, ack 374, win 54, length 1460
16:39:43.251732 IP 207.123.42.253.http > 172.20.38.238.57737: Flags [.], seq 4381:5841, ack 374, win 54, length 1460
16:39:43.251734 IP 207.123.42.253.http > 172.20.38.238.57737: Flags [P.], seq 5841:6382, ack 374, win 54, length 541
16:39:43.251946 IP 172.20.38.238.57740 > 207.123.42.253.http: Flags [.], ack 6645, win 256, length 0
16:39:43.252176 IP 172.20.38.238.57737 > 207.123.42.253.http: Flags [.], ack 6382, win 256, length 0
16:39:43.252573 IP 207.123.42.253.http > 172.20.38.238.57736: Flags [.], seq 2921:4381, ack 374, win 54, length 1460
16:39:43.252578 IP 207.123.42.253.http > 172.20.38.238.57736: Flags [.], seq 4381:5841, ack 374, win 54, length 1460
16:39:43.252581 IP 207.123.42.253.http > 172.20.38.238.57736: Flags [P.], seq 5841:6121, ack 374, win 54, length 280
16:39:43.252583 IP 207.123.42.253.http > 172.20.38.238.57738: Flags [.], seq 2921:4381, ack 374, win 54, length 1460
16:39:43.252586 IP 207.123.42.253.http > 172.20.38.238.57738: Flags [.], seq 4381:5841, ack 374, win 54, length 1460
16:39:43.252589 IP 207.123.42.253.http > 172.20.38.238.57738: Flags [P.], seq 5841:6034, ack 374, win 54, length 193
16:39:43.252695 IP 172.20.38.238.57736 > 207.123.42.253.http: Flags [.], ack 6121, win 256, length 0
16:39:43.252775 IP 172.20.38.238.57738 > 207.123.42.253.http: Flags [.], ack 6034, win 256, length 0
16:39:43.254611 IP 207.123.42.253.http > 172.20.38.238.57741: Flags [.], seq 2921:4381, ack 374, win 54, length 1460
16:39:43.254615 IP 207.123.42.253.http > 172.20.38.238.57741: Flags [.], seq 4381:5841, ack 374, win 54, length 1460
16:39:43.254619 IP 207.123.42.253.http > 172.20.38.238.57741: Flags [.], seq 5841:7301, ack 374, win 54, length 1460
16:39:43.254631 IP 207.123.42.253.http > 172.20.38.238.57739: Flags [.], seq 2921:4381, ack 374, win 54, length 1460
16:39:43.254634 IP 207.123.42.253.http > 172.20.38.238.57739: Flags [.], seq 4381:5841, ack 374, win 54, length 1460
16:39:43.254638 IP 207.123.42.253.http > 172.20.38.238.57739: Flags [P.], seq 5841:6794, ack 374, win 54, length 953
16:39:43.254783 IP 172.20.38.238.57741 > 207.123.42.253.http: Flags [.], ack 7301, win 256, length 0
16:39:43.254886 IP 172.20.38.238.57739 > 207.123.42.253.http: Flags [.], ack 6794, win 256, length 0
16:39:43.259710 IP 172.20.38.238.57740 > 207.123.42.253.http: Flags [P.], seq 375:748, ack 6645, win 256, length 373
16:39:43.261959 IP 172.20.38.238.57737 > 207.123.42.253.http: Flags [P.], seq 374:747, ack 6382, win 256, length 373
16:39:43.262322 IP 172.20.38.238.57738 > 207.123.42.253.http: Flags [P.], seq 374:747, ack 6034, win 256, length 373
16:39:43.262595 IP 172.20.38.238.57736 > 207.123.42.253.http: Flags [P.], seq 374:748, ack 6121, win 256, length 374
16:39:43.262884 IP 172.20.38.238.57739 > 207.123.42.253.http: Flags [P.], seq 374:747, ack 6794, win 256, length 373
16:39:43.309960 IP 172.20.38.238.57747 > 185.75.252.204.http: Flags [S], seq 2292173062, win 8192, options [mss 1460,nop,wscale 8,nop,nop,sackOK], length 0
16:39:43.328047 IP 8.26.213.126.http > 172.20.38.238.57735: Flags [.], seq 14601:16061, ack 487, win 54, length 1460
16:39:43.328050 IP 8.26.213.126.http > 172.20.38.238.57735: Flags [.], seq 16061:17521, ack 487, win 54, length 1460
16:39:43.328052 IP 8.26.213.126.http > 172.20.38.238.57735: Flags [.], seq 17521:18981, ack 487, win 54, length 1460
16:39:43.328058 IP 8.26.213.126.http > 172.20.38.238.57735: Flags [P.], seq 18981:19603, ack 487, win 54, length 622
16:39:43.328184 IP 172.20.38.238.57735 > 8.26.213.126.http: Flags [.], ack 19603, win 256, length 0
16:39:43.334876 IP 8.26.213.126.http > 172.20.38.238.57734: Flags [.], ack 920, win 63, length 0
16:39:43.335385 IP 8.26.213.126.http > 172.20.38.238.57734: Flags [.], ack 920, win 63, length 0
16:39:43.335460 IP 172.20.38.238.57734 > 8.26.213.126.http: Flags [.], ack 7065, win 256, length 0
16:39:43.335890 IP 8.26.213.126.http > 172.20.38.238.57734: Flags [P.], seq 7065:8125, ack 920, win 63, length 1060
16:39:43.388993 IP 172.20.38.238.57734 > 8.26.213.126.http: Flags [.], ack 8125, win 252, length 0
16:39:43.445841 IP 207.123.42.253.http > 172.20.38.238.57741: Flags [.], seq 7301:8761, ack 374, win 54, length 1460
16:39:43.445843 IP 207.123.42.253.http > 172.20.38.238.57741: Flags [P.], seq 8761:8767, ack 374, win 54, length 6
16:39:43.445952 IP 172.20.38.238.57741 > 207.123.42.253.http: Flags [.], ack 8767, win 256, length 0
16:39:43.446869 IP 207.123.42.253.http > 172.20.38.238.57740: Flags [.], ack 748, win 63, length 0
16:39:43.446870 IP 207.123.42.253.http > 172.20.38.238.57740: Flags [.], ack 748, win 63, length 0
16:39:43.446908 IP 172.20.38.238.57740 > 207.123.42.253.http: Flags [.], ack 6645, win 256, length 0
16:39:43.447515 IP 172.20.38.238.57741 > 207.123.42.253.http: Flags [P.], seq 374:747, ack 8767, win 256, length 373
16:39:43.449769 IP 207.123.42.253.http > 172.20.38.238.57740: Flags [.], seq 6645:8105, ack 748, win 63, length 1460
16:39:43.449771 IP 207.123.42.253.http > 172.20.38.238.57740: Flags [.], seq 8105:9565, ack 748, win 63, length 1460
16:39:43.449851 IP 172.20.38.238.57740 > 207.123.42.253.http: Flags [.], ack 9565, win 256, length 0
16:39:43.450188 IP 207.123.42.253.http > 172.20.38.238.57737: Flags [.], ack 747, win 63, length 0
16:39:43.450190 IP 207.123.42.253.http > 172.20.38.238.57737: Flags [.], ack 747, win 63, length 0
16:39:43.450280 IP 172.20.38.238.57737 > 207.123.42.253.http: Flags [.], ack 6382, win 256, length 0
16:39:43.450641 IP 207.123.42.253.http > 172.20.38.238.57737: Flags [.], seq 6382:7842, ack 747, win 63, length 1460
16:39:43.452158 IP 207.123.42.253.http > 172.20.38.238.57737: Flags [.], seq 7842:9302, ack 747, win 63, length 1460
16:39:43.452160 IP 207.123.42.253.http > 172.20.38.238.57738: Flags [.], ack 747, win 63, length 0
16:39:43.452161 IP 207.123.42.253.http > 172.20.38.238.57738: Flags [.], ack 747, win 63, length 0
16:39:43.452260 IP 172.20.38.238.57738 > 207.123.42.253.http: Flags [.], ack 6034, win 256, length 0
16:39:43.452371 IP 172.20.38.238.57737 > 207.123.42.253.http: Flags [.], ack 9302, win 256, length 0
16:39:43.475300 IP 207.123.42.253.http > 172.20.38.238.57738: Flags [.], seq 6034:7494, ack 747, win 63, length 1460
16:39:43.481105 IP 207.123.42.253.http > 172.20.38.238.57738: Flags [.], seq 7494:8954, ack 747, win 63, length 1460
16:39:43.481107 IP 207.123.42.253.http > 172.20.38.238.57736: Flags [.], ack 748, win 63, length 0
16:39:43.481108 IP 207.123.42.253.http > 172.20.38.238.57736: Flags [.], ack 748, win 63, length 0
16:39:43.481109 IP 207.123.42.253.http > 172.20.38.238.57739: Flags [.], ack 747, win 63, length 0
16:39:43.481177 IP 172.20.38.238.57736 > 207.123.42.253.http: Flags [.], ack 6121, win 256, length 0
16:39:43.481320 IP 172.20.38.238.57738 > 207.123.42.253.http: Flags [.], ack 8954, win 256, length 0
16:39:43.486232 IP 207.123.42.253.http > 172.20.38.238.57736: Flags [.], seq 6121:7581, ack 748, win 63, length 1460
16:39:43.489344 IP 207.123.42.253.http > 172.20.38.238.57736: Flags [.], seq 7581:9041, ack 748, win 63, length 1460
