16:37:53.139591 IP 172.20.38.238.57695 > vpn3000.cwru.edu.http: Flags [S], seq 2819149337, win 8192, options [mss 1460,nop,wscale 8,nop,nop,sackOK], length 0
16:37:54.811649 ARP, Request who-has 172.20.32.1 (b8:ca:3a:6c:f7:00 (oui Unknown)) tell 172.20.38.238, length 28
16:37:54.812635 IP ord30s22-in-f100.1e100.net.https > 172.20.38.238.57622: Flags [P.], seq 4226817094:4226817157, ack 283024294, win 375, length 63
16:37:54.813358 IP ord30s22-in-f14.1e100.net.https > 172.20.38.238.57625: Flags [P.], seq 610467133:610467196, ack 3757713176, win 419, length 63
16:37:54.853735 ARP, Reply 172.20.32.1 is-at b8:ca:3a:6c:f7:00 (oui Unknown), length 46
16:37:56.624122 IP 172.20.38.238.57689 > 104.46.104.228.https: Flags [F.], seq 2339106309, ack 498440893, win 258, length 0
16:37:56.817643 IP 104.46.104.228.https > 172.20.38.238.57689: Flags [F.], seq 1, ack 1, win 513, length 0
16:37:56.817733 IP 172.20.38.238.57689 > 104.46.104.228.https: Flags [.], ack 2, win 258, length 0
16:38:01.975486 IP 172.20.38.238.57635 > iq-in-f188.1e100.net.5228: Flags [.], seq 3482805391:3482805392, ack 674634662, win 255, length 1
16:38:02.131637 IP 172.20.38.238.60602 > resolver2.opendns.com.domain: 48329+ A? mashable.com. (30)
16:38:02.157326 IP iq-in-f188.1e100.net.5228 > 172.20.38.238.57635: Flags [.], ack 1, win 361, options [nop,nop,sack 1 {0:1}], length 0
16:38:02.311829 IP resolver2.opendns.com.domain > 172.20.38.238.60602: 48329 2/0/0 A 72.249.192.51, A 72.249.192.67 (62)
16:38:02.313336 IP 172.20.38.238.57696 > 72.249.192.51.http: Flags [S], seq 136447072, win 8192, options [mss 1460,nop,wscale 8,nop,nop,sackOK], length 0
16:38:02.331431 IP 172.20.38.238.57637 > ord30s22-in-f14.1e100.net.https: Flags [.], seq 2868143398:2868143399, ack 1591296418, win 255, length 1
16:38:02.380121 IP 172.20.38.238.57697 > 72.249.192.51.http: Flags [S], seq 1167907644, win 8192, options [mss 1460,nop,wscale 8,nop,nop,sackOK], length 0
16:38:02.479406 IP 72.249.192.51.http > 172.20.38.238.57696: Flags [S.], seq 3964561521, ack 136447073, win 14600, options [mss 1460,nop,nop,sackOK,nop,wscale 5], length 0
16:38:02.479568 IP 172.20.38.238.57696 > 72.249.192.51.http: Flags [.], ack 1, win 256, length 0
16:38:02.480239 IP 172.20.38.238.57696 > 72.249.192.51.http: Flags [P.], seq 1:371, ack 1, win 256, length 370
16:38:02.503215 IP ord30s22-in-f14.1e100.net.https > 172.20.38.238.57637: Flags [.], ack 1, win 402, options [nop,nop,sack 1 {0:1}], length 0
16:38:02.565053 IP 72.249.192.51.http > 172.20.38.238.57697: Flags [S.], seq 4009899928, ack 1167907645, win 14600, options [mss 1460,nop,nop,sackOK,nop,wscale 5], length 0
16:38:02.565204 IP 172.20.38.238.57697 > 72.249.192.51.http: Flags [.], ack 1, win 256, length 0
16:38:02.660917 IP 72.249.192.51.http > 172.20.38.238.57696: Flags [.], ack 371, win 490, length 0
16:38:02.661451 IP 72.249.192.51.http > 172.20.38.238.57696: Flags [.], seq 1:1461, ack 371, win 490, length 1460
16:38:02.664015 IP 72.249.192.51.http > 172.20.38.238.57696: Flags [.], seq 1461:2921, ack 371, win 490, length 1460
16:38:02.664017 IP 72.249.192.51.http > 172.20.38.238.57696: Flags [.], seq 2921:4381, ack 371, win 490, length 1460
16:38:02.664019 IP 72.249.192.51.http > 172.20.38.238.57696: Flags [.], seq 4381:5841, ack 371, win 490, length 1460
16:38:02.664027 IP 72.249.192.51.http > 172.20.38.238.57696: Flags [.], seq 7301:8761, ack 371, win 490, length 1460
16:38:02.664029 IP 72.249.192.51.http > 172.20.38.238.57696: Flags [.], seq 8761:10221, ack 371, win 490, length 1460
16:38:02.664030 IP 72.249.192.51.http > 172.20.38.238.57696: Flags [.], seq 10221:11681, ack 371, win 490, length 1460
16:38:02.664032 IP 72.249.192.51.http > 172.20.38.238.57696: Flags [.], seq 11681:13141, ack 371, win 490, length 1460
16:38:02.664033 IP 72.249.192.51.http > 172.20.38.238.57696: Flags [.], seq 13141:14601, ack 371, win 490, length 1460
16:38:02.664035 IP 72.249.192.51.http > 172.20.38.238.57696: Flags [.], seq 14601:16061, ack 371, win 490, length 1460
16:38:02.664037 IP 72.249.192.51.http > 172.20.38.238.57696: Flags [.], seq 16061:17521, ack 371, win 490, length 1460
16:38:02.664167 IP 172.20.38.238.57696 > 72.249.192.51.http: Flags [.], ack 5841, win 256, options [nop,nop,sack 1 {7301:8761}], length 0
16:38:02.664323 IP 172.20.38.238.57696 > 72.249.192.51.http: Flags [.], ack 5841, win 256, options [nop,nop,sack 1 {7301:10221}], length 0
16:38:02.664380 IP 172.20.38.238.57696 > 72.249.192.51.http: Flags [.], ack 5841, win 256, options [nop,nop,sack 1 {7301:11681}], length 0
16:38:02.664433 IP 172.20.38.238.57696 > 72.249.192.51.http: Flags [.], ack 5841, win 256, options [nop,nop,sack 1 {7301:13141}], length 0
16:38:02.664492 IP 172.20.38.238.57696 > 72.249.192.51.http: Flags [.], ack 5841, win 256, options [nop,nop,sack 1 {7301:14601}], length 0
16:38:02.664550 IP 172.20.38.238.57696 > 72.249.192.51.http: Flags [.], ack 5841, win 256, options [nop,nop,sack 1 {7301:16061}], length 0
16:38:02.664608 IP 172.20.38.238.57696 > 72.249.192.51.http: Flags [.], ack 5841, win 256, options [nop,nop,sack 1 {7301:17521}], length 0
16:38:02.665777 IP 72.249.192.51.http > 172.20.38.238.57696: Flags [.], seq 17521:18981, ack 371, win 490, length 1460
16:38:02.665780 IP 72.249.192.51.http > 172.20.38.238.57696: Flags [.], seq 18981:20441, ack 371, win 490, length 1460
16:38:02.665781 IP 72.249.192.51.http > 172.20.38.238.57696: Flags [.], seq 20441:21901, ack 371, win 490, length 1460
16:38:02.665787 IP 72.249.192.51.http > 172.20.38.238.57696: Flags [.], seq 21901:23361, ack 371, win 490, length 1460
16:38:02.665883 IP 172.20.38.238.57696 > 72.249.192.51.http: Flags [.], ack 5841, win 256, options [nop,nop,sack 1 {7301:18981}], length 0
16:38:02.666010 IP 172.20.38.238.57696 > 72.249.192.51.http: Flags [.], ack 5841, win 256, options [nop,nop,sack 1 {7301:20441}], length 0
16:38:02.666089 IP 172.20.38.238.57696 > 72.249.192.51.http: Flags [.], ack 5841, win 256, options [nop,nop,sack 1 {7301:21901}], length 0
16:38:02.666164 IP 172.20.38.238.57696 > 72.249.192.51.http: Flags [.], ack 5841, win 256, options [nop,nop,sack 1 {7301:23361}], length 0
16:38:02.735427 IP 172.20.38.238.57636 > ord30s22-in-f100.1e100.net.https: Flags [.], seq 2340910612:2340910613, ack 1813754975, win 252, length 1
16:38:02.844130 IP 72.249.192.51.http > 172.20.38.238.57696: Flags [.], seq 23361:24821, ack 371, win 490, length 1460
16:38:02.844257 IP 172.20.38.238.57696 > 72.249.192.51.http: Flags [.], ack 5841, win 256, options [nop,nop,sack 1 {7301:24821}], length 0
16:38:02.845550 IP 72.249.192.51.http > 172.20.38.238.57696: Flags [.], seq 24821:26281, ack 371, win 490, length 1460
16:38:02.845689 IP 172.20.38.238.57696 > 72.249.192.51.http: Flags [.], ack 5841, win 256, options [nop,nop,sack 1 {7301:26281}], length 0
16:38:02.847055 IP 72.249.192.51.http > 172.20.38.238.57696: Flags [.], seq 26281:27741, ack 371, win 490, length 1460
16:38:02.847098 IP 172.20.38.238.57696 > 72.249.192.51.http: Flags [.], ack 5841, win 256, options [nop,nop,sack 1 {7301:27741}], length 0
16:38:02.848892 IP 72.249.192.51.http > 172.20.38.238.57696: Flags [.], seq 27741:29201, ack 371, win 490, length 1460
16:38:02.848981 IP 172.20.38.238.57696 > 72.249.192.51.http: Flags [.], ack 5841, win 256, options [nop,nop,sack 1 {7301:29201}], length 0
16:38:02.851921 IP 72.249.192.51.http > 172.20.38.238.57696: Flags [.], seq 29201:30661, ack 371, win 490, length 1460
16:38:02.851924 IP 72.249.192.51.http > 172.20.38.238.57696: Flags [.], seq 30661:32121, ack 371, win 490, length 1460
16:38:02.851925 IP 72.249.192.51.http > 172.20.38.238.57696: Flags [.], seq 32121:33581, ack 371, win 490, length 1460
16:38:02.851930 IP 72.249.192.51.http > 172.20.38.238.57696: Flags [P.], seq 33581:35041, ack 371, win 490, length 1460
16:38:02.851932 IP 72.249.192.51.http > 172.20.38.238.57696: Flags [.], seq 5841:7301, ack 371, win 490, length 1460
16:38:02.852018 IP 172.20.38.238.57696 > 72.249.192.51.http: Flags [.], ack 5841, win 256, options [nop,nop,sack 1 {7301:30661}], length 0
16:38:02.852147 IP 172.20.38.238.57696 > 72.249.192.51.http: Flags [.], ack 5841, win 256, options [nop,nop,sack 1 {7301:32121}], length 0
16:38:02.852202 IP 172.20.38.238.57696 > 72.249.192.51.http: Flags [.], ack 5841, win 256, options [nop,nop,sack 1 {7301:33581}], length 0
16:38:02.852253 IP 172.20.38.238.57696 > 72.249.192.51.http: Flags [.], ack 5841, win 256, options [nop,nop,sack 1 {7301:35041}], length 0
16:38:02.852382 IP 172.20.38.238.57696 > 72.249.192.51.http: Flags [.], ack 35041, win 256, length 0
16:38:02.854004 IP 72.249.192.51.http > 172.20.38.238.57696: Flags [.], seq 35041:36501, ack 371, win 490, length 1460
16:38:02.854006 IP 72.249.192.51.http > 172.20.38.238.57696: Flags [.], seq 36501:37961, ack 371, win 490, length 1460
16:38:02.854008 IP 72.249.192.51.http > 172.20.38.238.57696: Flags [.], seq 37961:39421, ack 371, win 490, length 1460
16:38:02.854013 IP 72.249.192.51.http > 172.20.38.238.57696: Flags [.], seq 39421:40881, ack 371, win 490, length 1460
16:38:02.854015 IP 72.249.192.51.http > 172.20.38.238.57696: Flags [.], seq 40881:42341, ack 371, win 490, length 1460
16:38:02.854016 IP 72.249.192.51.http > 172.20.38.238.57696: Flags [.], seq 42341:43801, ack 371, win 490, length 1460
16:38:02.854018 IP 72.249.192.51.http > 172.20.38.238.57696: Flags [.], seq 43801:45261, ack 371, win 490, length 1460
16:38:02.854020 IP 72.249.192.51.http > 172.20.38.238.57696: Flags [.], seq 45261:46721, ack 371, win 490, length 1460
16:38:02.854022 IP 72.249.192.51.http > 172.20.38.238.57696: Flags [.], seq 46721:48181, ack 371, win 490, length 1460
16:38:02.854127 IP 172.20.38.238.57696 > 72.249.192.51.http: Flags [.], ack 48181, win 256, length 0
16:38:02.855395 IP 72.249.192.51.http > 172.20.38.238.57696: Flags [.], seq 48181:49641, ack 371, win 490, length 1460
16:38:02.855493 IP 172.20.38.238.57696 > 72.249.192.51.http: Flags [.], ack 49641, win 256, length 0
16:38:02.910233 IP ord30s22-in-f100.1e100.net.https > 172.20.38.238.57636: Flags [.], ack 1, win 405, options [nop,nop,sack 1 {0:1}], length 0
16:38:02.951786 IP 172.20.38.238.62333 > resolver2.opendns.com.domain: 8621+ A? rack.2.mshcdn.com. (35)
16:38:02.951786 IP 172.20.38.238.64204 > resolver2.opendns.com.domain: 12002+ A? widgets.outbrain.com. (38)
16:38:02.951860 IP 172.20.38.238.49543 > resolver2.opendns.com.domain: 27692+ A? analytics.revee.com. (37)
16:38:02.951861 IP 172.20.38.238.54360 > resolver2.opendns.com.domain: 42403+ A? rack.0.mshcdn.com. (35)
16:38:03.019946 IP 72.249.192.51.http > 172.20.38.238.57696: Flags [.], seq 49641:51101, ack 371, win 490, length 1460
16:38:03.019948 IP 72.249.192.51.http > 172.20.38.238.57696: Flags [.], seq 51101:52561, ack 371, win 490, length 1460
16:38:03.019955 IP 72.249.192.51.http > 172.20.38.238.57696: Flags [.], seq 52561:54021, ack 371, win 490, length 1460
16:38:03.020078 IP 172.20.38.238.57696 > 72.249.192.51.http: Flags [.], ack 54021, win 256, length 0
16:38:03.020377 IP 72.249.192.51.http > 172.20.38.238.57696: Flags [.], seq 54021:55481, ack 371, win 490, length 1460
16:38:03.020425 IP 172.20.38.238.57696 > 72.249.192.51.http: Flags [.], ack 55481, win 256, length 0
16:38:03.022794 IP 72.249.192.51.http > 172.20.38.238.57696: Flags [.], seq 55481:56941, ack 371, win 490, length 1460
16:38:03.023519 IP 72.249.192.51.http > 172.20.38.238.57696: Flags [.], seq 56941:58401, ack 371, win 490, length 1460
16:38:03.023602 IP 172.20.38.238.57696 > 72.249.192.51.http: Flags [.], ack 58401, win 256, length 0
16:38:03.024403 IP 72.249.192.51.http > 172.20.38.238.57696: Flags [P.], seq 58401:58643, ack 371, win 490, length 242
16:38:03.075631 IP 172.20.38.238.57696 > 72.249.192.51.http: Flags [.], ack 58643, win 255, length 0
16:38:03.120867 IP resolver2.opendns.com.domain > 172.20.38.238.49543: 27692 9/0/0 CNAME d1aex7d1pgk6o2.cloudfront.net., A 54.230.100.174, A 54.230.101.109, A 54.230.100.9, A 54.192.100.173, A 216.137.33.108, A 216.137.33.215, A 54.230.100.143, A 54.230.103.191 (208)
16:38:03.122519 IP 172.20.38.238.57698 > server-54-230-100-174.iad2.r.cloudfront.net.http: Flags [S], seq 3190131583, win 8192, options [mss 1460,nop,wscale 8,nop,nop,sackOK], length 0
16:38:03.140756 IP resolver2.opendns.com.domain > 172.20.38.238.54360: 42403 4/0/0 CNAME rack.mshcdn.com.edgesuite.net., CNAME a756.g.akamai.net., A 192.5.110.40, A 192.5.110.39 (138)
16:38:03.141366 IP resolver2.opendns.com.domain > 172.20.38.238.62333: 8621 4/0/0 CNAME rack.mshcdn.com.edgesuite.net., CNAME a756.g.akamai.net., A 192.5.110.39, A 192.5.110.40 (138)
16:38:03.142630 IP 172.20.38.238.57699 > a192-5-110-39.deploy.akamaitechnologies.com.http: Flags [S], seq 2134995766, win 8192, options [mss 1460,nop,wscale 8,nop,nop,sackOK], length 0
16:38:03.143178 IP 172.20.38.238.57700 > a192-5-110-39.deploy.akamaitechnologies.com.http: Flags [S], seq 690054935, win 8192, options [mss 1460,nop,wscale 8,nop,nop,sackOK], length 0
16:38:03.143570 IP 172.20.38.238.57701 > a192-5-110-40.deploy.akamaitechnologies.com.http: Flags [S], seq 1593703239, win 8192, options [mss 1460,nop,wscale 8,nop,nop,sackOK], length 0
16:38:03.143853 IP 172.20.38.238.57702 > a192-5-110-40.deploy.akamaitechnologies.com.http: Flags [S], seq 2165491352, win 8192, options [mss 1460,nop,wscale 8,nop,nop,sackOK], length 0
16:38:03.144412 IP resolver2.opendns.com.domain > 172.20.38.238.64204: 12002 3/0/0 CNAME san.outbrain.com.edgekey.net., CNAME e6565.b.akamaiedge.net., A 23.197.164.136 (129)
16:38:03.145952 IP 172.20.38.238.57703 > a23-197-164-136.deploy.static.akamaitechnologies.com.http: Flags [S], seq 1554325209, win 8192, options [mss 1460,nop,wscale 8,nop,nop,sackOK], length 0
16:38:03.200482 IP 172.20.38.238.57704 > a192-5-110-39.deploy.akamaitechnologies.com.http: Flags [S], seq 2646854998, win 8192, options [mss 1460,nop,wscale 8,nop,nop,sackOK], length 0
16:38:03.200972 IP 172.20.38.238.57705 > a192-5-110-40.deploy.akamaitechnologies.com.http: Flags [S], seq 3338794511, win 8192, options [mss 1460,nop,wscale 8,nop,nop,sackOK], length 0
16:38:03.204197 IP 172.20.38.238.57706 > a23-197-164-136.deploy.static.akamaitechnologies.com.http: Flags [S], seq 1944667041, win 8192, options [mss 1460,nop,wscale 8,nop,nop,sackOK], length 0
16:38:03.204807 IP 172.20.38.238.57707 > server-54-230-100-174.iad2.r.cloudfront.net.http: Flags [S], seq 769615023, win 8192, options [mss 1460,nop,wscale 8,nop,nop,sackOK], length 0
16:38:03.249512 IP 72.249.192.51.http > 172.20.38.238.57696: Flags [P.], seq 58401:58643, ack 371, win 490, length 242
16:38:03.249583 IP 172.20.38.238.57696 > 72.249.192.51.http: Flags [.], ack 58643, win 255, options [nop,nop,sack 1 {58401:58643}], length 0
16:38:03.294042 IP a192-5-110-40.deploy.akamaitechnologies.com.http > 172.20.38.238.57701: Flags [S.], seq 2041419892, ack 1593703240, win 14600, options [mss 1460,nop,nop,sackOK,nop,wscale 5], length 0
16:38:03.294208 IP 172.20.38.238.57701 > a192-5-110-40.deploy.akamaitechnologies.com.http: Flags [.], ack 1, win 256, length 0
16:38:03.294565 IP a192-5-110-40.deploy.akamaitechnologies.com.http > 172.20.38.238.57702: Flags [S.], seq 2793959112, ack 2165491353, win 14600, options [mss 1460,nop,nop,sackOK,nop,wscale 5], length 0
16:38:03.294716 IP 172.20.38.238.57702 > a192-5-110-40.deploy.akamaitechnologies.com.http: Flags [.], ack 1, win 256, length 0
16:38:03.294718 IP 172.20.38.238.57701 > a192-5-110-40.deploy.akamaitechnologies.com.http: Flags [P.], seq 1:370, ack 1, win 256, length 369
16:38:03.295055 IP 172.20.38.238.57702 > a192-5-110-40.deploy.akamaitechnologies.com.http: Flags [P.], seq 1:352, ack 1, win 256, length 351
16:38:03.295684 IP server-54-230-100-174.iad2.r.cloudfront.net.http > 172.20.38.238.57698: Flags [S.], seq 1123055021, ack 3190131584, win 14600, options [mss 1460,nop,nop,sackOK,nop,wscale 8], length 0
16:38:03.295764 IP 172.20.38.238.57698 > server-54-230-100-174.iad2.r.cloudfront.net.http: Flags [.], ack 1, win 256, length 0
16:38:03.296120 IP 172.20.38.238.57698 > server-54-230-100-174.iad2.r.cloudfront.net.http: Flags [P.], seq 1:323, ack 1, win 256, length 322
16:38:03.309953 IP a192-5-110-39.deploy.akamaitechnologies.com.http > 172.20.38.238.57699: Flags [S.], seq 889310648, ack 2134995767, win 14600, options [mss 1460,nop,nop,sackOK,nop,wscale 5], length 0
16:38:03.310107 IP 172.20.38.238.57699 > a192-5-110-39.deploy.akamaitechnologies.com.http: Flags [.], ack 1, win 256, length 0
16:38:03.310955 IP a192-5-110-39.deploy.akamaitechnologies.com.http > 172.20.38.238.57700: Flags [S.], seq 486161889, ack 690054936, win 14600, options [mss 1460,nop,nop,sackOK,nop,wscale 5], length 0
16:38:03.310955 IP 172.20.38.238.57699 > a192-5-110-39.deploy.akamaitechnologies.com.http: Flags [P.], seq 1:368, ack 1, win 256, length 367
16:38:03.311086 IP 172.20.38.238.57700 > a192-5-110-39.deploy.akamaitechnologies.com.http: Flags [.], ack 1, win 256, length 0
16:38:03.311514 IP 172.20.38.238.57700 > a192-5-110-39.deploy.akamaitechnologies.com.http: Flags [P.], seq 1:362, ack 1, win 256, length 361
16:38:03.326672 IP a23-197-164-136.deploy.static.akamaitechnologies.com.http > 172.20.38.238.57703: Flags [S.], seq 1218139794, ack 1554325210, win 28480, options [mss 1424,nop,nop,sackOK,nop,wscale 5], length 0
16:38:03.326841 IP 172.20.38.238.57703 > a23-197-164-136.deploy.static.akamaitechnologies.com.http: Flags [.], ack 1, win 261, length 0
16:38:03.327407 IP 172.20.38.238.57703 > a23-197-164-136.deploy.static.akamaitechnologies.com.http: Flags [P.], seq 1:320, ack 1, win 261, length 319
16:38:03.345573 IP a192-5-110-40.deploy.akamaitechnologies.com.http > 172.20.38.238.57705: Flags [S.], seq 1561744203, ack 3338794512, win 14600, options [mss 1460,nop,nop,sackOK,nop,wscale 5], length 0
16:38:03.345732 IP 172.20.38.238.57705 > a192-5-110-40.deploy.akamaitechnologies.com.http: Flags [.], ack 1, win 256, length 0
16:38:03.366777 IP a192-5-110-39.deploy.akamaitechnologies.com.http > 172.20.38.238.57704: Flags [S.], seq 2283232337, ack 2646854999, win 14600, options [mss 1460,nop,nop,sackOK,nop,wscale 5], length 0
16:38:03.366931 IP 172.20.38.238.57704 > a192-5-110-39.deploy.akamaitechnologies.com.http: Flags [.], ack 1, win 256, length 0
16:38:03.381994 IP server-54-230-100-174.iad2.r.cloudfront.net.http > 172.20.38.238.57707: Flags [S.], seq 1152893183, ack 769615024, win 14600, options [mss 1460,nop,nop,sackOK,nop,wscale 8], length 0
16:38:03.382147 IP 172.20.38.238.57707 > server-54-230-100-174.iad2.r.cloudfront.net.http: Flags [.], ack 1, win 256, length 0
16:38:03.390129 IP a23-197-164-136.deploy.static.akamaitechnologies.com.http > 172.20.38.238.57706: Flags [S.], seq 1215983921, ack 1944667042, win 28480, options [mss 1424,nop,nop,sackOK,nop,wscale 5], length 0
16:38:03.390312 IP 172.20.38.238.57706 > a23-197-164-136.deploy.static.akamaitechnologies.com.http: Flags [.], ack 1, win 261, length 0
16:38:03.446400 IP a192-5-110-40.deploy.akamaitechnologies.com.http > 172.20.38.238.57701: Flags [.], ack 370, win 490, length 0
16:38:03.447234 IP a192-5-110-40.deploy.akamaitechnologies.com.http > 172.20.38.238.57702: Flags [.], ack 352, win 490, length 0
16:38:03.447236 IP a192-5-110-40.deploy.akamaitechnologies.com.http > 172.20.38.238.57701: Flags [.], seq 1:1461, ack 370, win 490, length 1460
16:38:03.449753 IP a192-5-110-40.deploy.akamaitechnologies.com.http > 172.20.38.238.57701: Flags [.], seq 1461:2921, ack 370, win 490, length 1460
16:38:03.449756 IP a192-5-110-40.deploy.akamaitechnologies.com.http > 172.20.38.238.57701: Flags [.], seq 2921:4381, ack 370, win 490, length 1460
16:38:03.449758 IP a192-5-110-40.deploy.akamaitechnologies.com.http > 172.20.38.238.57701: Flags [.], seq 4381:5841, ack 370, win 490, length 1460
16:38:03.449766 IP a192-5-110-40.deploy.akamaitechnologies.com.http > 172.20.38.238.57701: Flags [.], seq 5841:7301, ack 370, win 490, length 1460
16:38:03.449768 IP a192-5-110-40.deploy.akamaitechnologies.com.http > 172.20.38.238.57701: Flags [.], seq 7301:8761, ack 370, win 490, length 1460
16:38:03.449770 IP a192-5-110-40.deploy.akamaitechnologies.com.http > 172.20.38.238.57701: Flags [.], seq 8761:10221, ack 370, win 490, length 1460
16:38:03.449772 IP a192-5-110-40.deploy.akamaitechnologies.com.http > 172.20.38.238.57701: Flags [.], seq 10221:11681, ack 370, win 490, length 1460
16:38:03.449774 IP a192-5-110-40.deploy.akamaitechnologies.com.http > 172.20.38.238.57701: Flags [.], seq 11681:13141, ack 370, win 490, length 1460
16:38:03.449776 IP a192-5-110-40.deploy.akamaitechnologies.com.http > 172.20.38.238.57701: Flags [.], seq 13141:14601, ack 370, win 490, length 1460
16:38:03.449777 IP a192-5-110-40.deploy.akamaitechnologies.com.http > 172.20.38.238.57701: Flags [.], seq 14601:16061, ack 370, win 490, length 1460
16:38:03.449779 IP a192-5-110-40.deploy.akamaitechnologies.com.http > 172.20.38.238.57701: Flags [.], seq 16061:17521, ack 370, win 490, length 1460
16:38:03.450052 IP 172.20.38.238.57701 > a192-5-110-40.deploy.akamaitechnologies.com.http: Flags [.], ack 17521, win 256, length 0
16:38:03.450395 IP a192-5-110-40.deploy.akamaitechnologies.com.http > 172.20.38.238.57701: Flags [.], seq 17521:18981, ack 370, win 490, length 1460
16:38:03.455962 IP a192-5-110-40.deploy.akamaitechnologies.com.http > 172.20.38.238.57701: Flags [.], seq 18981:20441, ack 370, win 490, length 1460
16:38:03.455965 IP a192-5-110-40.deploy.akamaitechnologies.com.http > 172.20.38.238.57701: Flags [P.], seq 20441:21155, ack 370, win 490, length 714
16:38:03.455967 IP a192-5-110-40.deploy.akamaitechnologies.com.http > 172.20.38.238.57702: Flags [.], seq 1:1461, ack 352, win 490, length 1460
16:38:03.455969 IP a192-5-110-40.deploy.akamaitechnologies.com.http > 172.20.38.238.57702: Flags [.], seq 1461:2921, ack 352, win 490, length 1460
16:38:03.455976 IP a192-5-110-40.deploy.akamaitechnologies.com.http > 172.20.38.238.57702: Flags [.], seq 2921:4381, ack 352, win 490, length 1460
16:38:03.455978 IP a192-5-110-40.deploy.akamaitechnologies.com.http > 172.20.38.238.57702: Flags [.], seq 4381:5841, ack 352, win 490, length 1460
16:38:03.455979 IP a192-5-110-40.deploy.akamaitechnologies.com.http > 172.20.38.238.57702: Flags [.], seq 5841:7301, ack 352, win 490, length 1460
16:38:03.455981 IP a192-5-110-40.deploy.akamaitechnologies.com.http > 172.20.38.238.57702: Flags [.], seq 7301:8761, ack 352, win 490, length 1460
16:38:03.455983 IP a192-5-110-40.deploy.akamaitechnologies.com.http > 172.20.38.238.57702: Flags [.], seq 8761:10221, ack 352, win 490, length 1460
16:38:03.455984 IP a192-5-110-40.deploy.akamaitechnologies.com.http > 172.20.38.238.57702: Flags [.], seq 10221:11681, ack 352, win 490, length 1460
16:38:03.455987 IP a192-5-110-40.deploy.akamaitechnologies.com.http > 172.20.38.238.57702: Flags [.], seq 11681:13141, ack 352, win 490, length 1460
16:38:03.455988 IP a192-5-110-40.deploy.akamaitechnologies.com.http > 172.20.38.238.57702: Flags [.], seq 13141:14601, ack 352, win 490, length 1460
16:38:03.455990 IP a192-5-110-40.deploy.akamaitechnologies.com.http > 172.20.38.238.57702: Flags [.], seq 14601:16061, ack 352, win 490, length 1460
16:38:03.455992 IP a192-5-110-40.deploy.akamaitechnologies.com.http > 172.20.38.238.57702: Flags [.], seq 16061:17521, ack 352, win 490, length 1460
16:38:03.455997 IP a192-5-110-40.deploy.akamaitechnologies.com.http > 172.20.38.238.57702: Flags [.], seq 17521:18981, ack 352, win 490, length 1460
16:38:03.455999 IP a192-5-110-40.deploy.akamaitechnologies.com.http > 172.20.38.238.57702: Flags [.], seq 18981:20441, ack 352, win 490, length 1460
16:38:03.456000 IP a192-5-110-40.deploy.akamaitechnologies.com.http > 172.20.38.238.57702: Flags [.], seq 20441:21901, ack 352, win 490, length 1460
16:38:03.456204 IP 172.20.38.238.57701 > a192-5-110-40.deploy.akamaitechnologies.com.http: Flags [.], ack 21155, win 256, length 0
16:38:03.456329 IP 172.20.38.238.57702 > a192-5-110-40.deploy.akamaitechnologies.com.http: Flags [.], ack 21901, win 256, length 0
16:38:03.456573 IP a192-5-110-40.deploy.akamaitechnologies.com.http > 172.20.38.238.57702: Flags [.], seq 21901:23361, ack 352, win 490, length 1460
16:38:03.456610 IP 172.20.38.238.57702 > a192-5-110-40.deploy.akamaitechnologies.com.http: Flags [.], ack 23361, win 256, length 0
16:38:03.465114 IP server-54-230-100-174.iad2.r.cloudfront.net.http > 172.20.38.238.57698: Flags [.], ack 323, win 62, length 0
16:38:03.466638 IP server-54-230-100-174.iad2.r.cloudfront.net.http > 172.20.38.238.57698: Flags [.], seq 1:1461, ack 323, win 62, length 1460
16:38:03.467804 IP server-54-230-100-174.iad2.r.cloudfront.net.http > 172.20.38.238.57698: Flags [.], seq 1461:2921, ack 323, win 62, length 1460
16:38:03.467807 IP server-54-230-100-174.iad2.r.cloudfront.net.http > 172.20.38.238.57698: Flags [.], seq 2921:4381, ack 323, win 62, length 1460
16:38:03.467810 IP server-54-230-100-174.iad2.r.cloudfront.net.http > 172.20.38.238.57698: Flags [.], seq 4381:5841, ack 323, win 62, length 1460
16:38:03.467935 IP 172.20.38.238.57698 > server-54-230-100-174.iad2.r.cloudfront.net.http: Flags [.], ack 5841, win 256, length 0
16:38:03.469476 IP server-54-230-100-174.iad2.r.cloudfront.net.http > 172.20.38.238.57698: Flags [.], seq 5841:7301, ack 323, win 62, length 1460
16:38:03.469479 IP server-54-230-100-174.iad2.r.cloudfront.net.http > 172.20.38.238.57698: Flags [.], seq 7301:8761, ack 323, win 62, length 1460
16:38:03.469481 IP server-54-230-100-174.iad2.r.cloudfront.net.http > 172.20.38.238.57698: Flags [.], seq 8761:10221, ack 323, win 62, length 1460
16:38:03.469487 IP server-54-230-100-174.iad2.r.cloudfront.net.http > 172.20.38.238.57698: Flags [.], seq 10221:11681, ack 323, win 62, length 1460
16:38:03.469489 IP server-54-230-100-174.iad2.r.cloudfront.net.http > 172.20.38.238.57698: Flags [.], seq 11681:13141, ack 323, win 62, length 1460
16:38:03.469490 IP server-54-230-100-174.iad2.r.cloudfront.net.http > 172.20.38.238.57698: Flags [.], seq 13141:14601, ack 323, win 62, length 1460
16:38:03.469615 IP 172.20.38.238.57698 > server-54-230-100-174.iad2.r.cloudfront.net.http: Flags [.], ack 14601, win 256, length 0
16:38:03.471804 IP a192-5-110-39.deploy.akamaitechnologies.com.http > 172.20.38.238.57699: Flags [.], ack 368, win 490, length 0
16:38:03.472585 IP a192-5-110-39.deploy.akamaitechnologies.com.http > 172.20.38.238.57700: Flags [.], ack 362, win 490, length 0
16:38:03.473990 IP a192-5-110-39.deploy.akamaitechnologies.com.http > 172.20.38.238.57699: Flags [.], seq 1:1461, ack 368, win 490, length 1460
16:38:03.473993 IP a192-5-110-39.deploy.akamaitechnologies.com.http > 172.20.38.238.57699: Flags [.], seq 1461:2921, ack 368, win 490, length 1460
16:38:03.473995 IP a192-5-110-39.deploy.akamaitechnologies.com.http > 172.20.38.238.57699: Flags [.], seq 2921:4381, ack 368, win 490, length 1460
16:38:03.474011 IP a192-5-110-39.deploy.akamaitechnologies.com.http > 172.20.38.238.57699: Flags [.], seq 4381:5841, ack 368, win 490, length 1460
16:38:03.474102 IP 172.20.38.238.57699 > a192-5-110-39.deploy.akamaitechnologies.com.http: Flags [.], ack 5841, win 256, length 0
16:38:03.487737 IP a192-5-110-39.deploy.akamaitechnologies.com.http > 172.20.38.238.57699: Flags [.], seq 5841:7301, ack 368, win 490, length 1460
16:38:03.487740 IP a192-5-110-39.deploy.akamaitechnologies.com.http > 172.20.38.238.57699: Flags [.], seq 7301:8761, ack 368, win 490, length 1460
16:38:03.487742 IP a192-5-110-39.deploy.akamaitechnologies.com.http > 172.20.38.238.57699: Flags [.], seq 8761:10221, ack 368, win 490, length 1460
16:38:03.487748 IP a192-5-110-39.deploy.akamaitechnologies.com.http > 172.20.38.238.57699: Flags [.], seq 10221:11681, ack 368, win 490, length 1460
16:38:03.487750 IP a192-5-110-39.deploy.akamaitechnologies.com.http > 172.20.38.238.57699: Flags [.], seq 11681:13141, ack 368, win 490, length 1460
16:38:03.487752 IP a192-5-110-39.deploy.akamaitechnologies.com.http > 172.20.38.238.57699: Flags [.], seq 13141:14601, ack 368, win 490, length 1460
16:38:03.487892 IP 172.20.38.238.57699 > a192-5-110-39.deploy.akamaitechnologies.com.http: Flags [.], ack 14601, win 256, length 0
16:38:03.489176 IP a192-5-110-39.deploy.akamaitechnologies.com.http > 172.20.38.238.57699: Flags [.], seq 14601:16061, ack 368, win 490, length 1460
16:38:03.489179 IP a192-5-110-39.deploy.akamaitechnologies.com.http > 172.20.38.238.57699: Flags [.], seq 16061:17521, ack 368, win 490, length 1460
16:38:03.489181 IP a192-5-110-39.deploy.akamaitechnologies.com.http > 172.20.38.238.57699: Flags [.], seq 17521:18981, ack 368, win 490, length 1460
16:38:03.489186 IP a192-5-110-39.deploy.akamaitechnologies.com.http > 172.20.38.238.57699: Flags [.], seq 18981:20441, ack 368, win 490, length 1460
16:38:03.489188 IP a192-5-110-39.deploy.akamaitechnologies.com.http > 172.20.38.238.57699: Flags [.], seq 20441:21901, ack 368, win 490, length 1460
16:38:03.489190 IP a192-5-110-39.deploy.akamaitechnologies.com.http > 172.20.38.238.57699: Flags [.], seq 21901:23361, ack 368, win 490, length 1460
16:38:03.489192 IP a192-5-110-39.deploy.akamaitechnologies.com.http > 172.20.38.238.57700: Flags [P.], seq 1:455, ack 362, win 490, length 454
16:38:03.489273 IP 172.20.38.238.57699 > a192-5-110-39.deploy.akamaitechnologies.com.http: Flags [.], ack 23361, win 256, length 0
16:38:03.510281 IP a23-197-164-136.deploy.static.akamaitechnologies.com.http > 172.20.38.238.57703: Flags [.], ack 320, win 924, length 0
16:38:03.516274 IP a23-197-164-136.deploy.static.akamaitechnologies.com.http > 172.20.38.238.57703: Flags [.], seq 1:1461, ack 320, win 924, length 1460
16:38:03.518911 IP a23-197-164-136.deploy.static.akamaitechnologies.com.http > 172.20.38.238.57703: Flags [.], seq 1461:2921, ack 320, win 924, length 1460
16:38:03.518914 IP a23-197-164-136.deploy.static.akamaitechnologies.com.http > 172.20.38.238.57703: Flags [.], seq 2921:4381, ack 320, win 924, length 1460
16:38:03.518915 IP a23-197-164-136.deploy.static.akamaitechnologies.com.http > 172.20.38.238.57703: Flags [.], seq 4381:5841, ack 320, win 924, length 1460
16:38:03.518925 IP a23-197-164-136.deploy.static.akamaitechnologies.com.http > 172.20.38.238.57703: Flags [.], seq 5841:7301, ack 320, win 924, length 1460
16:38:03.518927 IP a23-197-164-136.deploy.static.akamaitechnologies.com.http > 172.20.38.238.57703: Flags [.], seq 7301:8761, ack 320, win 924, length 1460
16:38:03.518930 IP a23-197-164-136.deploy.static.akamaitechnologies.com.http > 172.20.38.238.57703: Flags [.], seq 8761:10221, ack 320, win 924, length 1460
16:38:03.518932 IP a23-197-164-136.deploy.static.akamaitechnologies.com.http > 172.20.38.238.57703: Flags [.], seq 10221:11681, ack 320, win 924, length 1460
16:38:03.518936 IP a23-197-164-136.deploy.static.akamaitechnologies.com.http > 172.20.38.238.57703: Flags [.], seq 11681:13141, ack 320, win 924, length 1460
16:38:03.518938 IP a23-197-164-136.deploy.static.akamaitechnologies.com.http > 172.20.38.238.57703: Flags [.], seq 13141:14601, ack 320, win 924, length 1460
16:38:03.518940 IP a23-197-164-136.deploy.static.akamaitechnologies.com.http > 172.20.38.238.57703: Flags [.], seq 14601:16061, ack 320, win 924, length 1460
16:38:03.518942 IP a23-197-164-136.deploy.static.akamaitechnologies.com.http > 172.20.38.238.57703: Flags [P.], seq 16061:17136, ack 320, win 924, length 1075
16:38:03.519121 IP 172.20.38.238.57703 > a23-197-164-136.deploy.static.akamaitechnologies.com.http: Flags [.], ack 17136, win 261, length 0
16:38:03.539784 IP 172.20.38.238.57700 > a192-5-110-39.deploy.akamaitechnologies.com.http: Flags [.], ack 455, win 254, length 0
16:38:03.621297 IP a192-5-110-40.deploy.akamaitechnologies.com.http > 172.20.38.238.57702: Flags [.], seq 23361:24821, ack 352, win 490, length 1460
16:38:03.621300 IP a192-5-110-40.deploy.akamaitechnologies.com.http > 172.20.38.238.57702: Flags [.], seq 24821:26281, ack 352, win 490, length 1460
16:38:03.621413 IP 172.20.38.238.57702 > a192-5-110-40.deploy.akamaitechnologies.com.http: Flags [.], ack 26281, win 256, length 0
16:38:03.624062 IP a192-5-110-40.deploy.akamaitechnologies.com.http > 172.20.38.238.57702: Flags [.], seq 26281:27741, ack 352, win 490, length 1460
16:38:03.624065 IP a192-5-110-40.deploy.akamaitechnologies.com.http > 172.20.38.238.57702: Flags [.], seq 27741:29201, ack 352, win 490, length 1460
16:38:03.624067 IP a192-5-110-40.deploy.akamaitechnologies.com.http > 172.20.38.238.57702: Flags [.], seq 29201:30661, ack 352, win 490, length 1460
16:38:03.624074 IP a192-5-110-40.deploy.akamaitechnologies.com.http > 172.20.38.238.57702: Flags [.], seq 30661:32121, ack 352, win 490, length 1460
16:38:03.624077 IP a192-5-110-40.deploy.akamaitechnologies.com.http > 172.20.38.238.57702: Flags [P.], seq 32121:33581, ack 352, win 490, length 1460
16:38:03.624080 IP a192-5-110-40.deploy.akamaitechnologies.com.http > 172.20.38.238.57702: Flags [.], seq 33581:35041, ack 352, win 490, length 1460
16:38:03.624082 IP a192-5-110-40.deploy.akamaitechnologies.com.http > 172.20.38.238.57702: Flags [.], seq 35041:36501, ack 352, win 490, length 1460
16:38:03.624084 IP a192-5-110-40.deploy.akamaitechnologies.com.http > 172.20.38.238.57702: Flags [.], seq 36501:37961, ack 352, win 490, length 1460
16:38:03.624086 IP a192-5-110-40.deploy.akamaitechnologies.com.http > 172.20.38.238.57702: Flags [.], seq 37961:39421, ack 352, win 490, length 1460
16:38:03.624089 IP a192-5-110-40.deploy.akamaitechnologies.com.http > 172.20.38.238.57702: Flags [.], seq 39421:40881, ack 352, win 490, length 1460
16:38:03.624091 IP a192-5-110-40.deploy.akamaitechnologies.com.http > 172.20.38.238.57702: Flags [.], seq 40881:42341, ack 352, win 490, length 1460
16:38:03.624093 IP a192-5-110-40.deploy.akamaitechnologies.com.http > 172.20.38.238.57702: Flags [.], seq 42341:43801, ack 352, win 490, length 1460
16:38:03.624258 IP 172.20.38.238.57702 > a192-5-110-40.deploy.akamaitechnologies.com.http: Flags [.], ack 43801, win 256, length 0
16:38:03.624573 IP a192-5-110-40.deploy.akamaitechnologies.com.http > 172.20.38.238.57702: Flags [.], seq 43801:45261, ack 352, win 490, length 1460
16:38:03.624576 IP a192-5-110-40.deploy.akamaitechnologies.com.http > 172.20.38.238.57702: Flags [.], seq 45261:46721, ack 352, win 490, length 1460
16:38:03.624619 IP 172.20.38.238.57702 > a192-5-110-40.deploy.akamaitechnologies.com.http: Flags [.], ack 46721, win 256, length 0
16:38:03.626325 IP a192-5-110-40.deploy.akamaitechnologies.com.http > 172.20.38.238.57702: Flags [.], seq 46721:48181, ack 352, win 490, length 1460
16:38:03.626328 IP a192-5-110-40.deploy.akamaitechnologies.com.http > 172.20.38.238.57702: Flags [.], seq 48181:49641, ack 352, win 490, length 1460
16:38:03.626330 IP a192-5-110-40.deploy.akamaitechnologies.com.http > 172.20.38.238.57702: Flags [.], seq 49641:51101, ack 352, win 490, length 1460
16:38:03.626437 IP 172.20.38.238.57702 > a192-5-110-40.deploy.akamaitechnologies.com.http: Flags [.], ack 51101, win 256, length 0
16:38:03.639968 IP a192-5-110-40.deploy.akamaitechnologies.com.http > 172.20.38.238.57702: Flags [.], seq 51101:52561, ack 352, win 490, length 1460
16:38:03.639971 IP a192-5-110-40.deploy.akamaitechnologies.com.http > 172.20.38.238.57702: Flags [.], seq 52561:54021, ack 352, win 490, length 1460
16:38:03.639973 IP a192-5-110-40.deploy.akamaitechnologies.com.http > 172.20.38.238.57702: Flags [P.], seq 54021:55481, ack 352, win 490, length 1460
16:38:03.639989 IP a192-5-110-40.deploy.akamaitechnologies.com.http > 172.20.38.238.57702: Flags [.], seq 55481:56941, ack 352, win 490, length 1460
16:38:03.639991 IP a192-5-110-40.deploy.akamaitechnologies.com.http > 172.20.38.238.57702: Flags [.], seq 56941:58401, ack 352, win 490, length 1460
16:38:03.639993 IP a192-5-110-40.deploy.akamaitechnologies.com.http > 172.20.38.238.57702: Flags [.], seq 58401:59861, ack 352, win 490, length 1460
16:38:03.639995 IP a192-5-110-40.deploy.akamaitechnologies.com.http > 172.20.38.238.57702: Flags [.], seq 59861:61321, ack 352, win 490, length 1460
16:38:03.639996 IP a192-5-110-40.deploy.akamaitechnologies.com.http > 172.20.38.238.57702: Flags [.], seq 61321:62781, ack 352, win 490, length 1460
16:38:03.639999 IP a192-5-110-40.deploy.akamaitechnologies.com.http > 172.20.38.238.57702: Flags [.], seq 62781:64241, ack 352, win 490, length 1460
16:38:03.640001 IP a192-5-110-40.deploy.akamaitechnologies.com.http > 172.20.38.238.57702: Flags [.], seq 64241:65701, ack 352, win 490, length 1460
16:38:03.640167 IP 172.20.38.238.57702 > a192-5-110-40.deploy.akamaitechnologies.com.http: Flags [.], ack 65701, win 256, length 0
16:38:03.644083 IP a192-5-110-40.deploy.akamaitechnologies.com.http > 172.20.38.238.57702: Flags [.], seq 65701:67161, ack 352, win 490, length 1460
16:38:03.644086 IP a192-5-110-40.deploy.akamaitechnologies.com.http > 172.20.38.238.57702: Flags [.], seq 67161:68621, ack 352, win 490, length 1460
16:38:03.644088 IP a192-5-110-39.deploy.akamaitechnologies.com.http > 172.20.38.238.57699: Flags [.], seq 23361:24821, ack 368, win 490, length 1460
16:38:03.644094 IP a192-5-110-39.deploy.akamaitechnologies.com.http > 172.20.38.238.57699: Flags [.], seq 24821:26281, ack 368, win 490, length 1460
16:38:03.644096 IP a192-5-110-39.deploy.akamaitechnologies.com.http > 172.20.38.238.57699: Flags [.], seq 26281:27741, ack 368, win 490, length 1460
16:38:03.644236 IP 172.20.38.238.57702 > a192-5-110-40.deploy.akamaitechnologies.com.http: Flags [.], ack 68621, win 256, length 0
16:38:03.644408 IP 172.20.38.238.57699 > a192-5-110-39.deploy.akamaitechnologies.com.http: Flags [.], ack 27741, win 256, length 0
16:38:03.645002 IP a192-5-110-39.deploy.akamaitechnologies.com.http > 172.20.38.238.57699: Flags [.], seq 27741:29201, ack 368, win 490, length 1460
16:38:03.645043 IP 172.20.38.238.57699 > a192-5-110-39.deploy.akamaitechnologies.com.http: Flags [.], ack 29201, win 256, length 0
16:38:03.651103 IP a192-5-110-39.deploy.akamaitechnologies.com.http > 172.20.38.238.57699: Flags [.], seq 29201:30661, ack 368, win 490, length 1460
16:38:03.651105 IP a192-5-110-39.deploy.akamaitechnologies.com.http > 172.20.38.238.57699: Flags [.], seq 30661:32121, ack 368, win 490, length 1460
16:38:03.651111 IP a192-5-110-39.deploy.akamaitechnologies.com.http > 172.20.38.238.57699: Flags [P.], seq 32121:33581, ack 368, win 490, length 1460
16:38:03.651113 IP a192-5-110-39.deploy.akamaitechnologies.com.http > 172.20.38.238.57699: Flags [.], seq 33581:35041, ack 368, win 490, length 1460
16:38:03.651115 IP server-54-230-100-174.iad2.r.cloudfront.net.http > 172.20.38.238.57698: Flags [.], seq 14601:16061, ack 323, win 62, length 1460
16:38:03.651116 IP server-54-230-100-174.iad2.r.cloudfront.net.http > 172.20.38.238.57698: Flags [.], seq 16061:17521, ack 323, win 62, length 1460
16:38:03.651118 IP server-54-230-100-174.iad2.r.cloudfront.net.http > 172.20.38.238.57698: Flags [.], seq 17521:18981, ack 323, win 62, length 1460
16:38:03.651120 IP server-54-230-100-174.iad2.r.cloudfront.net.http > 172.20.38.238.57698: Flags [.], seq 18981:20441, ack 323, win 62, length 1460
16:38:03.651121 IP server-54-230-100-174.iad2.r.cloudfront.net.http > 172.20.38.238.57698: Flags [.], seq 20441:21901, ack 323, win 62, length 1460
16:38:03.651123 IP server-54-230-100-174.iad2.r.cloudfront.net.http > 172.20.38.238.57698: Flags [.], seq 21901:23361, ack 323, win 62, length 1460
16:38:03.651125 IP server-54-230-100-174.iad2.r.cloudfront.net.http > 172.20.38.238.57698: Flags [.], seq 23361:24821, ack 323, win 62, length 1460
16:38:03.651126 IP server-54-230-100-174.iad2.r.cloudfront.net.http > 172.20.38.238.57698: Flags [.], seq 24821:26281, ack 323, win 62, length 1460
16:38:03.651297 IP 172.20.38.238.57699 > a192-5-110-39.deploy.akamaitechnologies.com.http: Flags [.], ack 35041, win 256, length 0
16:38:03.651423 IP 172.20.38.238.57698 > server-54-230-100-174.iad2.r.cloudfront.net.http: Flags [.], ack 26281, win 256, length 0
16:38:03.651689 IP server-54-230-100-174.iad2.r.cloudfront.net.http > 172.20.38.238.57698: Flags [.], seq 26281:27741, ack 323, win 62, length 1460
