16:42:27.432422 IP 172.20.38.238.55178 > resolver2.opendns.com.domain: 15847+ A? sh.st. (23)
16:42:27.603960 IP resolver2.opendns.com.domain > 172.20.38.238.55178: 15847 3/0/0 A 78.140.188.188, A 78.140.188.190, A 78.140.188.189 (71)
16:42:27.605193 IP 172.20.38.238.57809 > 78.140.188.188.http: Flags [S], seq 884796412, win 8192, options [mss 1460,nop,wscale 8,nop,nop,sackOK], length 0
16:42:27.682500 IP 172.20.38.238.57810 > 78.140.188.188.http: Flags [S], seq 3465037001, win 8192, options [mss 1460,nop,wscale 8,nop,nop,sackOK], length 0
16:42:27.887905 IP 78.140.188.188.http > 172.20.38.238.57809: Flags [S.], seq 3454742492, ack 884796413, win 29200, options [mss 1460,nop,nop,sackOK,nop,wscale 7], length 0
16:42:27.888084 IP 172.20.38.238.57809 > 78.140.188.188.http: Flags [.], ack 1, win 256, length 0
16:42:27.888514 IP 172.20.38.238.57809 > 78.140.188.188.http: Flags [P.], seq 1:364, ack 1, win 256, length 363
16:42:27.942501 IP 78.140.188.188.http > 172.20.38.238.57810: Flags [S.], seq 2038048535, ack 3465037002, win 29200, options [mss 1460,nop,nop,sackOK,nop,wscale 7], length 0
16:42:27.942671 IP 172.20.38.238.57810 > 78.140.188.188.http: Flags [.], ack 1, win 256, length 0
16:42:28.176044 IP 78.140.188.188.http > 172.20.38.238.57809: Flags [.], seq 1:1461, ack 364, win 237, length 1460
16:42:28.176047 IP 78.140.188.188.http > 172.20.38.238.57809: Flags [.], seq 1461:2921, ack 364, win 237, length 1460
16:42:28.176048 IP 78.140.188.188.http > 172.20.38.238.57809: Flags [.], seq 2921:4381, ack 364, win 237, length 1460
16:42:28.176053 IP 78.140.188.188.http > 172.20.38.238.57809: Flags [P.], seq 4381:4550, ack 364, win 237, length 169
16:42:28.176168 IP 172.20.38.238.57809 > 78.140.188.188.http: Flags [.], ack 4550, win 256, length 0
16:42:28.184620 IP 172.20.38.238.56977 > resolver2.opendns.com.domain: 14174+ A? shorte.st. (27)
16:42:28.355542 IP resolver2.opendns.com.domain > 172.20.38.238.56977: 14174 2/0/0 A 78.140.188.189, A 78.140.188.188 (59)
16:42:28.356938 IP 172.20.38.238.57811 > 78.140.188.189.http: Flags [S], seq 2158606777, win 8192, options [mss 1460,nop,wscale 8,nop,nop,sackOK], length 0
16:42:28.434668 IP 172.20.38.238.57812 > 78.140.188.189.http: Flags [S], seq 2012547245, win 8192, options [mss 1460,nop,wscale 8,nop,nop,sackOK], length 0
16:42:28.703604 IP 78.140.188.189.http > 172.20.38.238.57812: Flags [S.], seq 4209812177, ack 2012547246, win 29200, options [mss 1460,nop,nop,sackOK,nop,wscale 7], length 0
16:42:28.703759 IP 172.20.38.238.57812 > 78.140.188.189.http: Flags [.], ack 1, win 256, length 0
16:42:28.704177 IP 172.20.38.238.57812 > 78.140.188.189.http: Flags [P.], seq 1:368, ack 1, win 256, length 367
16:42:28.965421 IP 78.140.188.189.http > 172.20.38.238.57812: Flags [F.], seq 1:103, ack 368, win 237, length 102
16:42:28.965542 IP 172.20.38.238.57812 > 78.140.188.189.http: Flags [.], ack 104, win 256, length 0
16:42:28.967032 IP 172.20.38.238.57812 > 78.140.188.189.http: Flags [F.], seq 368, ack 104, win 256, length 0
16:42:28.968501 IP 172.20.38.238.57813 > 78.140.188.189.https: Flags [S], seq 1676297319, win 8192, options [mss 1460,nop,wscale 8,nop,nop,sackOK], length 0
16:42:29.209684 IP 78.140.188.189.http > 172.20.38.238.57812: Flags [.], ack 369, win 237, length 0
16:42:29.211211 IP 78.140.188.189.https > 172.20.38.238.57813: Flags [S.], seq 7658898, ack 1676297320, win 29200, options [mss 1460,nop,nop,sackOK,nop,wscale 7], length 0
16:42:29.211372 IP 172.20.38.238.57813 > 78.140.188.189.https: Flags [.], ack 1, win 256, length 0
16:42:29.211953 IP 172.20.38.238.57813 > 78.140.188.189.https: Flags [P.], seq 1:207, ack 1, win 256, length 206
16:42:29.450064 IP 78.140.188.189.https > 172.20.38.238.57813: Flags [.], seq 1:1461, ack 207, win 237, length 1460
16:42:29.450067 IP 78.140.188.189.https > 172.20.38.238.57813: Flags [.], seq 1461:2921, ack 207, win 237, length 1460
16:42:29.450069 IP 78.140.188.189.https > 172.20.38.238.57813: Flags [P.], seq 2921:3890, ack 207, win 237, length 969
16:42:29.450194 IP 172.20.38.238.57813 > 78.140.188.189.https: Flags [.], ack 3890, win 256, length 0
16:42:29.456792 IP 172.20.38.238.57813 > 78.140.188.189.https: Flags [P.], seq 207:357, ack 3890, win 256, length 150
16:42:29.729106 IP 78.140.188.189.https > 172.20.38.238.57813: Flags [P.], seq 3890:4156, ack 357, win 245, length 266
16:42:29.744190 IP 172.20.38.238.57813 > 78.140.188.189.https: Flags [P.], seq 357:778, ack 4156, win 255, length 421
16:42:29.902257 IP 78.140.188.189.http > 172.20.38.238.57811: Flags [S.], seq 1674246316, ack 2158606778, win 29200, options [mss 1460,nop,nop,sackOK,nop,wscale 7], length 0
16:42:29.902411 IP 172.20.38.238.57811 > 78.140.188.189.http: Flags [.], ack 1, win 256, length 0
16:42:30.037928 IP 78.140.188.189.https > 172.20.38.238.57813: Flags [.], seq 4156:5616, ack 778, win 254, length 1460
16:42:30.037930 IP 78.140.188.189.https > 172.20.38.238.57813: Flags [.], seq 5616:7076, ack 778, win 254, length 1460
16:42:30.038048 IP 172.20.38.238.57813 > 78.140.188.189.https: Flags [.], ack 7076, win 256, length 0
16:42:30.039226 IP 78.140.188.189.https > 172.20.38.238.57813: Flags [.], seq 7076:8536, ack 778, win 254, length 1460
16:42:30.039228 IP 78.140.188.189.https > 172.20.38.238.57813: Flags [.], seq 8536:9996, ack 778, win 254, length 1460
16:42:30.039230 IP 78.140.188.189.https > 172.20.38.238.57813: Flags [.], seq 9996:11456, ack 778, win 254, length 1460
16:42:30.039236 IP 78.140.188.189.https > 172.20.38.238.57813: Flags [.], seq 11456:12916, ack 778, win 254, length 1460
16:42:30.039238 IP 78.140.188.189.https > 172.20.38.238.57813: Flags [P.], seq 12916:14273, ack 778, win 254, length 1357
16:42:30.039240 IP 78.140.188.189.https > 172.20.38.238.57813: Flags [P.], seq 14273:14326, ack 778, win 254, length 53
16:42:30.039358 IP 172.20.38.238.57813 > 78.140.188.189.https: Flags [.], ack 14326, win 256, length 0
16:42:30.086547 IP 172.20.38.238.53922 > resolver2.opendns.com.domain: 29145+ A? static.shorte.st. (34)
16:42:30.255805 IP resolver2.opendns.com.domain > 172.20.38.238.53922: 29145 2/0/0 A 78.140.188.190, A 78.140.188.189 (66)
16:42:30.257182 IP 172.20.38.238.57814 > 78.140.188.190.https: Flags [S], seq 2513438286, win 8192, options [mss 1460,nop,wscale 8,nop,nop,sackOK], length 0
16:42:30.257787 IP 172.20.38.238.57815 > 78.140.188.190.https: Flags [S], seq 3921381738, win 8192, options [mss 1460,nop,wscale 8,nop,nop,sackOK], length 0
16:42:30.258214 IP 172.20.38.238.57816 > 78.140.188.190.https: Flags [S], seq 362475592, win 8192, options [mss 1460,nop,wscale 8,nop,nop,sackOK], length 0
16:42:30.338389 IP 172.20.38.238.57817 > 78.140.188.190.https: Flags [S], seq 3640277755, win 8192, options [mss 1460,nop,wscale 8,nop,nop,sackOK], length 0
16:42:30.529671 IP 78.140.188.190.https > 172.20.38.238.57814: Flags [S.], seq 4224953832, ack 2513438287, win 29200, options [mss 1460,nop,nop,sackOK,nop,wscale 7], length 0
16:42:30.529844 IP 172.20.38.238.57814 > 78.140.188.190.https: Flags [.], ack 1, win 256, length 0
16:42:30.530489 IP 172.20.38.238.57814 > 78.140.188.190.https: Flags [P.], seq 1:214, ack 1, win 256, length 213
16:42:30.530815 IP 78.140.188.190.https > 172.20.38.238.57816: Flags [S.], seq 455249714, ack 362475593, win 29200, options [mss 1460,nop,nop,sackOK,nop,wscale 7], length 0
16:42:30.530995 IP 172.20.38.238.57816 > 78.140.188.190.https: Flags [.], ack 1, win 256, length 0
16:42:30.531215 IP 172.20.38.238.57816 > 78.140.188.190.https: Flags [P.], seq 1:214, ack 1, win 256, length 213
16:42:30.605200 IP 78.140.188.190.https > 172.20.38.238.57817: Flags [S.], seq 1658887250, ack 3640277756, win 29200, options [mss 1460,nop,nop,sackOK,nop,wscale 7], length 0
16:42:30.605365 IP 172.20.38.238.57817 > 78.140.188.190.https: Flags [.], ack 1, win 256, length 0
16:42:30.606164 IP 172.20.38.238.57817 > 78.140.188.190.https: Flags [P.], seq 1:214, ack 1, win 256, length 213
16:42:30.800456 IP 78.140.188.190.https > 172.20.38.238.57814: Flags [.], seq 1:1461, ack 214, win 237, length 1460
16:42:30.800459 IP 78.140.188.190.https > 172.20.38.238.57814: Flags [.], seq 1461:2921, ack 214, win 237, length 1460
16:42:30.800461 IP 78.140.188.190.https > 172.20.38.238.57814: Flags [P.], seq 2921:3890, ack 214, win 237, length 969
16:42:30.800614 IP 172.20.38.238.57814 > 78.140.188.190.https: Flags [.], ack 3890, win 256, length 0
16:42:30.807449 IP 78.140.188.190.https > 172.20.38.238.57816: Flags [.], seq 1:1461, ack 214, win 237, length 1460
16:42:30.807452 IP 78.140.188.190.https > 172.20.38.238.57816: Flags [.], seq 1461:2921, ack 214, win 237, length 1460
16:42:30.807454 IP 78.140.188.190.https > 172.20.38.238.57816: Flags [P.], seq 2921:3890, ack 214, win 237, length 969
16:42:30.807586 IP 172.20.38.238.57816 > 78.140.188.190.https: Flags [.], ack 3890, win 256, length 0
16:42:30.808328 IP 172.20.38.238.57814 > 78.140.188.190.https: Flags [P.], seq 214:364, ack 3890, win 256, length 150
16:42:30.815473 IP 172.20.38.238.57816 > 78.140.188.190.https: Flags [P.], seq 214:364, ack 3890, win 256, length 150
16:42:30.867424 IP 78.140.188.190.https > 172.20.38.238.57817: Flags [.], seq 1:1461, ack 214, win 237, length 1460
16:42:30.867427 IP 78.140.188.190.https > 172.20.38.238.57817: Flags [.], seq 1461:2921, ack 214, win 237, length 1460
16:42:30.867429 IP 78.140.188.190.https > 172.20.38.238.57817: Flags [P.], seq 2921:3890, ack 214, win 237, length 969
16:42:30.867563 IP 172.20.38.238.57817 > 78.140.188.190.https: Flags [.], ack 3890, win 256, length 0
16:42:30.875332 IP 172.20.38.238.57817 > 78.140.188.190.https: Flags [P.], seq 214:364, ack 3890, win 256, length 150
16:42:30.971168 IP 172.20.38.238.netbios-dgm > 172.20.47.255.netbios-dgm: NBT UDP PACKET(138)
16:42:31.074123 IP 78.140.188.190.https > 172.20.38.238.57814: Flags [P.], seq 3890:4156, ack 364, win 245, length 266
16:42:31.087996 IP 172.20.38.238.57814 > 78.140.188.190.https: Flags [P.], seq 364:785, ack 4156, win 255, length 421
16:42:31.141465 IP 78.140.188.190.https > 172.20.38.238.57817: Flags [P.], seq 3890:4156, ack 364, win 245, length 266
16:42:31.142829 IP 172.20.38.238.57817 > 78.140.188.190.https: Flags [P.], seq 364:769, ack 4156, win 255, length 405
16:42:31.349650 IP 78.140.188.190.https > 172.20.38.238.57814: Flags [.], seq 4156:5616, ack 785, win 254, length 1460
16:42:31.349654 IP 78.140.188.190.https > 172.20.38.238.57814: Flags [.], seq 5616:7076, ack 785, win 254, length 1460
16:42:31.349655 IP 78.140.188.190.https > 172.20.38.238.57814: Flags [P.], seq 7076:7089, ack 785, win 254, length 13
16:42:31.349778 IP 172.20.38.238.57814 > 78.140.188.190.https: Flags [.], ack 7089, win 256, length 0
16:42:31.351346 IP 78.140.188.190.https > 172.20.38.238.57814: Flags [.], seq 7089:8549, ack 785, win 254, length 1460
16:42:31.351349 IP 78.140.188.190.https > 172.20.38.238.57814: Flags [.], seq 8549:10009, ack 785, win 254, length 1460
16:42:31.351351 IP 78.140.188.190.https > 172.20.38.238.57814: Flags [.], seq 10009:11469, ack 785, win 254, length 1460
16:42:31.351360 IP 78.140.188.190.https > 172.20.38.238.57814: Flags [.], seq 11469:12929, ack 785, win 254, length 1460
16:42:31.351362 IP 78.140.188.190.https > 172.20.38.238.57814: Flags [.], seq 12929:14389, ack 785, win 254, length 1460
16:42:31.351364 IP 78.140.188.190.https > 172.20.38.238.57814: Flags [P.], seq 14389:15830, ack 785, win 254, length 1441
16:42:31.351483 IP 172.20.38.238.57814 > 78.140.188.190.https: Flags [.], ack 15830, win 256, length 0
16:42:31.352173 IP 78.140.188.190.https > 172.20.38.238.57814: Flags [.], seq 15830:17290, ack 785, win 254, length 1460
16:42:31.352250 IP 172.20.38.238.57814 > 78.140.188.190.https: Flags [.], ack 17290, win 256, length 0
16:42:31.407617 IP 78.140.188.190.https > 172.20.38.238.57817: Flags [.], seq 4156:5616, ack 769, win 254, length 1460
16:42:31.407620 IP 78.140.188.190.https > 172.20.38.238.57817: Flags [.], seq 5616:7076, ack 769, win 254, length 1460
16:42:31.407735 IP 172.20.38.238.57817 > 78.140.188.190.https: Flags [.], ack 7076, win 256, length 0
16:42:31.409096 IP 78.140.188.190.https > 172.20.38.238.57817: Flags [.], seq 7076:8536, ack 769, win 254, length 1460
16:42:31.409103 IP 78.140.188.190.https > 172.20.38.238.57817: Flags [.], seq 9985:11445, ack 769, win 254, length 1460
16:42:31.409105 IP 78.140.188.190.https > 172.20.38.238.57817: Flags [.], seq 11445:12905, ack 769, win 254, length 1460
16:42:31.409106 IP 78.140.188.190.https > 172.20.38.238.57817: Flags [.], seq 12905:14365, ack 769, win 254, length 1460
16:42:31.409108 IP 78.140.188.190.https > 172.20.38.238.57817: Flags [.], seq 14365:15825, ack 769, win 254, length 1460
16:42:31.409230 IP 172.20.38.238.57817 > 78.140.188.190.https: Flags [.], ack 8536, win 256, options [nop,nop,sack 1 {9985:11445}], length 0
16:42:31.409350 IP 172.20.38.238.57817 > 78.140.188.190.https: Flags [.], ack 8536, win 256, options [nop,nop,sack 1 {9985:12905}], length 0
16:42:31.409407 IP 172.20.38.238.57817 > 78.140.188.190.https: Flags [.], ack 8536, win 256, options [nop,nop,sack 1 {9985:14365}], length 0
16:42:31.409461 IP 172.20.38.238.57817 > 78.140.188.190.https: Flags [.], ack 8536, win 256, options [nop,nop,sack 1 {9985:15825}], length 0
16:42:31.546000 IP 172.20.38.238.57816 > 78.140.188.190.https: Flags [P.], seq 214:364, ack 3890, win 256, length 150
16:42:31.615410 IP 78.140.188.190.https > 172.20.38.238.57814: Flags [.], seq 17290:18750, ack 785, win 254, length 1460
16:42:31.615412 IP 78.140.188.190.https > 172.20.38.238.57814: Flags [P.], seq 18750:20210, ack 785, win 254, length 1460
16:42:31.615414 IP 78.140.188.190.https > 172.20.38.238.57814: Flags [.], seq 20210:21670, ack 785, win 254, length 1460
16:42:31.615423 IP 78.140.188.190.https > 172.20.38.238.57814: Flags [.], seq 21670:23130, ack 785, win 254, length 1460
16:42:31.615560 IP 172.20.38.238.57814 > 78.140.188.190.https: Flags [.], ack 23130, win 256, length 0
16:42:31.618484 IP 78.140.188.190.https > 172.20.38.238.57814: Flags [.], seq 23130:24590, ack 785, win 254, length 1460
16:42:31.618487 IP 78.140.188.190.https > 172.20.38.238.57814: Flags [.], seq 24590:26050, ack 785, win 254, length 1460
16:42:31.618489 IP 78.140.188.190.https > 172.20.38.238.57814: Flags [.], seq 26050:27510, ack 785, win 254, length 1460
16:42:31.618495 IP 78.140.188.190.https > 172.20.38.238.57814: Flags [.], seq 27510:28970, ack 785, win 254, length 1460
16:42:31.618626 IP 172.20.38.238.57814 > 78.140.188.190.https: Flags [.], ack 28970, win 256, length 0
16:42:31.619455 IP 78.140.188.190.https > 172.20.38.238.57814: Flags [.], seq 28970:30430, ack 785, win 254, length 1460
16:42:31.619457 IP 78.140.188.190.https > 172.20.38.238.57814: Flags [.], seq 30430:31890, ack 785, win 254, length 1460
16:42:31.619459 IP 78.140.188.190.https > 172.20.38.238.57814: Flags [.], seq 31890:33350, ack 785, win 254, length 1460
16:42:31.619464 IP 78.140.188.190.https > 172.20.38.238.57814: Flags [.], seq 33350:34810, ack 785, win 254, length 1460
16:42:31.619544 IP 172.20.38.238.57814 > 78.140.188.190.https: Flags [.], ack 34810, win 256, length 0
16:42:31.662372 IP 172.20.38.238.57634 > ie-in-f125.1e100.net.xmpp-client: Flags [P.], seq 1369678911:1369678937, ack 1649369269, win 251, length 26
16:42:31.674191 IP 78.140.188.190.https > 172.20.38.238.57817: Flags [.], seq 18745:20205, ack 769, win 254, length 1460
16:42:31.674194 IP 78.140.188.190.https > 172.20.38.238.57817: Flags [P.], seq 20205:21665, ack 769, win 254, length 1460
16:42:31.674299 IP 172.20.38.238.57817 > 78.140.188.190.https: Flags [.], ack 8536, win 256, options [nop,nop,sack 2 {18745:20205}{9985:15825}], length 0
16:42:31.674436 IP 172.20.38.238.57817 > 78.140.188.190.https: Flags [.], ack 8536, win 256, options [nop,nop,sack 2 {18745:21665}{9985:15825}], length 0
16:42:31.677257 IP 78.140.188.190.https > 172.20.38.238.57817: Flags [.], seq 21665:23125, ack 769, win 254, length 1460
16:42:31.677261 IP 78.140.188.190.https > 172.20.38.238.57817: Flags [.], seq 23125:24585, ack 769, win 254, length 1460
16:42:31.677263 IP 78.140.188.190.https > 172.20.38.238.57817: Flags [.], seq 24585:26045, ack 769, win 254, length 1460
16:42:31.677269 IP 78.140.188.190.https > 172.20.38.238.57817: Flags [.], seq 26045:27505, ack 769, win 254, length 1460
16:42:31.677271 IP 78.140.188.190.https > 172.20.38.238.57817: Flags [.], seq 27505:28965, ack 769, win 254, length 1460
16:42:31.677273 IP 78.140.188.190.https > 172.20.38.238.57817: Flags [P.], seq 8536:9985, ack 769, win 254, length 1449
16:42:31.677274 IP 78.140.188.190.https > 172.20.38.238.57817: Flags [.], seq 28965:30425, ack 769, win 254, length 1460
16:42:31.677380 IP 172.20.38.238.57817 > 78.140.188.190.https: Flags [.], ack 8536, win 256, options [nop,nop,sack 2 {18745:23125}{9985:15825}], length 0
16:42:31.677503 IP 172.20.38.238.57817 > 78.140.188.190.https: Flags [.], ack 8536, win 256, options [nop,nop,sack 2 {18745:24585}{9985:15825}], length 0
16:42:31.677560 IP 172.20.38.238.57817 > 78.140.188.190.https: Flags [.], ack 8536, win 256, options [nop,nop,sack 2 {18745:26045}{9985:15825}], length 0
16:42:31.677619 IP 172.20.38.238.57817 > 78.140.188.190.https: Flags [.], ack 8536, win 256, options [nop,nop,sack 2 {18745:27505}{9985:15825}], length 0
16:42:31.677676 IP 172.20.38.238.57817 > 78.140.188.190.https: Flags [.], ack 8536, win 256, options [nop,nop,sack 2 {18745:28965}{9985:15825}], length 0
16:42:31.677774 IP 172.20.38.238.57817 > 78.140.188.190.https: Flags [.], ack 15825, win 256, options [nop,nop,sack 1 {18745:28965}], length 0
16:42:31.677833 IP 172.20.38.238.57817 > 78.140.188.190.https: Flags [.], ack 15825, win 256, options [nop,nop,sack 1 {18745:30425}], length 0
16:42:31.678062 IP 78.140.188.190.https > 172.20.38.238.57816: Flags [P.], seq 3890:4156, ack 364, win 245, length 266
16:42:31.680181 IP 172.20.38.238.57816 > 78.140.188.190.https: Flags [P.], seq 364:817, ack 4156, win 255, length 453
16:42:31.812962 IP 78.140.188.190.https > 172.20.38.238.57816: Flags [.], ack 364, win 245, options [nop,nop,sack 1 {214:364}], length 0
16:42:31.826357 IP ie-in-f125.1e100.net.xmpp-client > 172.20.38.238.57634: Flags [.], ack 26, win 403, length 0
16:42:31.886472 IP 78.140.188.190.https > 172.20.38.238.57814: Flags [.], seq 34810:36270, ack 785, win 254, length 1460
16:42:31.886475 IP 78.140.188.190.https > 172.20.38.238.57814: Flags [.], seq 36270:37730, ack 785, win 254, length 1460
16:42:31.886477 IP 78.140.188.190.https > 172.20.38.238.57814: Flags [.], seq 37730:39190, ack 785, win 254, length 1460
16:42:31.886486 IP 78.140.188.190.https > 172.20.38.238.57814: Flags [.], seq 39190:40650, ack 785, win 254, length 1460
16:42:31.886488 IP 78.140.188.190.https > 172.20.38.238.57814: Flags [.], seq 40650:42110, ack 785, win 254, length 1460
16:42:31.886490 IP 78.140.188.190.https > 172.20.38.238.57814: Flags [.], seq 42110:43570, ack 785, win 254, length 1460
16:42:31.886616 IP 172.20.38.238.57814 > 78.140.188.190.https: Flags [.], ack 43570, win 256, length 0
16:42:31.888492 IP 78.140.188.190.https > 172.20.38.238.57814: Flags [.], seq 43570:45030, ack 785, win 254, length 1460
16:42:31.890890 IP 78.140.188.190.https > 172.20.38.238.57814: Flags [P.], seq 45030:46490, ack 785, win 254, length 1460
16:42:31.890894 IP 78.140.188.190.https > 172.20.38.238.57814: Flags [.], seq 46490:47950, ack 785, win 254, length 1460
16:42:31.890896 IP 78.140.188.190.https > 172.20.38.238.57814: Flags [.], seq 47950:49410, ack 785, win 254, length 1460
16:42:31.890905 IP 78.140.188.190.https > 172.20.38.238.57814: Flags [.], seq 49410:50870, ack 785, win 254, length 1460
16:42:31.890906 IP 78.140.188.190.https > 172.20.38.238.57814: Flags [.], seq 50870:52330, ack 785, win 254, length 1460
16:42:31.890908 IP 78.140.188.190.https > 172.20.38.238.57814: Flags [.], seq 52330:53790, ack 785, win 254, length 1460
16:42:31.890910 IP 78.140.188.190.https > 172.20.38.238.57814: Flags [.], seq 53790:55250, ack 785, win 254, length 1460
16:42:31.890912 IP 78.140.188.190.https > 172.20.38.238.57814: Flags [.], seq 55250:56710, ack 785, win 254, length 1460
16:42:31.890913 IP 78.140.188.190.https > 172.20.38.238.57814: Flags [.], seq 56710:58170, ack 785, win 254, length 1460
16:42:31.891053 IP 172.20.38.238.57814 > 78.140.188.190.https: Flags [.], ack 58170, win 256, length 0
16:42:31.947791 IP 78.140.188.190.https > 172.20.38.238.57817: Flags [.], seq 15825:17285, ack 769, win 254, length 1460
16:42:31.947794 IP 78.140.188.190.https > 172.20.38.238.57817: Flags [.], seq 17285:18745, ack 769, win 254, length 1460
16:42:31.947795 IP 78.140.188.190.https > 172.20.38.238.57817: Flags [.], seq 30425:31885, ack 769, win 254, length 1460
16:42:31.947802 IP 78.140.188.190.https > 172.20.38.238.57817: Flags [.], seq 31885:33345, ack 769, win 254, length 1460
16:42:31.947912 IP 172.20.38.238.57817 > 78.140.188.190.https: Flags [.], ack 17285, win 256, options [nop,nop,sack 1 {18745:30425}], length 0
16:42:31.948100 IP 172.20.38.238.57817 > 78.140.188.190.https: Flags [.], ack 30425, win 256, length 0
16:42:31.948180 IP 172.20.38.238.57817 > 78.140.188.190.https: Flags [.], ack 33345, win 256, length 0
16:42:31.949602 IP 78.140.188.190.https > 172.20.38.238.57817: Flags [.], seq 33345:34805, ack 769, win 254, length 1460
16:42:31.949604 IP 78.140.188.190.https > 172.20.38.238.57817: Flags [.], seq 34805:36265, ack 769, win 254, length 1460
16:42:31.949606 IP 78.140.188.190.https > 172.20.38.238.57817: Flags [.], seq 36265:37725, ack 769, win 254, length 1460
16:42:31.949612 IP 78.140.188.190.https > 172.20.38.238.57817: Flags [.], seq 37725:39185, ack 769, win 254, length 1460
16:42:31.949615 IP 78.140.188.190.https > 172.20.38.238.57816: Flags [.], ack 817, win 254, length 0
16:42:31.949616 IP 78.140.188.190.https > 172.20.38.238.57816: Flags [.], seq 4156:5616, ack 817, win 254, length 1460
16:42:31.949618 IP 78.140.188.190.https > 172.20.38.238.57816: Flags [.], seq 5616:7076, ack 817, win 254, length 1460
16:42:31.949620 IP 78.140.188.190.https > 172.20.38.238.57816: Flags [.], seq 7076:8536, ack 817, win 254, length 1460
16:42:31.949623 IP 78.140.188.190.https > 172.20.38.238.57816: Flags [P.], seq 8536:8881, ack 817, win 254, length 345
16:42:31.949805 IP 172.20.38.238.57817 > 78.140.188.190.https: Flags [.], ack 39185, win 256, length 0
16:42:31.949944 IP 172.20.38.238.57816 > 78.140.188.190.https: Flags [.], ack 8881, win 256, length 0
16:42:31.953069 IP 172.20.38.238.57816 > 78.140.188.190.https: Flags [P.], seq 817:1270, ack 8881, win 256, length 453
16:42:32.150001 IP 78.140.188.190.https > 172.20.38.238.57814: Flags [.], seq 58170:59630, ack 785, win 254, length 1460
16:42:32.150004 IP 78.140.188.190.https > 172.20.38.238.57814: Flags [.], seq 59630:61090, ack 785, win 254, length 1460
16:42:32.150006 IP 78.140.188.190.https > 172.20.38.238.57814: Flags [.], seq 61090:62550, ack 785, win 254, length 1460
16:42:32.150021 IP 78.140.188.190.https > 172.20.38.238.57814: Flags [P.], seq 62550:64010, ack 785, win 254, length 1460
16:42:32.150023 IP 78.140.188.190.https > 172.20.38.238.57814: Flags [.], seq 64010:65470, ack 785, win 254, length 1460
16:42:32.150025 IP 78.140.188.190.https > 172.20.38.238.57814: Flags [.], seq 65470:66930, ack 785, win 254, length 1460
16:42:32.150163 IP 172.20.38.238.57814 > 78.140.188.190.https: Flags [.], ack 66930, win 256, length 0
16:42:32.152747 IP 78.140.188.190.https > 172.20.38.238.57814: Flags [.], seq 68390:69850, ack 785, win 254, length 1460
16:42:32.152749 IP 78.140.188.190.https > 172.20.38.238.57814: Flags [.], seq 69850:71310, ack 785, win 254, length 1460
16:42:32.152751 IP 78.140.188.190.https > 172.20.38.238.57814: Flags [.], seq 71310:72770, ack 785, win 254, length 1460
16:42:32.152856 IP 172.20.38.238.57814 > 78.140.188.190.https: Flags [.], ack 66930, win 256, options [nop,nop,sack 1 {68390:69850}], length 0
16:42:32.153003 IP 172.20.38.238.57814 > 78.140.188.190.https: Flags [.], ack 66930, win 256, options [nop,nop,sack 1 {68390:71310}], length 0
16:42:32.153068 IP 172.20.38.238.57814 > 78.140.188.190.https: Flags [.], ack 66930, win 256, options [nop,nop,sack 1 {68390:72770}], length 0
16:42:32.154048 IP 78.140.188.190.https > 172.20.38.238.57814: Flags [.], seq 72770:74230, ack 785, win 254, length 1460
16:42:32.154051 IP 78.140.188.190.https > 172.20.38.238.57814: Flags [.], seq 74230:75690, ack 785, win 254, length 1460
16:42:32.154053 IP 78.140.188.190.https > 172.20.38.238.57814: Flags [.], seq 75690:77150, ack 785, win 254, length 1460
16:42:32.154062 IP 78.140.188.190.https > 172.20.38.238.57814: Flags [.], seq 77150:78610, ack 785, win 254, length 1460
16:42:32.154064 IP 78.140.188.190.https > 172.20.38.238.57814: Flags [.], seq 78610:80070, ack 785, win 254, length 1460
16:42:32.154167 IP 172.20.38.238.57814 > 78.140.188.190.https: Flags [.], ack 66930, win 256, options [nop,nop,sack 1 {68390:74230}], length 0
16:42:32.154301 IP 172.20.38.238.57814 > 78.140.188.190.https: Flags [.], ack 66930, win 256, options [nop,nop,sack 1 {68390:75690}], length 0
16:42:32.154380 IP 172.20.38.238.57814 > 78.140.188.190.https: Flags [.], ack 66930, win 256, options [nop,nop,sack 1 {68390:77150}], length 0
16:42:32.154453 IP 172.20.38.238.57814 > 78.140.188.190.https: Flags [.], ack 66930, win 256, options [nop,nop,sack 1 {68390:78610}], length 0
16:42:32.154521 IP 172.20.38.238.57814 > 78.140.188.190.https: Flags [.], ack 66930, win 256, options [nop,nop,sack 1 {68390:80070}], length 0
16:42:32.154794 IP 78.140.188.190.https > 172.20.38.238.57814: Flags [.], seq 80070:81530, ack 785, win 254, length 1460
16:42:32.154796 IP 78.140.188.190.https > 172.20.38.238.57814: Flags [.], seq 81530:82990, ack 785, win 254, length 1460
16:42:32.154826 IP 172.20.38.238.57814 > 78.140.188.190.https: Flags [.], ack 66930, win 256, options [nop,nop,sack 1 {68390:81530}], length 0
16:42:32.154889 IP 172.20.38.238.57814 > 78.140.188.190.https: Flags [.], ack 66930, win 256, options [nop,nop,sack 1 {68390:82990}], length 0
16:42:32.204644 IP 78.140.188.190.https > 172.20.38.238.57817: Flags [.], seq 39185:40645, ack 769, win 254, length 1460
16:42:32.205910 IP 78.140.188.190.https > 172.20.38.238.57817: Flags [.], seq 40645:42105, ack 769, win 254, length 1460
16:42:32.206008 IP 172.20.38.238.57817 > 78.140.188.190.https: Flags [.], ack 42105, win 256, length 0
16:42:32.206681 IP 78.140.188.190.https > 172.20.38.238.57817: Flags [.], seq 42105:43565, ack 769, win 254, length 1460
16:42:32.206683 IP 78.140.188.190.https > 172.20.38.238.57817: Flags [.], seq 43565:45025, ack 769, win 254, length 1460
16:42:32.206685 IP 78.140.188.190.https > 172.20.38.238.57817: Flags [P.], seq 45025:46485, ack 769, win 254, length 1460
16:42:32.206749 IP 172.20.38.238.57817 > 78.140.188.190.https: Flags [.], ack 46485, win 256, length 0
16:42:32.208031 IP 78.140.188.190.https > 172.20.38.238.57817: Flags [.], seq 46485:47945, ack 769, win 254, length 1460
16:42:32.208034 IP 78.140.188.190.https > 172.20.38.238.57817: Flags [.], seq 47945:49405, ack 769, win 254, length 1460
16:42:32.208035 IP 78.140.188.190.https > 172.20.38.238.57817: Flags [.], seq 49405:50865, ack 769, win 254, length 1460
16:42:32.208044 IP 78.140.188.190.https > 172.20.38.238.57817: Flags [.], seq 50865:52325, ack 769, win 254, length 1460
16:42:32.208155 IP 172.20.38.238.57817 > 78.140.188.190.https: Flags [.], ack 52325, win 256, length 0
16:42:32.210270 IP 78.140.188.190.https > 172.20.38.238.57816: Flags [.], seq 8881:10341, ack 1270, win 262, length 1460
16:42:32.210274 IP 78.140.188.190.https > 172.20.38.238.57816: Flags [P.], seq 10341:10950, ack 1270, win 262, length 609
16:42:32.210386 IP 172.20.38.238.57816 > 78.140.188.190.https: Flags [.], ack 10950, win 256, length 0
16:42:32.212972 IP 172.20.38.238.57816 > 78.140.188.190.https: Flags [P.], seq 1270:1723, ack 10950, win 256, length 453
16:42:32.413740 IP 78.140.188.190.https > 172.20.38.238.57814: Flags [.], seq 84450:85910, ack 785, win 254, length 1460
16:42:32.413743 IP 78.140.188.190.https > 172.20.38.238.57814: Flags [.], seq 85910:87370, ack 785, win 254, length 1460
16:42:32.413745 IP 78.140.188.190.https > 172.20.38.238.57814: Flags [.], seq 87370:88830, ack 785, win 254, length 1460
16:42:32.413753 IP 78.140.188.190.https > 172.20.38.238.57814: Flags [P.], seq 88830:90290, ack 785, win 254, length 1460
16:42:32.413859 IP 172.20.38.238.57814 > 78.140.188.190.https: Flags [.], ack 66930, win 256, options [nop,nop,sack 2 {84450:85910}{68390:82990}], length 0
16:42:32.413999 IP 172.20.38.238.57814 > 78.140.188.190.https: Flags [.], ack 66930, win 256, options [nop,nop,sack 2 {84450:87370}{68390:82990}], length 0
16:42:32.414053 IP 172.20.38.238.57814 > 78.140.188.190.https: Flags [.], ack 66930, win 256, options [nop,nop,sack 2 {84450:88830}{68390:82990}], length 0
16:42:32.414104 IP 172.20.38.238.57814 > 78.140.188.190.https: Flags [.], ack 66930, win 256, options [nop,nop,sack 2 {84450:90290}{68390:82990}], length 0
16:42:32.414371 IP 78.140.188.190.https > 172.20.38.238.57814: Flags [.], seq 90290:91750, ack 785, win 254, length 1460
16:42:32.414374 IP 78.140.188.190.https > 172.20.38.238.57814: Flags [.], seq 91750:93210, ack 785, win 254, length 1460
16:42:32.414413 IP 172.20.38.238.57814 > 78.140.188.190.https: Flags [.], ack 66930, win 256, options [nop,nop,sack 2 {84450:91750}{68390:82990}], length 0
16:42:32.414475 IP 172.20.38.238.57814 > 78.140.188.190.https: Flags [.], ack 66930, win 256, options [nop,nop,sack 2 {84450:93210}{68390:82990}], length 0
16:42:32.419016 IP 78.140.188.190.https > 172.20.38.238.57814: Flags [.], seq 93210:94670, ack 785, win 254, length 1460
16:42:32.419027 IP 78.140.188.190.https > 172.20.38.238.57814: Flags [.], seq 94670:96130, ack 785, win 254, length 1460
16:42:32.419029 IP 78.140.188.190.https > 172.20.38.238.57814: Flags [.], seq 96130:97590, ack 785, win 254, length 1460
16:42:32.419030 IP 78.140.188.190.https > 172.20.38.238.57814: Flags [.], seq 66930:68390, ack 785, win 254, length 1460
16:42:32.419033 IP 78.140.188.190.https > 172.20.38.238.57814: Flags [.], seq 97590:99050, ack 785, win 254, length 1460
16:42:32.419035 IP 78.140.188.190.https > 172.20.38.238.57814: Flags [.], seq 99050:100510, ack 785, win 254, length 1460
16:42:32.419037 IP 78.140.188.190.https > 172.20.38.238.57814: Flags [.], seq 100510:101970, ack 785, win 254, length 1460
16:42:32.419038 IP 78.140.188.190.https > 172.20.38.238.57814: Flags [.], seq 101970:103430, ack 785, win 254, length 1460
16:42:32.419142 IP 172.20.38.238.57814 > 78.140.188.190.https: Flags [.], ack 66930, win 256, options [nop,nop,sack 2 {84450:94670}{68390:82990}], length 0
16:42:32.419323 IP 172.20.38.238.57814 > 78.140.188.190.https: Flags [.], ack 66930, win 256, options [nop,nop,sack 2 {84450:96130}{68390:82990}], length 0
16:42:32.419379 IP 172.20.38.238.57814 > 78.140.188.190.https: Flags [.], ack 66930, win 256, options [nop,nop,sack 2 {84450:97590}{68390:82990}], length 0
16:42:32.419490 IP 172.20.38.238.57814 > 78.140.188.190.https: Flags [.], ack 82990, win 256, options [nop,nop,sack 1 {84450:97590}], length 0
16:42:32.419550 IP 172.20.38.238.57814 > 78.140.188.190.https: Flags [.], ack 82990, win 256, options [nop,nop,sack 1 {84450:99050}], length 0
16:42:32.419611 IP 172.20.38.238.57814 > 78.140.188.190.https: Flags [.], ack 82990, win 256, options [nop,nop,sack 1 {84450:100510}], length 0
16:42:32.419670 IP 172.20.38.238.57814 > 78.140.188.190.https: Flags [.], ack 82990, win 256, options [nop,nop,sack 1 {84450:101970}], length 0
16:42:32.419728 IP 172.20.38.238.57814 > 78.140.188.190.https: Flags [.], ack 82990, win 256, options [nop,nop,sack 1 {84450:103430}], length 0
16:42:32.419935 IP 78.140.188.190.https > 172.20.38.238.57814: Flags [.], seq 103430:104890, ack 785, win 254, length 1460
16:42:32.419973 IP 172.20.38.238.57814 > 78.140.188.190.https: Flags [.], ack 82990, win 256, options [nop,nop,sack 1 {84450:104890}], length 0
16:42:32.476490 IP 78.140.188.190.https > 172.20.38.238.57817: Flags [.], seq 53785:55245, ack 769, win 254, length 1460
16:42:32.476575 IP 172.20.38.238.57817 > 78.140.188.190.https: Flags [.], ack 52325, win 256, options [nop,nop,sack 1 {53785:55245}], length 0
16:42:32.477965 IP 78.140.188.190.https > 172.20.38.238.57817: Flags [.], seq 55245:56705, ack 769, win 254, length 1460
16:42:32.477968 IP 78.140.188.190.https > 172.20.38.238.57817: Flags [.], seq 56705:58165, ack 769, win 254, length 1460
16:42:32.477970 IP 78.140.188.190.https > 172.20.38.238.57817: Flags [.], seq 58165:59625, ack 769, win 254, length 1460
16:42:32.477977 IP 78.140.188.190.https > 172.20.38.238.57817: Flags [.], seq 59625:61085, ack 769, win 254, length 1460
16:42:32.477979 IP 78.140.188.190.https > 172.20.38.238.57817: Flags [.], seq 61085:62545, ack 769, win 254, length 1460
16:42:32.478076 IP 172.20.38.238.57817 > 78.140.188.190.https: Flags [.], ack 52325, win 256, options [nop,nop,sack 1 {53785:56705}], length 0
16:42:32.478200 IP 172.20.38.238.57817 > 78.140.188.190.https: Flags [.], ack 52325, win 256, options [nop,nop,sack 1 {53785:58165}], length 0
16:42:32.478266 IP 172.20.38.238.57817 > 78.140.188.190.https: Flags [.], ack 52325, win 256, options [nop,nop,sack 1 {53785:59625}], length 0
16:42:32.478335 IP 172.20.38.238.57817 > 78.140.188.190.https: Flags [.], ack 52325, win 256, options [nop,nop,sack 1 {53785:61085}], length 0
16:42:32.478409 IP 172.20.38.238.57817 > 78.140.188.190.https: Flags [.], ack 52325, win 256, options [nop,nop,sack 1 {53785:62545}], length 0
16:42:32.478807 IP 78.140.188.190.https > 172.20.38.238.57817: Flags [.], seq 62545:64005, ack 769, win 254, length 1460
16:42:32.478811 IP 78.140.188.190.https > 172.20.38.238.57817: Flags [.], seq 64005:65465, ack 769, win 254, length 1460
16:42:32.478897 IP 172.20.38.238.57817 > 78.140.188.190.https: Flags [.], ack 52325, win 256, options [nop,nop,sack 1 {53785:64005}], length 0
16:42:32.479004 IP 172.20.38.238.57817 > 78.140.188.190.https: Flags [.], ack 52325, win 256, options [nop,nop,sack 1 {53785:65465}], length 0
16:42:32.479273 IP 78.140.188.190.https > 172.20.38.238.57817: Flags [.], seq 65465:66925, ack 769, win 254, length 1460
16:42:32.479309 IP 172.20.38.238.57817 > 78.140.188.190.https: Flags [.], ack 52325, win 256, options [nop,nop,sack 1 {53785:66925}], length 0
16:42:32.493447 IP 78.140.188.190.https > 172.20.38.238.57816: Flags [.], seq 10950:12410, ack 1723, win 270, length 1460
16:42:32.493451 IP 78.140.188.190.https > 172.20.38.238.57816: Flags [.], seq 12410:13870, ack 1723, win 270, length 1460
16:42:32.493452 IP 78.140.188.190.https > 172.20.38.238.57816: Flags [P.], seq 13870:14987, ack 1723, win 270, length 1117
16:42:32.493579 IP 172.20.38.238.57816 > 78.140.188.190.https: Flags [.], ack 14987, win 256, length 0
16:42:32.496246 IP 172.20.38.238.57816 > 78.140.188.190.https: Flags [P.], seq 1723:2176, ack 14987, win 256, length 453
16:42:32.674282 IP 172.20.38.238.57796 > 75.98.93.51.http: Flags [.], seq 2205363145:2205363146, ack 3163071936, win 64746, length 1
16:42:32.682474 IP 78.140.188.190.https > 172.20.38.238.57814: Flags [.], seq 104890:106350, ack 785, win 254, length 1460
16:42:32.682558 IP 172.20.38.238.57814 > 78.140.188.190.https: Flags [.], ack 82990, win 256, options [nop,nop,sack 1 {84450:106350}], length 0
16:42:32.684898 IP 78.140.188.190.https > 172.20.38.238.57814: Flags [.], seq 82990:84450, ack 785, win 254, length 1460
16:42:32.685049 IP 172.20.38.238.57814 > 78.140.188.190.https: Flags [.], ack 106350, win 256, length 0
16:42:32.685601 IP 78.140.188.190.https > 172.20.38.238.57814: Flags [.], seq 106350:107810, ack 785, win 254, length 1460
16:42:32.685604 IP 78.140.188.190.https > 172.20.38.238.57814: Flags [.], seq 107810:109270, ack 785, win 254, length 1460
16:42:32.685661 IP 172.20.38.238.57814 > 78.140.188.190.https: Flags [.], ack 109270, win 256, length 0
16:42:32.690475 IP 78.140.188.190.https > 172.20.38.238.57814: Flags [.], seq 109270:110730, ack 785, win 254, length 1460
16:42:32.692429 IP 78.140.188.190.https > 172.20.38.238.57814: Flags [.], seq 110730:112190, ack 785, win 254, length 1460
16:42:32.692432 IP 78.140.188.190.https > 172.20.38.238.57814: Flags [.], seq 112190:113650, ack 785, win 254, length 1460
16:42:32.692433 IP 78.140.188.190.https > 172.20.38.238.57814: Flags [.], seq 113650:115110, ack 785, win 254, length 1460
16:42:32.692439 IP 78.140.188.190.https > 172.20.38.238.57814: Flags [.], seq 115110:116570, ack 785, win 254, length 1460
16:42:32.692441 IP 78.140.188.190.https > 172.20.38.238.57814: Flags [.], seq 116570:118030, ack 785, win 254, length 1460
16:42:32.692442 IP 78.140.188.190.https > 172.20.38.238.57814: Flags [P.], seq 118030:119490, ack 785, win 254, length 1460
16:42:32.692444 IP 78.140.188.190.https > 172.20.38.238.57814: Flags [.], seq 119490:120950, ack 785, win 254, length 1460
16:42:32.692446 IP 78.140.188.190.https > 172.20.38.238.57814: Flags [.], seq 120950:122410, ack 785, win 254, length 1460
16:42:32.692597 IP 172.20.38.238.57814 > 78.140.188.190.https: Flags [.], ack 122410, win 256, length 0
16:42:32.760831 IP 78.140.188.190.https > 172.20.38.238.57817: Flags [.], seq 66925:68385, ack 769, win 254, length 1460
16:42:32.760834 IP 78.140.188.190.https > 172.20.38.238.57817: Flags [.], seq 68385:69845, ack 769, win 254, length 1460
16:42:32.760916 IP 172.20.38.238.57817 > 78.140.188.190.https: Flags [.], ack 52325, win 256, options [nop,nop,sack 1 {53785:68385}], length 0
16:42:32.761045 IP 172.20.38.238.57817 > 78.140.188.190.https: Flags [.], ack 52325, win 256, options [nop,nop,sack 1 {53785:69845}], length 0
16:42:32.762325 IP 78.140.188.190.https > 172.20.38.238.57817: Flags [.], seq 52325:53785, ack 769, win 254, length 1460
16:42:32.762328 IP 78.140.188.190.https > 172.20.38.238.57817: Flags [.], seq 69845:71305, ack 769, win 254, length 1460
16:42:32.762330 IP 78.140.188.190.https > 172.20.38.238.57817: Flags [.], seq 71305:72765, ack 769, win 254, length 1460
16:42:32.762337 IP 78.140.188.190.https > 172.20.38.238.57817: Flags [.], seq 72765:74225, ack 769, win 254, length 1460
16:42:32.762339 IP 78.140.188.190.https > 172.20.38.238.57817: Flags [.], seq 74225:75685, ack 769, win 254, length 1460
16:42:32.762509 IP 172.20.38.238.57817 > 78.140.188.190.https: Flags [.], ack 69845, win 256, length 0
16:42:32.762656 IP 172.20.38.238.57817 > 78.140.188.190.https: Flags [.], ack 75685, win 256, length 0
16:42:32.773738 IP 78.140.188.190.https > 172.20.38.238.57816: Flags [.], seq 14987:16447, ack 2176, win 279, length 1460
16:42:32.773741 IP 78.140.188.190.https > 172.20.38.238.57816: Flags [.], seq 16447:17907, ack 2176, win 279, length 1460
16:42:32.773743 IP 78.140.188.190.https > 172.20.38.238.57816: Flags [P.], seq 17907:18736, ack 2176, win 279, length 829
16:42:32.773868 IP 172.20.38.238.57816 > 78.140.188.190.https: Flags [.], ack 18736, win 256, length 0
16:42:32.776165 IP 172.20.38.238.57816 > 78.140.188.190.https: Flags [P.], seq 2176:2629, ack 18736, win 256, length 453
16:42:32.914774 IP 75.98.93.51.http > 172.20.38.238.57796: Flags [.], ack 1, win 4514, length 0
16:42:32.955771 IP 78.140.188.190.https > 172.20.38.238.57814: Flags [.], seq 122410:123870, ack 785, win 254, length 1460
16:42:32.957713 IP 78.140.188.190.https > 172.20.38.238.57814: Flags [.], seq 123870:125330, ack 785, win 254, length 1460
16:42:32.957814 IP 172.20.38.238.57814 > 78.140.188.190.https: Flags [.], ack 125330, win 256, length 0
16:42:32.958199 IP 78.140.188.190.https > 172.20.38.238.57814: Flags [.], seq 125330:126790, ack 785, win 254, length 1460
16:42:32.964695 IP 78.140.188.190.https > 172.20.38.238.57814: Flags [.], seq 128250:129710, ack 785, win 254, length 1460
16:42:32.964698 IP 78.140.188.190.https > 172.20.38.238.57814: Flags [.], seq 129710:131170, ack 785, win 254, length 1460
